1497,journalArticle,2017.0,"De Munter, Stéphanie; De Vries, Philippe",To Tweet or not to Tweet? An analysis of Twitter use during the 2014 Belgian elections.,"Politics, Culture & Socialization",,https://ezproxy.lib.utexas.edu/login?url=https://search.ebscohost.com/login.aspx?direct=true&db=sih&AN=144821260&site=ehost-live,"Social media, and Twitter in particular, are playing an increasing role in the day-to-day activities of politicians (Weber Shandwick, 2014). Before the digital revolution, the relationship between the politician and the voter was intermediated by journalists and broadcast media. In contrast to traditional media, social media are presumed to enable politicians to engage directly with the electorate (Kruikemeier, Van Noort, Vliegenthart & De Vreese, 2015). In the last decade, there was a growing interest in the role of social media in election campaigns, triggered by Barack Obama's electoral presidential election victory in 2008 and more recently by Donald Trumps' triumph in 2016 (Rodriguez-Andres, 2018). The research presented in this article answers three main questions. First, who are the politicians using Twitter for campaigning purposes and what variables can predict Twitter use? Second, when do Belgian politicians use it and with which frequency? And third: do tweeting politicians perform better at the ballot box? The main findings reveal that a Flemish candidate has a higher probability of 18,7% to be present on Twitter compared to a candidate from the French community. Another important finding is that there is no significant association between the number of tweets and number of preferential votes, although a trend towards significance was observed for Flemish politicians. [ABSTRACT FROM AUTHOR]",Social media; Twitter (Web resource); Elections; Twitter; social media; Digital technology; political communication; Belgium; elections; Politicians -- Attitudes,SocIndex,0,,,,,,,
1498,journalArticle,2016.0,"van Zuydam, Sabine; Metze, Tamara",Making political leaders king: Enacted credibility in times of elections.,"Politics, Culture & Socialization",,https://ezproxy.lib.utexas.edu/login?url=https://search.ebscohost.com/login.aspx?direct=true&db=sih&AN=144902066&site=ehost-live,"Political leaders need to be persuasive to acquire support from citizens in elections and in office. Credibility is essential in this respect. Due to the mediated nature of political communication, citizens base their credibility evaluation on leaders' media presentations and the public debate in the media that develops in response to it. The source credibility approach suggests that leaders are credible if citizens consider them competent, trustworthy, and caring. What remains underexplored is how these evaluations of leaders' source credibility come about and how changes in them can be understood. To this end, we introduce the concept of enacted credibility. Enacted credibility entails the framing and reframing of leaders' credibility in the interaction between political leaders' performance, citizens, and other participants in the public debate in the media. Empirically we explore the relevance of this concept by studying the case of Dutch Social Democratic leader Job Cohen. We found that the interplay among and between participants in the public debate in the media and his media performance is key to understanding the substantial decline in his source credibility during the 2010 parliamentary election campaign. Our analysis shows that some dimensions of credibility became more salient in the public debate in the media than others, impacting the overall evaluation of his source credibility. [ABSTRACT FROM AUTHOR]",Elections; Twitter; Politicians; framing; Mass media; Political communication; Political debates; performance; credibility; political leadership; mediated politics,SocIndex,2,,,,,,,
1499,journalArticle,2021.0,"Tillery, Alvin B.",Tweeting racial representation: how the congressional Black Caucus used Twitter in the 113th congress.,"Politics, Groups & Identities",,https://ezproxy.lib.utexas.edu/login?url=https://search.ebscohost.com/login.aspx?direct=true&db=sih&AN=149413830&site=ehost-live,"The social media and microblogging site Twitter has emerged as both a vehicle for political expression and a powerful tool for political organizing within the African American community. This paper examines the extent to which members of the Congressional Black Caucus (CBC) utilize Twitter to communicate with their constituents about racial issues. An analysis of CBC members' tweets during the 113th Congress (2013–2014) shows that the organization's members do talk about race and occasionally use racially distinct hashtags. Moreover, statistical analyses show that the best predictors of a CBC members' engagement with racial issues on Twitter are being a woman legislator, the size of their margin of victory in the 2012 elections, and the percentage of whites living within the boundaries of their district. [ABSTRACT FROM AUTHOR]",Social media; Twitter Inc.; Microblogs; Twitter; Hispanic Americans; African Americans; Black Twitter; Black politics; Black representation; Black women legislators; Caucus; Congressional Black Caucus; Support groups; Women legislators,SocIndex,12,,,,,,,
1500,journalArticle,2019.0,"Gervais, Bryan T.; Wilson, Walter C.",New media for the new electorate? Congressional outreach to Latinos on Twitter.,"Politics, Groups & Identities",,https://ezproxy.lib.utexas.edu/login?url=https://search.ebscohost.com/login.aspx?direct=true&db=sih&AN=136979097&site=ehost-live,"Over the last decade, Latinos have exercised rapidly growing influence in elections. This trend has coincided with the closing of the so-called digital divide between Anglos and Latinos and increased use of social media platforms for constituency outreach by members of Congress. Leveraging a battery of indicators associated with Latino outreach by U.S. representatives in communications via Twitter throughout the 112th Congress (the first ""tweeting"" Congress), we demonstrate that representatives pursue digital home styles oriented toward specific demographic constituencies, and, furthermore, reveal that representative ethnicity shapes Twitter outreach to Latinos in ways that have important implications for the substantive representation of Latinos. Our findings build on previous research which to date has largely presumed that Twitter outreach is characterized by relatively homogenous in-party communication patterns, and has identified only limited evidence that representative ethnicity impacts digital home style. [ABSTRACT FROM AUTHOR]",Twitter (Web resource); Communication; social media; Hispanic Americans; mass media; Voters; Latino/a politics; legislative; minority representation; political parties; political representation,SocIndex,15,,,,,,,
1501,journalArticle,2019.0,"Dancey, Logan; Masand, Jasmine",Race and representation on Twitter: members of congress' responses to the deaths of Michael Brown and Eric Garner.,"Politics, Groups & Identities",,https://ezproxy.lib.utexas.edu/login?url=https://search.ebscohost.com/login.aspx?direct=true&db=sih&AN=136979095&site=ehost-live,"This paper investigates the public responses of members of Congress to the deaths of Michael Brown and Eric Garner and the subsequent protests and grand jury decisions. To do so, we examine members' engagement with the issue on Twitter, which became a platform for public protest with such hashtags as #BlackLivesMatter and #ICantBreathe. We find that a member's race is a more robust predictor of their engagement on the issue than is the member's partisanship or the partisan and racial demographics of their district. By showing that descriptive representation may overwhelm more traditional notions of district-based representation in responses to a racially charged issue, we further highlight the role descriptive representation in Congress plays in ensuring that the diversity of voices coming out of Congress reflects the diversity of voices in the public at large. [ABSTRACT FROM AUTHOR]","Twitter (Web resource); Race; American politics; political representation; Brown, Michael, 1996-2014; public policy; racial politics",SocIndex,9,,,,,,,
1502,journalArticle,2019.0,"Whitesell, Anne",Interest groups and social media in the age of the Twitter president.,"Politics, Groups & Identities",,https://ezproxy.lib.utexas.edu/login?url=https://search.ebscohost.com/login.aspx?direct=true&db=sih&AN=134239976&site=ehost-live,"There is a burgeoning literature on how political engagement has changed as a result of social media. The research on interest groups and social media, however, has primarily focused on describing the extent to which traditional interest groups have joined popular social networking sites, with less focus on how this new media has led to the creation of new interest groups and influenced policy change. This essay reviews the literature on the relationship between interest groups and social media while proposing some ways to move the research agenda forward. There is a particular need for research that seeks to explain how interest groups use social media to influence policy and engage with stakeholders. [ABSTRACT FROM AUTHOR]",Social media; Twitter (Web resource); Communication; social media; Online social networks; social movement; political participation; Pressure groups; interest groups; Stakeholders,SocIndex,13,,,,,,,
1503,journalArticle,2023.0,"Gori Maia, Alexandre; Martinez, Jose Daniel Morales; Marteleto, Leticia Junqueira; Rodrigues, Cristina Guimaraes; Sereno, Luiz Gustavo",Can the Content of Social Networks Explain Epidemic Outbreaks?,Population Research & Policy Review,,https://ezproxy.lib.utexas.edu/login?url=https://search.ebscohost.com/login.aspx?direct=true&db=sih&AN=162069068&site=ehost-live,"People share and seek information online that reflects a variety of social phenomena, including concerns about health conditions. We analyze how the contents of social networks provide real-time information to monitor and anticipate policies aimed at controlling or mitigating public health outbreaks. In November 2020, we collected tweets on the COVID-19 pandemic with content ranging from safety measures, vaccination, health, to politics. We then tested different specifications of spatial econometrics models to relate the frequency of selected keywords with administrative data on COVID-19 cases and deaths. Our results highlight how mentions of selected keywords can significantly explain future COVID-19 cases and deaths in one locality. We discuss two main mechanisms potentially explaining the links we find between Twitter contents and COVID-19 diffusion: risk perception and health behavior. [ABSTRACT FROM AUTHOR]",Twitter; COVID-19; Public health; Social behavior; Spatial models; Spatial panel model,SocIndex,0,,,,,,,
1504,journalArticle,2020.0,"Yatsyk, Alexandra",Biopolitical Populism in Poland: The Case of PiS.,Populism,,https://ezproxy.lib.utexas.edu/login?url=https://search.ebscohost.com/login.aspx?direct=true&db=sih&AN=147200282&site=ehost-live,"This paper examines the discourse of PiS party in Poland as a form of biopolitical populism. I view this phenomenon as a specific style of political discourse rather than an ideology, that, first , focuses on bodily issues, including family and gender policy, sexual behavior, etc., second —it is inherently performative and as such it appeals to emotions, and, third —it directly communicates with ""people"" while circumventing the existing institutional framework of the state. Based on the cases of PiS rhetoric on the Smolensk catastrophe, and its narratives on gender and anti-LGBTQ issues, I demonstrate how the latter could be used for political othering and for subverting the core democratic principles. My data includes publications in Polish media and on social platforms (Twitter and Facebook), mostly before and after elections to European and national parliaments in May and October 2019, as well as during the presidential election in spring 2020. [ABSTRACT FROM AUTHOR]",Human sexuality; populism; Populism; Presidential elections; LGBTQ+ people; Poland; biopolitics; Biopolitics (Philosophy); LGBTQ; Smolensk catastrophe,SocIndex,9,,,,,,,
1505,journalArticle,2017.0,"James, Elaine; Harvey, Mark; Mitchell, Rob",The Mental Capacity Act Call to Action: Online Development of Critical Rights - Based Social Work.,Practice (09503153),,https://ezproxy.lib.utexas.edu/login?url=https://search.ebscohost.com/login.aspx?direct=true&db=sih&AN=124333137&site=ehost-live,"This paper outlines the approach taken and findings from a national social work practice development event, the MCA Call to Action. In March 2016, the adult social work Principal Social Worker (PSW) Network ran the first Call to Action in support of the Ministry of Justice Mental Capacity Action Day. The MCA Call to Action was conceived and designed as a critical and creative way to conduct practice-led research into the integration into social work values of the statutory principles within the MCA 2005. The approach made use of the open social media platform, twitter. Thematic analysis was undertaken of the content generated during the Call to Action. Secondary social network analysis was undertaken to map the relationships and exchanges which took place during the MCA Call to Action. The findings were that 269 unique users participated in the MCA Call to Action, two-thirds of which self-identified as being social workers during the MCA Call to action. There were 244 media tweets posted during the Call to Action showing an image of anunwise decision, 80% of these were posted by social workers. The role of PSWs and the implications for social work practice leadership are discussed. [ABSTRACT FROM PUBLISHER]",Social media; Psychosocial factors; social media; Human rights; Social services; social work; Law; human rights; Capacity (Law); Legislation; mental capacity; Professional practice; rights-based,SocIndex,2,,,,,,,
1506,journalArticle,2019.0,"Tereszkiewicz, Anna",Responding to customer complaints on English and Polish corporate  profiles on Twitter.,Pragmatics & Society,,https://ezproxy.lib.utexas.edu/login?url=https://search.ebscohost.com/login.aspx?direct=true&db=sih&AN=137928078&site=ehost-live,"The study investigates the strategies used by English and Polish companies in the process of handling customer complaints on Twitter. Since English and Polish are recognized as representatives of negative and positive politeness cultures, respectively, the analysis was to examine if there are differences in politeness conventions in customer-provider interaction on Twitter. The study found that although similar strategies are used by English and Polish companies in responding to complaints, the frequency of the respective strategies is different. The results of the analysis confirm differences in the use of positive and negative politeness strategies as well as differences in the level of directness in interaction between English and Polish profiles. [ABSTRACT FROM AUTHOR]",Twitter; Apologizing; apology; Business communication; Consumer complaints; customer complaints; Customer satisfaction; English; Linguistic politeness; negative/positive politeness cultures; Polish,SocIndex,7,,,,,,,
1507,journalArticle,2022.0,"Francisco, M.; Benítez-Castro, M. Á.; Hidalgo-Tenorio, E.; Castro, Juan L.",A semi-supervised algorithm for detecting extremism propaganda diffusion on social media.,Pragmatics & Society,,https://ezproxy.lib.utexas.edu/login?url=https://search.ebscohost.com/login.aspx?direct=true&db=sih&AN=158121059&site=ehost-live,"Extremist online networks reportedly tend to use Twitter and other Social Networking Sites (SNS) in order to issue propaganda and recruitment statements. Traditional machine learning models may encounter problems when used in such a context, due to the peculiarities of microblogging sites and the manner in which these networks interact (both between themselves and with other networks). Moreover, state-of-the-art approaches have focused on non-transparent techniques that cannot be audited; so, despite the fact that they are top performing techniques, it is impossible to check if the models are actually fair. In this paper, we present a semi-supervised methodology that uses our Discriminatory Expressions algorithm for feature selection to detect expressions that are biased towards extremist content (Francisco and Castro 2020). With the help of human experts, the relevant expressions are filtered and used to retrieve further extremist content in order to iteratively provide a set of relevant and accurate expressions. These discriminatory expressions have been proved to produce less complex models that are easier to comprehend, and thus improve model transparency. In the following, we present close to 70 expressions that were discovered by using this method alongside the validation test of the algorithm in several different contexts. [ABSTRACT FROM AUTHOR]",Twitter (Web resource); Microblogs; social media; Online social networks; microblogging; text mining; propaganda; discriminatory expressions; extremism; Extremists; feature selection; interpretability; Specialists,SocIndex,0,,,,,,,
1508,journalArticle,2022.0,"Bartley, Leanne","""They fabricated lies against us and described us in the harshest of ways"": An analysis of the transitivity patterns used in the online magazine DABIQ.",Pragmatics & Society,,https://ezproxy.lib.utexas.edu/login?url=https://search.ebscohost.com/login.aspx?direct=true&db=sih&AN=158121060&site=ehost-live,"Over the past decade, Islamic State (ISIS) has made numerous attempts to propagate their beliefs on a global scale via a range of social media platforms (e.g. Twitter), enabling them to reach an extensive audience within a very short time span; when successful, people enlist as supporters of their ideas and, essentially, become radicalised. ISIS also achieve this through publishing propaganda materials, such as the two online magazines Dabiq and Rumiyah (Heidarysafa et al. 2019). In this paper, our focus lies with the former. Through a transitivity analysis of three issues from Dabiq, this paper explores how the in-group (the believers) and the Other (the non-believers) are represented in the magazine. The transitivity framework is useful here because it exposes the linguistic choices that people make and, in turn, reveals how they perceive their world. To retrieve both quantitative and qualitative findings, the UAM Corpus Tool (O'Donnell 2016) is employed. [ABSTRACT FROM AUTHOR]",Social media; Twitter (Web resource); ideology; Islamic State (Organization); Periodicals; Fans (Persons); corpus linguistics; CDA; Dabiq; systemic functional linguistics; transitivity,SocIndex,0,,,,,,,
1509,journalArticle,2022.0,"MEGARI, Larbi",Islamic Preaching on Twitter: Mohamad al-Arefe Case Study.,Prédication islamique sur Twitter : le cas de Mohamad al-Arefe.,,https://ezproxy.lib.utexas.edu/login?url=https://search.ebscohost.com/login.aspx?direct=true&db=sih&AN=160891605&site=ehost-live,"This research is part of communication studies on the interplay between religion and media. It is also part of research on the use of Twitter by religious people and the use of social media in the Arab world, and more specifically the current article focuses on the priorities of Arab religious preachers in the Arab-Muslim world in their uses of Twitter. I have chosen a Muslim preacher who has been the owner of the most followed Twitter account in the Arab-Muslim world: Mohamad al-Arefe. At the time of my research, this Saudi Sunni preacher was ranked in the 83rd1 place in the global ranking of the most followed Twitter accounts in the world. This article aims to develop a typology of content shared on Twitter by al-Arefe. This research examines the way the Twitter platform is being used by this preacher, and it answers the question whether the theoretical model of religion mediatisation applies to the content shared by al-Arefe. This article combines two methodological approaches to study the content shared by al-Arefe on his Twitter account: a quantitative method and a qualitative one. I focus on the analysis of three elements present among the contents shared by this preacher on his Twitter account: Hashtags, visuals and links. Finally, my analysis shows how al-Arefe focuses more on his person and his image than he focuses on presenting Islamic teachings. (English) [ABSTRACT FROM AUTHOR]",Social media; Twitter; social media; religion; Accounting methods; Clergy; médiatisation; mediatization; réseaux sociaux; Salafism; salafisme; Sunni Islam,SocIndex,0,,,,,,,
