journalArticle,2015,"Chua, Vincent; Wellman, Barry","Social Networks in East and Southeast Asia II: Labor Migration, Opportunity, Social Media, and Well-Being.",American Behavioral Scientist,,https://ezproxy.lib.utexas.edu/login?url=https://search.ebscohost.com/login.aspx?direct=true&db=sih&AN=108529436&site=ehost-live,"This second issue continues our study of social networks and social capital in East and Southeast Asia. The articles show both similarities and differences in how each country's social contexts significantly affect the nature of their social networks. The articles consistently show an Asian version of networked individualism, based on close kinship and friendship, hierarchies, strong work ethics, frequent travel, and digital media. In Thai villages, migrants send remittances to family members back home to honor broader village networks and norms. In China, migrants who come from wealthier village families have larger friendship networks in cities. In Hong Kong, cultural differences such as language limit social interactions between Mainland Chinese and Hong Kong students. In Singapore, population characteristics substantially affect inter-ethnic contact. While social norms circumscribe behavior on Twitter in Japan, Sina Weibo in China is a more chaotic space with much fraudulent practice. In Taiwan, online and offline networks combine to affect participation in voluntary associations. In China and Singapore, authoritative contacts and weak ties increase as well as reduce personal well-being. [ABSTRACT FROM AUTHOR]",Social networks; Japan; digital media; China; Social norms; networks; migration; East Asia; Hong Kong; Taiwan; Thailand; opportunity structures; Remittances; Singapore; Southeast Asia; well-being,SocIndex,,,,,,,,,0.522222417,Social Networks in East and Southeast Asia II Labor Migration Opportunity Social Media and Well Being
journalArticle,2014,"McKinney, Mitchell S.; Houston, J. Brian; Hawthorne, Joshua",Social Watching a 2012 Republican Presidential Primary Debate.,American Behavioral Scientist,,https://ezproxy.lib.utexas.edu/login?url=https://search.ebscohost.com/login.aspx?direct=true&db=sih&AN=94776808&site=ehost-live,"This study examines the “Twitter election of 2012,” and specifically young citizens’ “social watching” behaviors while live-tweeting a 2012 nationally televised Republican primary debate. We find several important relationships between key demographic, social, and political engagement variables and participants’ social watching activity (frequency of tweeting while watching the debate). We also find important links between tweet content (frequency of candidate mentions in tweets) and debate viewers’ candidate evaluations. [ABSTRACT FROM PUBLISHER]","Twitter (Web resource); Twitter; United States; social media; Social media & politics; Primaries; Republican Party (U.S. : 1854- ); United States presidential election, 2012; Obama, Barack, 1961-; Romney, Mitt, 1947-; Campaign debates; presidential campaign; Young adults; Paul, Ron, 1935-; primary debate; social watching; Television viewing -- Social aspects",SocIndex,,x,,,x,,,,0.319389819,Social Watching a 2012 Republican Presidential Primary Debate
journalArticle,2021,"Quinn, Kelly",Social media and social wellbeing in later life.,Ageing & Society,,https://ezproxy.lib.utexas.edu/login?url=https://search.ebscohost.com/login.aspx?direct=true&db=sih&AN=150256157&site=ehost-live,"Social wellbeing is important to health, but maintaining social relations often becomes difficult in later life due to retirement, chronic disease, and the death of spouses and friends. Social media platforms, such as Facebook and Twitter, present accessible and low-cost communication technologies that have been demonstrated to enhance feelings of social connection and reduce loneliness in younger age groups. This exploratory study uses a four-week social media training workshop as an intervention in a randomised controlled study to examine whether similar social benefits might be realised for those at older ages, aged 65+ years. Social wellbeing measures of social capital, loneliness, social connectedness and social provisions were examined, revealing only small differences in social integration. As these findings seemingly contradict studies conducted with younger persons, the contexts of social media use in older adulthood are discussed, along with proposals for future research directions. [ABSTRACT FROM AUTHOR]",Social media; Twitter (Web resource); Well-being; Descriptive statistics; Social support; Statistical sampling; social media; Facebook (Web resource); Research; Social capital; older adults; Interpersonal relations; Old age; loneliness; Loneliness; Social integration; Adult education workshops; Educational outcomes; Evaluation of human services programs; lifecourse; Randomized controlled trials; social capital; social connectedness; social wellbeing,SocIndex,,,,x,,,x,,0.443396454,Social media and social wellbeing in later life
journalArticle,2013,"Earl, J; Hurwitz, HM; Mesinas, AM; Tolan, M; Arlotti, A",THIS PROTEST WILL BE TWEETED: Twitter and protest policing during the Pittsburgh G20,INFORMATION COMMUNICATION & SOCIETY,10.1080/1369118X.2013.777756,,"This article examines the use of Twitter at protests surrounding the G20 meetings held in Pittsburgh, PA in September 2009. Based on work on information communication technologies and protest, and on more recent work on Twitter usage at protests, we develop several hypotheses about the content of tweets during protests. Most significantly, we argue that Twitter is a widely available mobile social networking tool that can be used to reduce information asymmetries between protesters and police. Examining the content of 30,296 tweets over a nine-day period, we find that protesters frequently used Twitter to share information, including information about protest locations, as well as the location and actions of police, which is information that was formerly monopolized by the police. Twitter use may be creating a new dynamic in protester and police interaction toward information symmetries. We conclude by identifying implications for policing practices and for protesters.",TECHNOLOGY; Twitter; INTERNET; MOVEMENT; protest; information asymmetry; protest policing; repression,WOS,,x,x,,,,,,0.010953223,THIS PROTEST WILL BE TWEETED Twitter and protest policing during the Pittsburgh G20
journalArticle,2020,"Berti, C; Loner, E","The 2019 European Elections on Twitter between Populism, Euroscepticism and Nationalism: The Case of Italy",SOCIETAMUTAMENTOPOLITICA-RIVISTA ITALIANA DI SOCIOLOGIA,10.13128/smp-12654,,"*European Parliament elections have often been defined second-order elections, focused on national rather than transnational issues. This paper investigates the combined impact of Eurosceptic populism and social media in the development of the campaign during the 2019 European Parliament elections. It evaluates how populist and non-populist politicians and parties campaigned for the European elections on Twitter by using the case study of Italy. Computer-assisted quantitative analysis and qualitative analysis of social media content are used to assess the relevance of Europe in political communication and the strategies used by different political actors. Findings show that the concept of nation plays a central role in the campaign, with Europe depicted either as an enemy (by nationalist populism) or a saviour (by pro-Europeans). Moreover, there is e tendency towards a ""populist shift"" in the communication style.",Social media; SOCIAL MEDIA; European Parliament; political communication; INTERNET; populism; DISCOURSE; PUBLIC SPHERE; GOVERNMENT; PARTIES; CONTESTATION; INTEGRATION; Italian politics; PARLIAMENT ELECTIONS; POLITICAL COMMUNICATION STYLE,WOS,,x,x,,,,,,0.00633937,The 2019 European Elections on Twitter between Populism Euroscepticism and Nationalism The Case of Italy
journalArticle,2013,"Bruns, Axel; Highfield, Tim; Burgess, Jean",The Arab Spring and Social Media Audiences: English and Arabic Twitter Users and Their Networks.,American Behavioral Scientist,,https://ezproxy.lib.utexas.edu/login?url=https://search.ebscohost.com/login.aspx?direct=true&db=sih&AN=88262185&site=ehost-live,"Although popular media narratives about the role of social media in driving the events of the 2011 “Arab Spring” are likely to overstate the impact of Facebook and Twitter on these uprisings, it is nonetheless true that protests and unrest in countries from Tunisia to Syria generated a substantial amount of social media activity. On Twitter alone, several millions of tweets containing the hashtags #libya or #egypt were generated during 2011, both by directly affected citizens of these countries and by onlookers from further afield. What remains unclear, though, is the extent to which there was any direct interaction between these two groups (especially considering potential language barriers between them). Building on hashtag data sets gathered between January and November 2011, this article compares patterns of Twitter usage during the popular revolution in Egypt and the civil war in Libya. Using custom-made tools for processing “big data,” we examine the volume of tweets sent by English-, Arabic-, and mixed-language Twitter users over time and examine the networks of interaction (variously through @replying, retweeting, or both) between these groups as they developed and shifted over the course of these uprisings. Examining @reply and retweet traffic, we identify general patterns of information flow between the English- and Arabic-speaking sides of the Twittersphere and highlight the roles played by users bridging both language spheres. [ABSTRACT FROM PUBLISHER]","Social media; Twitter (Web resource); Political participation; Twitter; Public demonstrations; Facebook (Web resource); Online social networks; Arab Spring; Egypt; Statistical correlation; Blogs & politics; Arab countries; Arabic language; English language; Internet access; language networks; Libya; Meta tags (HTML); Transborder data flow; Arab Spring Uprisings, 2011-",SocIndex,,x,,,,,,,0.927793765,The Arab Spring and Social Media Audiences English and Arabic Twitter Users and Their Networks
journalArticle,2016,"Galily, Yair; Yarchi, Moran; Tamir, Ilan; Samuel-Azran, Tal",The Boston Game and the ISIS Match.,American Behavioral Scientist,,https://ezproxy.lib.utexas.edu/login?url=https://search.ebscohost.com/login.aspx?direct=true&db=sih&AN=116332828&site=ehost-live,"The world is becoming largely interconnected. This notion has thought-provoking implications due to the fact that this interdependence affords terrorist organizations opportunities to perpetrate attacks. It is inevitable that an increased risk of terrorism, especially on the forefront of megasporting events, is on the rise due to the global publicity such attacks receive. This article focuses on the Boston Marathon Bombing and the Islamic State and illustrates how high-profile news coverage and coverage on social media (through user-generated content or “terrorist organization”–generated content) advance terrorist groups’ attempts to use large-scale sporting events to leverage their agenda and ideology. [ABSTRACT FROM AUTHOR]",Twitter (Web resource); Twitter; Islamic State (Organization); Terrorism; media; Terrorist organizations; terrorism; ISIS; Mass media research; terror organization,SocIndex,,,,,,,,,0.27028343,The Boston Game and the ISIS Match
journalArticle,2022,"Casero-Ripollés, Andreu; Alonso-Muñoz, Laura; Marcos-García, Silvia",The Influence of Political Actors in the Digital Public Debate on Twitter About the Negotiations for the Formation of the Government in Spain.,American Behavioral Scientist,,https://ezproxy.lib.utexas.edu/login?url=https://search.ebscohost.com/login.aspx?direct=true&db=sih&AN=155376158&site=ehost-live,"Social media has introduced new parameters that can potentially transform the digital political conversation. Traditionally, in the age of mass communication, public debate was dominated by politicians and journalists. However, digital platforms, primarily Twitter, have allowed other social actors to join the political discussion, trying to influence it. The objective of this research is to establish what factors enable the authority and digital influence of political actors in the public debate on Twitter. We use a big data sample of 127.3 million tweets from the negotiation process around the formation of the Government in Spain. The applied methodology is based on social network analysis and machine learning. The results show that ideology, political initiative, and political career are configured as factors capable of conditioning the authority and influence of political actors in the political conversation on Twitter. [ABSTRACT FROM AUTHOR]",Social media; Twitter Inc.; Twitter; Social network analysis; social media; Spain; Actors; digital media; Digital technology; political communication; political conversation; Power (Social sciences); social influence,SocIndex,,x,,,,,,,0.469663058,The Influence of Political Actors in the Digital Public Debate on Twitter About the Negotiations for the Formation of the Government in Spain
journalArticle,2020,"Young, DG",The Lincoln Project and the Conservative Aesthetic,SOCIETY,10.1007/s12115-020-00537-9,,"This election season, a rogue band of Republican Party operatives has attracted considerable media attention, and the Twitter wrath of President Trump, with a series of negative advertisements attacking the incumbent. The Lincoln Project strategy demonstrates how social and cultural conservatives are attracted to a particular aesthetic, prompted by their psychological attraction to rhetorical forms that are threat-oriented, clear, efficient, hyperbolic, emotional, and authoritative.",Political psychology; Trump; Political advertising,WOS,,x,,,,,,,0.016227524,The Lincoln Project and the Conservative Aesthetic
journalArticle,2014,"Dubois, Elizabeth; Gaffney, Devin",The Multiple Facets of Influence: Identifying Political Influentials and Opinion Leaders on Twitter.,American Behavioral Scientist,,https://ezproxy.lib.utexas.edu/login?url=https://search.ebscohost.com/login.aspx?direct=true&db=sih&AN=97727009&site=ehost-live,"This study compares six metrics commonly used to identify influential players in two of Canada’s largest political Twitter communities based on the users, and ranking order of users, identified by each metric. All tweets containing the hashtag #CPC, representing the Conservative Party of Canada (government), and #NDP, representing the New Democratic Party of Canada (official opposition), were collected over a 2-week period in March 2013 and a follower network graph was created. Social network analysis and content analysis were employed to identify influentials. Kendall’s τ was the primary quantitative measure for comparison. Categorization of Twitter profiles of users found within the top 20 most influential lists, according to each metric of influence, made up the qualitative portion of analysis. The authors find that measures of centrality—indegree and eigenvector centrality—identify the traditional political elite (media outlets, journalists, politicians) as influential, whereas measures considering the quality of messages and interactions provide a different group of influencers, including political commentators and bloggers. Finally, the authors investigate the possibility of using the local clustering coefficient of nodes to identify those who are both aware of the traditional elite and embedded in tightly knit communities, similar to the “opinion leader,” described in the Two-Step Flow Hypothesis. [ABSTRACT FROM PUBLISHER]",Social media; Twitter (Web resource); Twitter; Content analysis; Social network analysis; social media; Online social networks; social network analysis; Computer network resources; Trend setters; Social influence; online communities; Canadian politics & government; influence,SocIndex,,x,,,x,,,,0.87563688,The Multiple Facets of Influence Identifying Political Influentials and Opinion Leaders on Twitter
journalArticle,2015,"Levin, Brian",The Original Web of Hate.,American Behavioral Scientist,,https://ezproxy.lib.utexas.edu/login?url=https://search.ebscohost.com/login.aspx?direct=true&db=sih&AN=110353438&site=ehost-live,"Before the Islamic State in Iraq and the Levant (ISIL) leveraged the Internet into a truly modern quasi-state propaganda machine through horrendous online videos, travel handbooks, and sophisticated Twitter messengering, more humble yet highly effective precursors targeted youthful Western Muslims for radicalism, during a time when home grown plots peaked. These brash new entrants into the crowded freewheeling world of extremist cyber-haters joined racists, religious extremists of other faiths, Islamophobes, single issue proponents, as well as anti-government rhetoriticians and conspiracists. The danger from these evolving new provocateurs, then and now, is not that they represent a viewpoint that is widely shared by American Muslims. However, the earlier successful forays by extremist Salafists, firmly established the Internet as a tool to rapidly radicalize, train and connect a growing, but small number of disenfranchised or unstable young people to violence. The protections that the First Amendment provide to expression in the United States, contempt for Western policies and culture, contorted fundamentalism, and the initial successes of these early extremist Internet adopters, outlined here, paved the way for the ubiquitous and sophisticated online radicalization efforts we see today. [ABSTRACT FROM AUTHOR]","Terrorism; Mujahideen; Computer network resources; Internet & terrorism; Internet; Islam; terrorism; Qaida (Organization); Al-Awlaki, Anwar, 1971-2011; Domestic terrorism; radicalism; Radicalism -- Religious aspects; Religious extremists",SocIndex,,,,,,,,,0.087078301,The Original Web of Hate
journalArticle,2017,"Casero-Ripollés, Andreu; Sintes-Olivella, Marçal; Franch, Pere",The Populist Political Communication Style in Action: Podemos's Issues and Functions on Twitter During the 2016 Spanish General Election.,American Behavioral Scientist,,https://ezproxy.lib.utexas.edu/login?url=https://search.ebscohost.com/login.aspx?direct=true&db=sih&AN=125876346&site=ehost-live,"Populism is a phenomenon that has been acquiring great relevance over recent years in the United States and Europe. Literature on the subject has identified the existence of a populist style that also affects political communication. The aim of this article is to analyze the structure of issues and the functions of messages circulated by a populist party in order to determine the presence and incidence of this style's main components. The methodology is based on a quantitative analysis of the content of the Twitter profiles of the Spanish political party Podemos and its leader, Pablo Iglesias, during the 2016 Spanish elections. Totally, 2,612 tweets were analyzed. The results allow the identification of a strategy of complementarity, which appears as a new component in the communication style of populism in the digital environment. Podemos is also seen to lean toward antielitism and its leader toward the communicative construction of ""the people."" [ABSTRACT FROM AUTHOR]","Twitter (Web resource); Elections; Twitter; social media; Spain; political communication; populism; Political communication; Podemos; Podemos (Political party : Spain); Populist parties (Politics); Iglesias Turrión, Pablo, 1978-",SocIndex,,x,x,,,,,,0.195148368,The Populist Political Communication Style in Action Podemos s Issues and Functions on Twitter During the 2016 Spanish General Election
journalArticle,2017,"Chua, Alton Y. K.; Tee, Cheng-Ying; Pang, Augustine; Lim, Ee-Peng",The Retransmission of Rumor and Rumor Correction Messages on Twitter.,American Behavioral Scientist,,https://ezproxy.lib.utexas.edu/login?url=https://search.ebscohost.com/login.aspx?direct=true&db=sih&AN=124605619&site=ehost-live,"This article seeks to examine the relationships among source credibility, message plausibility, message type (rumor or rumor correction) and retransmission of tweets in a rumoring situation. From a total of 5,885 tweets related to the rumored death of the founding father of Singapore Lee Kuan Yew, 357 original tweets without an “RT” prefix were selected and analyzed using negative binomial regression analysis. The results show that source credibility and message plausibility are correlated with retransmission. Also, rumor correction tweets are retweeted more than rumor tweets. Moreover, message type moderates the relationship between source credibility and retransmission as well as that between message plausibility and retransmission. By highlighting some implications for theory and practice, this article concludes with some limitations and suggestions for further research. [ABSTRACT FROM AUTHOR]",Twitter (Web resource); Microblogs; Twitter; Online social networks; Tags (Metadata); Regression analysis; rumor; Rumor; Fake news; retransmission; retweetability; rumor correction,SocIndex,,,x,x,,,,,0.795152307,The Retransmission of Rumor and Rumor Correction Messages on Twitter
journalArticle,2019,"Myers, Megan Jeanette","The classroom, the campus, and beyond: Using Twitter to connect in #Latinxstudies courses.","El salón de clases, el recinto y más allá: El uso de Twitter como conexión en los cursos de #Latinxstudies.",,https://ezproxy.lib.utexas.edu/login?url=https://search.ebscohost.com/login.aspx?direct=true&db=sih&AN=136557752&site=ehost-live,"This article examines how Twitter can be used as a pedagogical tool in the Latinx studies classroom to connect students to a more expansive Latinx network beyond the local or campus community. The use of a course hashtag and careful delineation of a class Twitter project allows students to actively engage in national discussions related to Latinx studies and to critically (and virtually) curate an individual response to current events. This article includes a mixed-methods assessment of the use of Twitter in the Latinx studies classroom over a period of three semesters in an introductory-level course at a large, Midwestern, public institution. (English) [ABSTRACT FROM AUTHOR]",Social media; Twitter (Web resource); Twitter; Critical thinking; Digital literacy; Digital pedagogies; Alfabetismo digital; Classrooms; Medios sociales; Pedagogías digitales; Pensamiento crítico,SocIndex,,,x,,,,,,0.017597446,The classroom the campus and beyond Using Twitter to connect in Latinxstudies courses
journalArticle,2019,"van den Broek, TA; Need, A; Ehrenhard, ML; Priante, A; Hiemstra, D",The influence of network structure and prosocial cultural norms on charitable giving: A multilevel analysis of Movember's fundraising campaigns in 24 countries,SOCIAL NETWORKS,10.1016/j.socnet.2019.04.001,,"This study examines how the interplay between an online campaign's network structure and prosocial cultural norms in a country affect charitable giving. We conducted a multilevel analysis that includes Twitter network and aggregated donation data from the 2013 Movember fundraising campaigns in 24 countries during 62 campaign days. Prosocial cultural norms did not affect the relationship between network size and average donations raised, nor did they affect the relationship between network centralization and average donation amount. Prosocial cultural norms did affect the relationship between network density and average donations raised. However, this effect was negative and contrary to our expectation.",Social media; Social networks; Collective action; COLLECTIVE ACTION; COMMUNITY; Communities; Campaigns; Charitable giving; Cultural norms; SOCIAL NETWORKS; COMPUTER-MEDIATED COMMUNICATION; FOCUS; PHILANTHROPY; TIES,WOS,,,,,,x,,,0.008224383,The influence of network structure and prosocial cultural norms on charitable giving A multilevel analysis of Movember s fundraising campaigns in 24 countries
