243,journalArticle,2020.0,"Altman-Lupu, Michael J.",UGANDA'S TAX ON SOCIAL MEDIA: FINANCIAL BURDENS AS A MEANS OF SUPPRESSING DISSENT.,Columbia Human Rights Law Review,,https://ezproxy.lib.utexas.edu/login?url=https://search.ebscohost.com/login.aspx?direct=true&db=sih&AN=145312114&site=ehost-live,"In response to political upheaval, African states have restricted access to social media platforms. In what appears to be the start of a regional trend, several East African nations have imposed taxes and fees on social media. Uganda has levied the world's first tax on social media users, imposing in 2018 a daily tax on the use of fiftyeight websites and applications, including Facebook, Twitter, Instagram, WhatsApp, and Skype. To access these platforms, one must pay a daily fee of 200 Ugandan Shillings ($.054 USD). This Note will use the Ugandan social media tax as a case study through which to examine the legality, under international law, of financial burdens designed to suppress political dissent. While the analysis will focus solely on Uganda's law, much of it will apply beyond Uganda's borders to countries pursuing similar legislation. Part I provides important background with respect to the Ugandan scheme. Part II explores freedom of expression over the Internet under international law and determines what types of restrictions on expression are legally permissible. Part III analyzes whether a tax that affects speech would be considered a restriction of expression. Finally, Part IV examines the social media tax through the lens of Article 19 of the International Covenant on Civil and Political Rights (ICCPR) and analyzes the consequences of a determination that the social media tax violates international norms, both within Uganda and more broadly across East Africa. [ABSTRACT FROM AUTHOR]",Social media; Political opposition; Freedom of expression; International law; Taxation; Uganda,SocIndex,,,,,,,,
244,journalArticle,2019.0,"Harris, Lindsay M.",WITHHOLDING PROTECTION.,Columbia Human Rights Law Review,,https://ezproxy.lib.utexas.edu/login?url=https://search.ebscohost.com/login.aspx?direct=true&db=sih&AN=136834691&site=ehost-live,"In June 2018, President Trump wrote a pair of tweets en route to his golf course, calling for ""no Judges or Court Cases"" at our border and swift deportation of immigrants, essentially without due process. While immigrant advocates were quick to explain the myriad constitutional problems with this proposal, elements of Trump's dream are already a reality. This Article reveals how a single Customs and Border Protection officer can short-circuit the checks and balances prescribed by U.S. and international law to protect refugees from being returned to harm, and cast a long shadow over a future, meritorious asylum claim. In light of the growing attention to the plight of those fleeing persecution and seeking asylum at our borders, this Article examines shortcomings in both law and practice, illuminating the long-lasting ramifications of erroneously issued expedited removal orders for asylum seekers and their families. Congress designed the expedited removal system to expedite deportations and circumvent due process before an immigration judge. Certain humanitarian protections are built into the system to ensure that the United States meets its international and domestic legal obligations not to return refugees to a place where they would face persecution or torture. In practice, these humanitarian protections are too often improperly implemented and front-line border enforcement officials, whether manifesting bias against asylum seekers or lacking proper training and expertise, routinely ignore U.S. law and the Department of Homeland Security's own regulations. This results in the wrongful deportation of asylum seekers and, as revealed in the Article, in permanent negative ramifications for those lucky enough to make it back over the border to in an attempt to re-apply for asylum. The Article examines the disastrous interplay between two of the ""speed deportation"" processes of expedited removal and reinstatement of removal, the lack of sufficient safeguards that leave refugee screening at our borders in the shadows, and the absence of judicial review. The Article seeks not only to expose and analyze this problem, but also to improve the situation by considering a suite of pragmatic, actionable solutions to close the gap between the humanitarian protections prescribed by law and the reality faced by asylum seekers at the U.S. border. As an immediate first step to implement the humanitarian protections enshrined in law, the Article explores the merits and risks of using readily available technology: the use of Body-Worn Cameras by Customs and Border Protection officers conducting screenings of potential refugees at the border to fill the protection gap. [ABSTRACT FROM AUTHOR]","United States; Border security; Trump, Donald, 1946-; Deportation; Deportation policy; Legal status of political refugees",SocIndex,,,,,,,,
245,journalArticle,2018.0,"BRIGGS, SAMANTHA",The Freedom of Tweets: The Intersection of Government Use of Social Media and Public Forum Doctrine.,Columbia Journal of Law & Social Problems,,https://ezproxy.lib.utexas.edu/login?url=https://search.ebscohost.com/login.aspx?direct=true&db=sih&AN=132765003&site=ehost-live,"In recent years, American presidents and other government actors have moved much of their communications with the general public online, through their use of social media. President Donald Trump is particularly known for his use of Twitter and his extensive communications via his account, @realDonaldTrump. Such government social media usage has historically gone unchecked by the courts, but that changed when the Knight Institute brought suit against President Trump for violating the First Amendment rights of users blocked by @realDonaldTrump. This litigation is an illuminating example of why First Amendment analysis must extend to government social media pages, and yet raises new challenges. There are logical reasons why government actors may want to exert certain controls over their social media pages, though these controls will potentially run against the First Amendment. As such, this Note not only argues why First Amendment analysis must extend to government use of social media, but also proposes methods for how government actors might structure their online presences to avoid First Amendment rebuke. [ABSTRACT FROM AUTHOR]","Microblogs; Social media & politics; Blogs & politics; Trump, Donald, 1946-; United States. Constitution. 1st Amendment",SocIndex,,,,,,,,
246,journalArticle,,"Trusolino, Madison",“I wanna kill my rapist”: Margaret Cho’s #12DaysofRage campaign as promotional digital activism,Communication and the Public,10.1177/20570473221111200,https://doi-org.ezproxy.lib.utexas.edu/10.1177/20570473221111200,"On November 1, 2015, comedian Margaret Cho announced a two-part campaign inspired by her history as a sexual-abuse survivor, to promote her new music video “I Wanna Kill My Rapist”. This included the creation of the hashtag #12DaysofRage. In this article, I explore how Cho used her status as a celebrity to circulate #12DaysofRage which acted as a discursive intervention in rape culture. I used content analysis and thematic analysis to identify themes in the archive of 2401 tweets I collected. I also performed a feminist discourse analysis on both the tweets and news coverage of the campaign to situate the hashtag within its historical, social, and political context. I argue that Cho performed what I call “promotional activism”, a subsection of celebrity activism where a celebrity promotes a cause as part of the promotion of a particular project or product. Cho’s choice to centre herself in the campaign made it impossible to separate Cho from the hashtag, preventing #12DaysofRage from greater viral potential, but still acting as a resonant, but ephemeral, gathering point for survivor-focused advocacy.",,SAGE,,,,,,,,
247,journalArticle,,"Clark, Meredith D.",DRAG THEM: A brief etymology of so-called “cancel culture”,Communication and the Public,10.1177/2057047320961562,https://doi-org.ezproxy.lib.utexas.edu/10.1177/2057047320961562,"The term “cancel culture” has significant implications for defining discourses of digital and social media activism. In this essay, I briefly interrogate the evolution of digital accountability praxis as performed by Black Twitter, a meta-network of culturally linked communities online. I trace the practice of the social media callout from its roots in Black vernacular tradition to its misappropriation in the digital age by social elites, arguing that the application of useful anger by minoritized people and groups has been effectively harnessed in social media spaces as a strategy for networked framing of extant social problems. This strategy is challenged, however, by the dominant culture’s ability to narrativize the process of being “canceled” as a moral panic with the potential to upset the concept of a limited public sphere.",,SAGE,,,,,,,,
248,journalArticle,,"Shao, Lingwei; Zhang, Hong",Global voice and social television: Exploring microblogging responses to “The Voice” shows in China and Germany,Communication and the Public,10.1177/2057047316649962,https://doi-org.ezproxy.lib.utexas.edu/10.1177/2057047316649962,"This study examines the audiences’ discussions on the local adaptations of The Voice of China and The Voice of Germany through a content analysis of 128 microblogging posts. Specifically, this research explores the content, language and tone of the sampled posts on Sina Weibo and Twitter, respectively. The study found that while German audiences take notice of various topics relating to the show, Chinese audiences mainly focus on talents. The Chinese audiences have also paid attention to the talents’ age in accordance with their respect to the elderly in the society. Compared to the German audiences, the Chinese audiences post in their mother tongue exclusively and they are more critical. The findings suggest marked differences of the audiences’ responses to the shows on microblogging websites in different national contexts, but also partly challenge the traditional cultural values proposed by Hall and Hofstede based on researches of offline behaviors.",,SAGE,,,,,,,,
249,journalArticle,,"Levental, Orr; Galily, Yair; Yarchi, Moran; Tamir, Ilan","Imagined communities, the online sphere, and sport: The Internet and Hapoel Tel Aviv Football Club fans as a case study",Communication and the Public,10.1177/2057047316668364,https://doi-org.ezproxy.lib.utexas.edu/10.1177/2057047316668364,"The Internet, particularly social media, has enhanced civic movements’ ability to communicate and organize their activities. This study addresses this issue in the realm of sports and examines fans’ online interaction while analyzing different platforms Hapoel Tel Aviv FC fans use (websites, forums, Twitter, and Facebook), especially during their 2011–2012 protest against the team’s owner. Findings indicate that technology enables fans to create and distribute information and organize beyond just official team activities and platforms. These trends are more salient in times of a protest.",,SAGE,,,,,,,,
250,journalArticle,,"Demir, Fatih; Bastug, Mehmet F.; Douai, Aziz",Keeping it peaceful: Twitter and the Gezi Park movement,Communication and the Public,10.1177/2057047320959852,https://doi-org.ezproxy.lib.utexas.edu/10.1177/2057047320959852,"Over the last decade, social media platforms have become the leading communication tools for activists and protesters all over the world. Understanding protesters’ motivations and reasons for using social media is a challenging issue for researchers. In this article, we analyzed the use of Twitter during the anti-governmental protests in Istanbul that was launched in May 2013. We examined 13,794 tweets posted to the #direngeziparki hashtag over a 6-day period. Based on the results of a qualitative content coding of the tweets, we found that the Twitter platform was widely used to mobilize protesters, share information about the events, and express opinions about the policing of the protests. We argue that social media can help keep protests peaceful by preventing vandalism, informing the protesters about extremist or violent groups participating in the protests, and can help them to avoid engaging in violent acts against police forces.",,SAGE,,,,,,,,
251,journalArticle,,"Hopke, Jill E.; Gabay, Itay; Kim, Sojung C.; Rojas, Hernando",Mobile phones and political participation in Colombia: Mobile Twitter versus mobile Facebook,Communication and the Public,10.1177/2057047316642607,https://doi-org.ezproxy.lib.utexas.edu/10.1177/2057047316642607,"In this article, we test the relationships between Twitter and Facebook use on mobile phones and political conversation with offline and online political participation, as well as online expressive communication. Our findings show that using Twitter on mobile phones is associated with a higher likelihood for both online and offline political participation, as well as online expressive communication. Using Facebook is associated with a higher likelihood for online expressive communication only. The key contribution of this article is to show empirical differences between the relationships of social media and social networking on mobile devices with political participation and online expressive communication. Public social media apps, such as Twitter, bring mobile communication back into the public realm of a (albeit diffused) broadcast-like channel. Mobile Twitter adds to the affordances of mobility, networked connectivity, and the publicness of social media.",,SAGE,,,,,,,,
425,journalArticle,2017.0,"Byrd, W. Carson; Gilbert, Keon L.; Richardson, Joseph B.",The vitality of social media for establishing a research agenda on black lives and the movement.,Ethnic & Racial Studies,,https://ezproxy.lib.utexas.edu/login?url=https://search.ebscohost.com/login.aspx?direct=true&db=sih&AN=123952407&site=ehost-live,"Social media provides scholars with important portals into the lives of marginalized communities and the movements organized to combat issues of race and racism in society. However, how to incorporate the seemingly unwieldy amount of social media data for research in our fields can pose challenges to further clarify how people navigate our social world and the issues with in it, but also how they organize to push for social change and equality. In what follows, the authors discuss how social media data can be used to enhance our studies of black lives in reflection of the burgeoning Black Lives Matter movement on issues such as gun violence, public health, and higher education. [ABSTRACT FROM AUTHOR]",Social media; Twitter; Equality; social media; Social movements; education; public health; Black Lives Matter; Communities; criminal justice; Poor people,SocIndex,,,,,,,,
468,journalArticle,2022.0,"Schuenemann, WJ; Brand, A; Koenig, T; Ziegler, J",Leveraging Dynamic Heterogeneous Networks to Study Transnational Issue Publics. The Case of the European COVID-19 Discourse on Twitter,FRONTIERS IN SOCIOLOGY,10.3389/fsoc.2022.884640,,"The ongoing COVID-19 pandemic constitutes a critical phase for the transnationalization of public spheres. Against this backdrop, we ask how transnational COVID-19 related online discourse has been throughout the EU over the first year of the pandemic. Which events triggered higher transnational coherence or national structuration of this specific issue public on Twitter? In order to study these questions, we rely on Twitter data obtained from the TBCOV database, i.e., a dataset for multilingual, geolocated COVID-19 related Twitter communication. We selected corpora for the 27 member states of the EU plus the United Kingdom. We defined three research periods representing different phases of the pandemic, namely April (1st wave), August (interim) and December 2020 (2nd wave) resulting in a set of 51,893,966 unique tweets for comparative analysis. In order to measure the level and temporal variation of transnational discursive linkages, we conducted a spatiotemporal network analysis of so-called Heterogeneous Information Networks (HINs). HINs allow for the integration of multiple, heterogeneous network entities (hashtags, retweets, @-mentions, URLs and named entities) to better represent the complex discursive structures reflected in social media communication. Therefrom, we obtained an aggregate measure of transnational linkages on a daily base by relating these linkages back to their geolocated authors. We find that the share of transnational discursive linkages increased over the course of the pandemic, indicating effects of adaptation and learning. However, stringent political measures of crisis management at the domestic level (such as lockdown decisions) caused stronger national structuration of COVID-19 related Twitter discourse.",MEDIA; Twitter; COVID-19; PATTERNS; discourse analysis; POWER; SITES; DISEASE; dynamic networks; European public sphere; heterogeneous information networks; transnationalization,WOS,,,,,,,,
520,journalArticle,2021.0,"Roy, Melissa; Moreau, Nicolas; Rousseau, Cécile; Mercier, Arnaud; Wilson, Andrew; Dozon, Jean-Pierre; Atlani-Duault, Laëtitia","Constructing Ebola martyrs, warriors, and saviours: online heroisation in a context of risk and unease.","Health, Risk & Society",,https://ezproxy.lib.utexas.edu/login?url=https://search.ebscohost.com/login.aspx?direct=true&db=sih&AN=149919939&site=ehost-live,"The perception of epidemic risk has been associated with the production of narratives in which figures such as villains and heroes emerge. This article critically analyzes social media users' construction of heroic figures during the 2013–2016 Ebola epidemic. We used international Twitter and Facebook comments as our raw material, collected by key word extraction. A thematic analysis resulted in a descriptive typology of three heroic figures: the martyr, the warrior, and the saviour. Our analysis showed that heroic status (highly associated with willingness to take high risks on behalf of others) was mostly conferred on common individuals and 'insiders' living in the Ebola-afflicted communities – often deemed 'unsung' – rather than the foreigners frequently heroised in previous crises. We deconstruct this heroisation dynamic, showing that it is a socially strategic move because it is embedded in a potential instrumentalization of heroes. First, this production of 'everyday heroes' may encourage the involvement of lay people in the epidemic response, by conveying that anyone can become a health hero. Second, we show that this heroisation process maintains the status quo by encouraging adherence to biomedical discourses, and by individualising the narrative and neglecting the structural changes needed to address the epidemic. Finally, we caution against discourses that seem socially 'progressive' but may be used as a smokescreen to hide discriminatory dynamics, and we recommend changes in communication strategies. [ABSTRACT FROM AUTHOR]",Social media; Twitter (Web resource); Thematic analysis; social media; Facebook (Web resource); Ebola; Ebola virus disease; Consumer attitudes; Courage; epidemic; health risk perception; Hero; Risk-taking behavior,SocIndex,,,,,,,,
550,journalArticle,2017.0,"Waisbord, S; Amado, A",Populist communication by digital means: presidential Twitter in Latin America,INFORMATION COMMUNICATION & SOCIETY,10.1080/1369118X.2017.1328521,,"In this paper, we analyze the uses of Twitter by populist presidents in contemporary Latin America in the context of the debates about whether populism truly represents a revolution in public communication - that is, overturning the traditional hierarchical model in favor of popular and participatory communication. In principle, Twitter makes it possible to promote the kind of interactive communication often praised in populist rhetoric. It offers a flattened communication structure in contrast to the top-down structure of the traditional legacy media. It is suitable for horizontal, unmediated exchanges between politicians and citizens. Our findings, however, suggest that Twitter does not signal profound changes in populist presidential communication. Rather, it represents the continuation of populism's top-down approach to public communication. Twitter has not been used to promote dialogue among presidents and publics or to shift conventional practices of presidential communication. Instead, Twitter has been used to reach out the public and the media without filters or questions. It has been incorporated into the presidential media apparatus as another platform to shape news agenda and public conversation. Rather than engaging with citizens to exchange views and listen to their ideas, populists have used Twitter to harass critical journalists, social media users and citizens. Just like legacy media, Twitter has been a megaphone for presidential attacks on the press and citizens. It has provided with a ready-made, always available platforms to lash out at critics, conduct personal battles, and get media attention.",Social media; POLITICAL COMMUNICATION; Twitter; FACEBOOK; political communication; populism; CANDIDATES; ELECTION CAMPAIGN; presidential communication; TWEETS,WOS,,,,,,,,
609,journalArticle,2020.0,"Vicari, S; Iannelli, L; Zurovac, E",Political hashtag publics and counter-visuality: a case study of #fertilityday in Italy,INFORMATION COMMUNICATION & SOCIETY,10.1080/1369118X.2018.1555271,,"In 2016 the Italian health ministry launched the 'Fertility Day' campaign, aimed at tackling Italy's low birth rate. Under the accusation of delivering sexist and racist messages, the campaign became a trending topic on Twitter, and a protest was launched to be held during Fertility Day. By applying a combination of digital methods and visual content analysis to the #fertilityday Twitter stream, this paper contributes to existing research on the deliberative strength of political hashtag publics, with a particular focus on their power structures, communication patterns and visual content use. Findings on gatekeeping dynamics downsize optimistic views on the democratising potential of Twitter's socio-technical infrastructure as they point to the emergence of online satirical media and 'tweetstars' - along with mainstream news media- as main producers of spreadable content, with ordinary users only surfacing when traditional media elites and new satirical actors lack or lose interest in the debate. Results confirm that political hashtag publics follow acute event communication patterns, with users highly engaged in retweeting and referencing external material and visual content playing a key role in these gatewatching practices. The transient counter-visuality - or critical stance - of tweets with user-manipulated images, however, also suggests that the deliberative potential of these publics is not easily sustainable over time.",Twitter; public sphere; Gatekeeping; hashtag publics; visual data; TWITTER; MEMES,WOS,,,,,,,,
640,journalArticle,2018.0,"Habel, P; Moon, R; Fang, A",News and information leadership in the digital age,INFORMATION COMMUNICATION & SOCIETY,10.1080/1369118X.2017.1346136,,"This paper examines information networks on social media to draw conclusions about influence relationships among members of the mass media. The project considers social networks and information patterns using Twitter data, first at the newspaper level and second at the journalist level. Using a computational approach, we look for evidence of elite-directed information flows, as well as exploring whether we find evidence of an increase in the democratization of newsmaking. This study finds that elite voices continue to dominate information networks in the digital age; however, it also finds evidence that information can move expeditiously from journalists in local and regional outlets to elite ones, and vice versa. We move further to explore the content of tweets among the journalist network, finding that there are substantial, direct interactions among elite and regional and local journalists. Our results taken together uncover new network patterns and provide a novel insight on the role of information technologies in newsmaking in the digital age.",social media; JOURNALISTS; COVERAGE; journalism; BIRDS; FEATHER; computational methods; imitation journalism; Information leadership; newsmaking; TWITTER; SETTING INFLUENCE; TRADITIONAL MEDIA,WOS,,,,,,,,
