173,journalArticle,2021.0,"Martiniuk, Jill","Moms, muses, and moguls: Russian businesswomen and social media.",Canadian Slavonic Papers,,https://ezproxy.lib.utexas.edu/login?url=https://search.ebscohost.com/login.aspx?direct=true&db=sih&AN=154569847&site=ehost-live,"This article focuses on the influence of a group of Russian women collectively known as ""the czarinas"" on social media. This group of business-minded socialites began appearing on social media around 2012 and have turned their popularity on Twitter and Instagram into Internet-based business ventures that are centred around their perceived identities as wives, mothers, and fashion muses. Together, these women have served as an aspirational tableau for other Russian women trying to navigate their own roles of mothers and businesswomen. This article examines how these ""czarinas"" have constructed their perceived social media identities as wives and mothers to create a relationship with their followers that allows the czarinas to influence their purchasing decisions. Finally, it examines why these women have embraced social media, how they use it to promote their businesses, and how successfully they have navigated social issues created in both Russia and the West. (English) [ABSTRACT FROM AUTHOR]",Social media; gender; influencers; Russian businesswomen; women's position in Russia,SocIndex,0,,,,,,,
174,journalArticle,2021.0,"Isaksen, Judy L.; Eltantawy, Nahed",What happens when a celebrity feminist slings microaggressive shade?: Twitter and the pushback against neoliberal feminism.,Celebrity Studies,,https://ezproxy.lib.utexas.edu/login?url=https://search.ebscohost.com/login.aspx?direct=true&db=sih&AN=152788720&site=ehost-live,"Bouncing off the excitement expressed on Twitter and onstage at the 2015 Video Music Awards ceremony involving Nicki Minaj, Taylor Swift, Miley Cyrus, and music fans, this case study explores the pronounced whiteness among celebrity feminists within our neoliberal postfeminist culture and the pushback on social media against the glaring contradictions of Swift's and Cyrus's white feminism. Analyses of the tweets are conducted through both critical rhetoric and microaggressive theories, useful tools for exposing problematic hegemonic social practices regarding race, gender, and body politics within the music industry. This cultural critique on the role of celebrity feminists unmasks the role of discourse – intentional and unintentional – in both reproducing and challenging hegemonic ideologies; exposes Swift's unknowing contribution to neoliberal feminism; and positions Twitter as a valuable venue for emerging feminists to create counter-narratives that challenge formations within celebrity feminism. By examining the celebrities' digital interactions and the responsive fan intervention, we are able to come to a clearer understanding of the gestures that both support and challenge the co-constitutive structures of celebrity and feminism and see specifically the ways in which Swift's neoliberal form of feminism reinscribes the very oppression that she and other celebrity feminists claim to be against. [ABSTRACT FROM AUTHOR]","Twitter Inc.; Feminism; Twitter; Feminists; celebrity feminism; Cyrus, Miley, 1992-; Fame; Gesture; Microaggressions; Music awards; Music videos; neoliberalism; Neoliberalism; Swift, Taylor, 1989-; white feminism",SocIndex,12,,,,,,,
175,journalArticle,2019.0,"Patrick, Stephanie","Becky with the Twitter: Lemonade, social media, and embodied academic fandom.",Celebrity Studies,,https://ezproxy.lib.utexas.edu/login?url=https://search.ebscohost.com/login.aspx?direct=true&db=sih&AN=136461199&site=ehost-live,"As someone who uses Twitter to follow celebrity culture, but rarely tweets directly 'at' celebrities, I have been neglected in much work on social media that centres on issues of authenticity or 'democratisation'. In this article I theorise 'aca-fandom' in relation to race, situating myself as a white feminist researcher/consumer of Black women's cultural and intellectual production. I reflect upon on my own use of Twitter in relation to Beyoncé's star image in order to explicate ways of engaging with celebrity beyond the authenticity paradigm centring on a front-stage/back-stage dichotomy. By following prominent social justice activists and writers who comprise 'Black Twitter', I was able to access their commentary on Lemonade in ways that enriched my understanding of Beyoncé's work; work that I increasingly felt distanced from, but more enthralled by. This article uses autoethnographic methods to re-centre the researcher body and illuminate connections between privilege and perspective on both star–audience relations and subject–researcher positions. Although Twitter may not challenge the hierarchical structures of media production, nor necessarily provide more 'authentic' views on celebrity, it does provide access to diverse perspectives on celebrity texts and, in this way, is a valuable resource for both audiences and researchers of celebrity culture. [ABSTRACT FROM AUTHOR]",Social media; Twitter (Web resource); Twitter; aca-fandom; autoethnography; Beyoncé; Lemonade,SocIndex,6,,,,,,,
176,journalArticle,2016.0,"Myers, Greg",Everyday oracles: authors on Twitter.,Celebrity Studies,,https://ezproxy.lib.utexas.edu/login?url=https://search.ebscohost.com/login.aspx?direct=true&db=sih&AN=119092437&site=ehost-live,"Most authors participate, reluctantly or enthusiastically, in a cycle of promotion, including book tours, literary festivals, interviews, and now social media. Some authors make regular use of Twitter to post updates about professional activities, comments on events in their everyday lives, news of readings, statements of opinions, photos, links, or retweets. This study examines tweets by 10 authors, using corpus linguistic tools to find stylistic patterns characteristic of the corpus as a whole or of individual authors. The article then looks at tweets by others that mention the authors or use quotations from the authors in new contexts, creating an online presence for authors whether they tweet themselves or not. Authors are subject to the same tension between ordinariness and specialness that others have noted with stars in music, television, film, or fashion. Literature, because of its assumed cultural position, and its production in private, has sometimes been seen as being apart from and opposed to the cultural system of celebrity and promotion. But this cultural position also means the ordinariness of authors is treated as surprising and interesting, while the specialness makes them available to all as oracles. [ABSTRACT FROM AUTHOR]",Twitter (Web resource); Twitter; Authors; authorship; Authorship; celebrity; Corpora; everyday life; Oracles; quotation; singularity,SocIndex,0,,,,,,,
177,journalArticle,2015.0,"Kehrberg, Amanda K.","‘I love you, please notice me’: the hierarchical rhetoric of Twitter fandom.",Celebrity Studies,,https://ezproxy.lib.utexas.edu/login?url=https://search.ebscohost.com/login.aspx?direct=true&db=sih&AN=100953756&site=ehost-live,"Since its 2006 debut, Twitter has emerged as the primary online space for communication between celebrity and audience. Yet scholars are conflicted on whether Twitter’s expanded interaction is actual or merely perceived. Some contend that the social media site represents a democratised public square in which the borders between ordinary and extraordinary are flattened, while others argue that Twitter encompasses synthetic personalisation: hierarchical power dynamics masked by simulated interconnection. Assuming that Twitter communication is an extension of traditions of letter-writing by fans and fan clubs, this study utilises a framework for rhetorical arrangement drawn from medieval work on thears dictaminis, or the art of letter-writing. Informed by Cicero, thears dictaminisdivided the letter into five parts, includingexordium(opening),captatio benevolentiae(capturing of goodwill),narratio(background),petitio(petition/request), andconclusio(conclusion). Tweets directed at the top five most-followed Twitter accounts (Justin Bieber, Katy Perry, Barack Obama, Rihanna, and Taylor Swift) are classified by which of thears dictaminiselements they accomplish. The findings suggest that, given the limitations of the medium, Twitter users focus oncaptatio benevolentiaeandpetitioin addressing stars. It is particularly startling that users often construct their Twitter handles as a reference to the star, thereby soliciting goodwill in the rhetorical space of message sender rather than content. The apparent emphasis oncaptatio benevolentiae– or facework – suggests a maintenance of hierarchical borders among Twitter addressers and addressees in line with synthetic personalisation. Implications are discussed for the future study of the rhetoric of fandom and parasocial interaction online. [ABSTRACT FROM AUTHOR]",Twitter (Web resource); Feminism; Twitter; Online social networks; rhetoric; Celebrities; fandom; Letter writing; celebrity; Affectional orientation; parasocial interaction,SocIndex,33,,,,,,,
178,journalArticle,2014.0,"Van den Bulck, Hilde; Claessens, Nathalie; Bels, Annebeth",‘By working she means tweeting’: online celebrity gossip media and audience readings of celebrity Twitter behaviour.,Celebrity Studies,,https://ezproxy.lib.utexas.edu/login?url=https://search.ebscohost.com/login.aspx?direct=true&db=sih&AN=99801078&site=ehost-live,"The article analyzes use of celebrity Twitter from the perspective of an audience. Topics discussed include construction of the celebrity self on Twitter and evaluation of it by online celebrity gossip media and their audiences, use of celebrity Twitter from perspective of an audience and Twitter just as an another medium in a marginally evolving celebrity culture.",Twitter (Web resource); Twitter Inc.; Celebrities; Audiences; Mass media & celebrities,SocIndex,19,,,,,,,
179,journalArticle,2021.0,"Becker, Amy B.","Alec Baldwin's appearances on Saturday Night Live: tangerine wig, Twitter backlash, and the humanising of President Donald J. Trump.",Celebrity Studies,,https://ezproxy.lib.utexas.edu/login?url=https://search.ebscohost.com/login.aspx?direct=true&db=sih&AN=148751427&site=ehost-live,"For more than three years, Alec Baldwin, comic actor and recurring I Saturday Night Live i host, has been making regular guest appearances on the NBC variety programme clad in a tangerine wig and business suit (Nir [14]). At the same time, however, viewing I SNL i followed by Trump's response to I SNL i via Twitter again reinforces perceptions that Trump is authentic. So even two years in, it seems that Trump's critical and combative response to I SNL i , and in turn Baldwin via Twitter, is still working to Trump's advantage. In the end it seems that as long as Trump remains in the Oval Office, Baldwin will continue to appear on I SNL i an as an exaggerated, and increasingly more likeable version of Trump, especially in contrast with the version of political reality offered up by the current White House. [Extracted from the article]","Public opinion; Trump, Donald, 1946-; Identity (Psychology); Baldwin, Alec, 1958-; Presidential administrations; Presidents; Wigs",SocIndex,,,,,,,,
