865,journalArticle,2012.0,"Hargittai, Eszter; Litt, Eden",BECOMING A TWEEP.,"Information, Communication & Society",,https://ezproxy.lib.utexas.edu/login?url=https://search.ebscohost.com/login.aspx?direct=true&db=sih&AN=76142995&site=ehost-live,"Despite much excitement about the microblogging platform Twitter, little is known about predictors of its adoption and how its uses relate to other online activities in particular. Using a unique longitudinal data set from 2009 to 2010 surveying over 500 diverse young American adults about their online experiences, we look at how adoption of Twitter relates to prior engagement in other types of online activities. Our findings suggest that online skills as well as prior consumption and production activities especially in the domain of entertainment news are significant predictors of subsequent Twitter use. Our results caution about the potential biases that may result from studies that sample on Twitter users excluding other populations. [ABSTRACT FROM AUTHOR]",Social media; Social networks; Microblogs; Twitter; Online social networks; adoption; social network sites; Websites; celebrities; entertainment; longitudinal data,SocIndex,0,,,,,,,
866,journalArticle,2011.0,"Ampofo, Lawrence; Anstead, Nick; O'Loughlin, Ben","TRUST, CONFIDENCE, AND CREDIBILITY.","Information, Communication & Society",,https://ezproxy.lib.utexas.edu/login?url=https://search.ebscohost.com/login.aspx?direct=true&db=sih&AN=63627255&site=ehost-live,"This paper explores how citizen-users think and communicate about public opinion polling through an analysis of tweets published during and just after the 2010 UK General Election leaders' debate broadcast on Sky News on 22 April 2010, the second of three debates. For those who comment on events in real time through social media such as Twitter, a category we call the ‘viewertariat’, this event was notable for Sky News's immediate coverage of a YouGov poll that seemed discrepant. Indeed, within an hour of the end of the debate, various mainstream media published a number of polls apparently at odds with each other. Such discrepancies opened a space for lay theories to emerge about relationships between political parties, media, polling firms, and the wider public itself. Individuals were pushed to find explanations and quick to publish them in a public assembly of views. Analysis of these data illuminates not just what people think, but how they think about long-term concerns of scholars and practitioners of politics and political communication, such as credibility, trust and power, and how citizens manage expectations during events where the outcome is uncertain. Accounting for viewertariat behaviour develops recent research on mediatized politics in important ways. First, we find some viewertariat members performing a lay tutelage role, providing information and explanations about polling and elections to fellow citizens who express confusion. This indicates the continued importance of informed public discussion to some citizens. Second, we find a blurring of elite/non-elite interactions alongside persistent theories about elite conspiracies. [ABSTRACT FROM AUTHOR]",Social networks; United Kingdom; Elections; Public opinion polls; politics; media studies; Web 2.0; social networking; Truthfulness & falsehood; Internet & politics; e-democracy; Teledemocracy,SocIndex,0,,,,,,,
867,journalArticle,2013.0,"Skovsgaard, Morten; Van Dalen, Arjen",DODGING THE GATEKEEPERS?,"Information, Communication & Society",,https://ezproxy.lib.utexas.edu/login?url=https://search.ebscohost.com/login.aspx?direct=true&db=sih&AN=87844700&site=ehost-live,"Although politicians, scholars and campaigners claim that social media such as Facebook and Twitter profoundly change election campaigns, still little is known about the place of social media in the overall campaign mix and its use compared to traditional campaigning channels like the mass media. Cluster analysis of a representative survey among the candidates in the 2011 parliamentary election in Denmark shows that the candidates can be divided into three groups with different campaign mixes: a group which mainly communicates through the traditional mass media, a group which emphasizes social media, and a group which puts low emphasis on media in their campaign. The place of social media in the campaign mix of Danish candidates can be explained by access to the mainstream media and incentives for individual candidates. Traditional media remain the most important communication channel in the Danish campaign, but primarily for candidates who are newsworthy due to their experience and incumbency status. These candidates use social media to generate coverage in the traditional mass media. Challengers and less experienced candidates are more likely to use social media to compensate for lack of attention from the mainstream media, in particular when they are involved in intra-party competition. It is concluded that social media are integrated into Danish campaign mix according to the incentive structure of the electoral system and the media logic which characterizes modern campaigns. [ABSTRACT FROM AUTHOR]",Twitter; social media; Political communication; politicians; Facebook; election; Social media & politics; Election of legislators; campaigning; Internet in political campaigns; Denmark; Mass media -- Political aspects,SocIndex,0,,,,,,,
868,journalArticle,2018.0,"Parsloe, Sarah M.; Holton, Avery E.",#Boycottautismspeaks: communicating a counternarrative through cyberactivism and connective action.,"Information, Communication & Society",,https://ezproxy.lib.utexas.edu/login?url=https://search.ebscohost.com/login.aspx?direct=true&db=sih&AN=128928094&site=ehost-live,"A growing body of research is examining the role of cyberactivism in facilitating social movements. Yet, few have considered the interplay between cyberactivism and disability advocacy. Through a case study of the #boycottautismspeaks movement, this study finds that cyberactivism may provide platforms for self-advocates to connect through bridging and bonding in unique ways that draw together and give voice to individuals who otherwise may not have means for such dynamic engagement. Drawing on a sample of approximately 10,000 tweets that circulated with the #boycottautismspeaks hashtag, this research applies thematic analysis and the Social Identity Model of Deindividuation Effects to reveal how counternarratives of disability are developed and circulated via cyberactivism. Findings reveal that #boycottautismspeaks contributors communicated to enhance bonding through (a) (dis)identification, (b) collaboration, and (c) creative resistance. In addition, they communicated to facilitate bridging by (a) demonstrating morality, (b) appealing to humanity, and (c) aligning with other causes. The #boycottautismspeaks movement melded the logic of collective and connective action, provided opportunities for both coordinated and self-directed activity, developing a network of networks through various stitching mechanisms, and cultivating an affective public. Implications for cyberactivism research and practice as well as disability advocacy are discussed. [ABSTRACT FROM AUTHOR]",Social movements; Social history; Internet; connective action; Autism; counternarratives; cyberactivism; Disabilities; SIDE model; Wide area networks,SocIndex,45,,,,,,,
869,journalArticle,2018.0,"Prøitz, Lin",Visual social media and affectivity: the impact of the image of Alan Kurdi and young people’s response to the refugee crisis in Oslo and Sheffield.,"Information, Communication & Society",,https://ezproxy.lib.utexas.edu/login?url=https://search.ebscohost.com/login.aspx?direct=true&db=sih&AN=126756901&site=ehost-live,"This article focuses on the reception of the image of Alan Kurdi by a group of young volunteers in Oslo and Sheffield, and their understanding of the subsequent civic and political engagement. Methodologically, the study draws on a series of in-depth interviews conducted with a group of young volunteers who saw the photograph when it went viral on Twitter and who had followed the media coverage and participated in on- and offline activities related to the case. To analyse the views of the research participants on the Alan Kurdi case, I draw on feminist theoretical perspectives on affectivity, theoretical literature relating to news images and iconic photography, and online social movement theories. The study shows that the iconic image of Alan Kurdi offered a way of transforming complex and unsettled aspects of the refugee crisis into something concrete and understandable, contributing to galvanize affective resonance and immediate public response among the involved subjects. The infrastructure of social media, enabling the rapid global circulation of the image, contributed to shaping social assemblages to which connective emotions and common meanings were ascribed. [ABSTRACT FROM AUTHOR]",Social media; social media; Social interaction; Mass media; media studies; Reputation; Collective memory; Young people; affect and emotion; image studies,SocIndex,68,,,,,,,
870,journalArticle,2017.0,"Sachdeva, Sonya; McCaffrey, Sarah; Locke, Dexter",Social media approaches to modeling wildfire smoke dispersion: spatiotemporal and social scientific investigations.,"Information, Communication & Society",,https://ezproxy.lib.utexas.edu/login?url=https://search.ebscohost.com/login.aspx?direct=true&db=sih&AN=122728192&site=ehost-live,"Wildfires have significant effects on human populations, economically, environmentally, and in terms of their general well-being. Smoke pollution, in particular, from either prescribed burns or uncontrolled wildfires, can have significant health impacts. Some estimates suggest that smoke dispersion from fire events may affect the health of one in three residents in the United States, leading to an increased incidence of respiratory illnesses such as asthma and pulmonary disease. Scarcity in the measurements of particulate matter responsible for these public health issues makes addressing the problem of smoke dispersion challenging, especially when fires occur in remote regions. Crowdsourced data have become an essential component in addressing other societal problems (e.g., disaster relief, traffic congestion) but its utility in monitoring air quality impacts of wildfire events is unexplored. In this study, we assessed if user-generated social media content can be used as a complementary source of data in measuring particulate pollution from wildfire smoke. We found that the frequency of daily tweets within a 40,000 km2area was a significant predictor of PM2.5 levels, beyond daily and geographic variation. These results suggest that social media can be a valuable tool for the measurement of air quality impacts of wildfire events, particularly in the absence of data from physical monitoring stations. Also, an analysis of the semantic content in people’s tweets provided insight into the socio-psychological dimensions of fire and smoke and their impact on people residing in, working in, or otherwise engaging with affected areas. [ABSTRACT FROM AUTHOR]",Social media; Sentiment analysis; Crowdsourcing; air quality; Forest fires; risk perception; smoke; wildfire; Wildfires,SocIndex,43,,,,,,,
871,journalArticle,2013.0,"Horan, Tyler J.",‘SOFT’ VERSUS ‘HARD’ NEWS ON MICROBLOGGING NETWORKS.,"Information, Communication & Society",,https://ezproxy.lib.utexas.edu/login?url=https://search.ebscohost.com/login.aspx?direct=true&db=sih&AN=84462596&site=ehost-live,"This article examines the variability of produsage (the hybridization of production and consumption) within popular social media by introducing semantic network analysis of information communication on Twitter. Utilizing user data (n[2,254,806]), the study examines the dynamics of produsage (a) as a function of user activity and (b) whether produsage levels vary based on either ‘soft’ or ‘hard’ news information. The findings extend upon past socio-ethnographic studies of social media produsage and demonstrate that produsage is significantly low for low-activity users (the majority) but increases dramatically with user activity becoming the dominant communication modality for users with 5,000–25,000 status messages. The volume of soft news information is over double that of hard news information, while produsage networks vary only slightly based on the type of content distributed with ‘hard’ news information tending toward production bias and ‘soft’ news information toward consumption bias. [ABSTRACT FROM AUTHOR]",Social media; Twitter (Web resource); Twitter; social media; news; produsage; semantic networks; Consumption (Economics); Semantic computing; Semantic networks (Information theory),SocIndex,59,,,,,,,
872,journalArticle,2012.0,"Neuhaus, Fabian; Webmoor, Timothy",AGILE ETHICS FOR MASSIFIED RESEARCH AND VISUALIZATION.,"Information, Communication & Society",,https://ezproxy.lib.utexas.edu/login?url=https://search.ebscohost.com/login.aspx?direct=true&db=sih&AN=70332525&site=ehost-live,"In this paper, the authors examine some of the implications of born-digital research environments by discussing the emergence of data mining and the analysis of social media platforms. With the rise of individual online activity in chat rooms, social networking sites and micro-blogging services, new repositories for social science research have become available in large quantities. Given the changes of scale that accompany such research, both in terms of data mining and the communication of results, the authors term this type of research ‘massified research’. This article argues that while the private and commercial processing of these new massive data sets is far from unproblematic, the use by academic practitioners poses particular challenges with respect to established ethical protocols. These involve reconfigurations of the external relations between researchers and participants, as well as the internal relations that compose the identities of the participant, the researcher and that of the data. Consequently, massified research and its outputs operate in a grey area of undefined conduct with respect to these concerns. The authors work through the specific case study of using Twitter's public Application Programming Interface for research and visualization. To conclude, this article proposes some potential best practices to extend current procedures and guidelines for such massified research. Most importantly, the authors develop these under the banner of ‘agile ethics’. The authors conclude by making the counterintuitive suggestion that researchers make themselves as vulnerable to potential data mining as the subjects who comprise their data sets: a parity of practice. [ABSTRACT FROM AUTHOR]",Twitter; Data mining; Digital technology; Ethics; ethics; social media platforms; visualization; Automatic extracting (Information science); data intensity; Database searching; e-science,SocIndex,83,,,,,,,
873,journalArticle,2017.0,"Qiu, Yuanbo",The openness of Open Application Programming Interfaces.,"Information, Communication & Society",,https://ezproxy.lib.utexas.edu/login?url=https://search.ebscohost.com/login.aspx?direct=true&db=sih&AN=124023345&site=ehost-live,"As a way to provide services or data to third-party developers, Open Application Programming Interfaces (Open APIs) have gained popularity among the programming community in recent years. Many corporations such as Google, Facebook and Twitter are developing Open APIs for their existing services, and most of them are free of charge. As these free APIs facilitate collaboration between different software platforms, many programmers treat them as alternatives to open source. Yet, some programmers have found this collaboration risky to their independence, and they have started to think about the true meaning of the openness of API. More importantly, the definition of Open APIs is rendered ambiguous through the discursive practices that define ‘openness’ in contemporary digital culture. Drawing on the political economy of programming and software, this study begins with the historical discussion of openness and its relationship with the power of code in programming. It points out the openness in programming is not only about the accessibility of the source code, but also the liberty to use source code without restriction. This paper then identifies the technical features of Open APIs and examines the subtle power that restricts their openness. It concludes by suggesting ways to critically understand the openness of software and their politics. [ABSTRACT FROM AUTHOR]",Social media; political economy; Open source software; Application program interfaces; critical code studies; Open APIs; open source; openness; Political economic analysis; Source code,SocIndex,24,,,,,,,
874,journalArticle,2017.0,"Bailo, Francesco; Vromen, Ariadne",Hybrid social and news media protest events: from #MarchinMarch to #BusttheBudget in Australia.,"Information, Communication & Society",,https://ezproxy.lib.utexas.edu/login?url=https://search.ebscohost.com/login.aspx?direct=true&db=sih&AN=124023340&site=ehost-live,"Public protest events are now both social media and news media events. They are deeply entangled, with news media actors – such as journalists or news organisations – directly participating in the protest by tweeting about the event using the protest hashtag; and social media actors sharing news items published online by professional news agencies. Protesters have always deployed tactics to engage the media and use news media agencies’ resources to amplify their reach, with the dual aim of mobilising new supporters and adding their voice to public, mediatised debate. When protest moves between a physical space and a virtual space, the interactions between protesters and media stop being asynchronous orpost hocand turn instantaneous. In this new media-protest ecosystem, traditional media are still relevant sources of information and legitimacy, yet this dynamic is increasingly underpinned by a hybrid interdependency between traditional news and social media sources. In this paper we focus on an anti-austerity government movement that arose in Australia in early 2014 and was mobilised as a series of social media driven, connective action protest events. We show that there is a complex symbiotic interdependency between the movement and the traditional media for recognition and amplification of initial protest events, but that over time as media interest wanes, the movements’ network becomes disconnected and momentum is lost. This suggests that the active role traditional media play in protest events is being underestimated in the current research agenda on connective action. [ABSTRACT FROM AUTHOR]",Social media; Journalists; Government policy; social media; Social movements; Austerity; social networking; Press; news; News agencies,SocIndex,36,,,,,,,
875,journalArticle,2017.0,"Groshek, Jacob; Koc-Michalska, Karolina","Helping populism win? Social media use, filter bubbles, and support for populist presidential candidates in the 2016 US election campaign.","Information, Communication & Society",,https://ezproxy.lib.utexas.edu/login?url=https://search.ebscohost.com/login.aspx?direct=true&db=sih&AN=123602612&site=ehost-live,"Undoubtedly, populist political candidates from the right and the left, including Donald Trump and Bernie Sanders, changed the tenor and direction of the 2016 presidential contest in the US. Much like Barack Obama’s electoral successes that were credited at least in part to his savvy social media campaigning in 2008 and 2012, since Trump’s victory, the notion that social media ‘helped him win’ has been revitalized, even by Trump himself [McCormick, R. (2016a). Donald Trump says Facebook and Twitter ‘helped him win’.The Verge. Retrieved fromhttp://www.theverge.com/2016/11/13/13619148/trump-facebook-twitter-helped-win]. This study therefore explores citizen support for populist and establishment candidates across the ideological spectrum in the US to specifically examine if using social media was related to an increased likelihood of supporting populist presidential political candidates, including Trump. Differing forms of active, passive, and uncivil social media were taken into account and the findings suggest active social media use for politics was actually related to less support for Republican populists, such as Trump, but that forms of both passive or uncivil social media use were linked to an increase in the likelihood of support to a level roughly equivalent to that of the traditional television viewing. These patterns are almost the inverse of support for Democratic populists, in this case namely Sanders. [ABSTRACT FROM AUTHOR]","Social media; social media; Trump; Populism; Presidential candidates; elections; Political candidates; Trump, Donald, 1946-; United States presidential election, 2016; campaigns; president",SocIndex,300,,,,,,,
876,journalArticle,2017.0,"Engesser, Sven; Ernst, Nicole; Esser, Frank; Büchel, Florin",Populism and social media: how politicians spread a fragmented ideology.,"Information, Communication & Society",,https://ezproxy.lib.utexas.edu/login?url=https://search.ebscohost.com/login.aspx?direct=true&db=sih&AN=122728189&site=ehost-live,"Populism is a relevant but contested concept in political communication research. It has been well-researched in political manifestos and the mass media. The present study focuses on another part of the hybrid media system and explores how politicians in four countries (AT, CH, IT, UK) use Facebook and Twitter for populist purposes. Five key elements of populism are derived from the literature: emphasizing the sovereignty of the people, advocating for the people, attacking the elite, ostracizing others, and invoking the ‘heartland’. A qualitative text analysis reveals that populism manifests itself in a fragmented form on social media. Populist statements can be found across countries, parties, and politicians’ status levels. While a broad range of politicians advocate for the people, attacks on the economic elite are preferred by left-wing populists. Attacks on the media elite and ostracism of others, however, are predominantly conducted by right-wing speakers. Overall, the paper provides an in-depth analysis of populism on social media. It shows that social media give the populist actors the freedom to articulate their ideology and spread their messages. The paper also contributes to a refined conceptualization and measurement of populism in future studies. [ABSTRACT FROM AUTHOR]",Social media; ideology; social media; Populism; Political doctrines; Political elites; politics; Demagogues; qualitative text analysis,SocIndex,926,,,,,,,
877,journalArticle,2017.0,"Hampton, Keith N.; Shin, Inyoung; Lu, Weixu",Social media and political discussion: when online presence silences offline conversation.,"Information, Communication & Society",,https://ezproxy.lib.utexas.edu/login?url=https://search.ebscohost.com/login.aspx?direct=true&db=sih&AN=122640716&site=ehost-live,"This paper explores the relationship between the use of social media, attitudinal strength, perceived opinion agreement with social ties, and willingness to discuss a political issue in different online and offline contexts. Unlike the anonymous environment of some Internet forums, social media are closely tied to the relationships and activities of everyday life. Social media increasingly make ties from offline contexts persistent online, and, because of the ambient nature of these technologies, awareness of the opinions, interests, and activities of social ties has become pervasive. As such, the use of social media is likely to affect everyday conversation about political issues in on- and offline contexts, including the home, workplace, social gatherings with friends, community meetings, and on social network sites (SNSs). Based on a national probability survey, we find that the use of SNSs (i.e., Facebook and Twitter) has a direct, negative relationship to deliberation in many offline settings. Some uses of these platforms are associated with having a lower, perceived opinion agreement with social ties. As part of a spiral of silence, this further reduces the willingness of social media users to join political conversations in some offline settings. Only those with the strongest attitudes on an issue are immune. [ABSTRACT FROM AUTHOR]",Social media; Twitter (Web resource); Facebook (Web resource); Online social networks; social networks; Political science; Discursive deliberation; opinion climate; reference group; spiral of silence,SocIndex,149,,,,,,,
