1525,journalArticle,2017.0,"Ostertag, SF; Ortiz, DG",Can Social Media Use Produce Enduring Social Ties? Affordances and the Case of Katrina Bloggers,QUALITATIVE SOCIOLOGY,10.1007/s11133-016-9346-3,,"Can previously unacquainted, grieving individuals who use social media to organize and participate in decentralized mobilizations build strong, lasting social ties? If so, how? What is it about particular social media technologies and platforms that might explain the strength and longevity of their social ties? Drawing on a case study of New Orleans bloggers who took part in a variety of contentious and non-contentious mobilizations after hurricane Katrina, we find that people who mobilize through social media like blogs can form strong and lasting social ties. We argue that this is partly because of the types of communication and interaction that blogs afford. We identify two types of affordances, mechanical and cultural, as distinct qualities of social media like blogs, and illustrate how they enable the building of strong, digitally mediated social ties among grieving people.",Social media; ENGAGEMENT; Emotions; SUPPORT; Blogs; TWITTER; DIGITAL MEDIA; COMMUNICATION TECHNOLOGIES; Affordances; FACEBOOK USE; Mobilization; Moralities; Social ties,WOS,28,,,,,,,
1526,journalArticle,2017.0,"Schneider, Christopher J.",$#*! Sociologists Say: e-Public Sociology on Twitter.,Qualitative Sociology Review,,https://ezproxy.lib.utexas.edu/login?url=https://search.ebscohost.com/login.aspx?direct=true&db=sih&AN=122902445&site=ehost-live,"This paper explores how individuals who self-identify on Twitter as sociologists holding teaching posts at institutions of higher education use the popular micro-blogging social media site. A total of 152,977 tweets from profiles of 130 sociologists were collected and examined using qualitative media analysis. What emerged from these data was an empirical case for an expanded conceptualization of Burawoy's vision of public sociology. Building upon published research (Schneider and Simonetto 2016), the purpose of this conceptually informed paper is to further empirically develop e-public sociology--a form of public sociology that emerges through use of social media whereby the sociologist can simultaneously be the generator and interlocutor of dialogue with multiple publics. Suggestions for future research are noted. [ABSTRACT FROM AUTHOR]",Social media; Twitter; Social learning; Higher education; Social Media; Public sociology; e-Public Sociology; Public Sociology; Qualitative Media Analysis; Social processes,SocIndex,6,,,,,,,
1527,journalArticle,2016.0,"Simonetto, Deana","Expanding Our Methodological Toolbox: The ""Place"" of Twitter in the Ethnographic Endeavor.",Qualitative Sociology Review,,https://ezproxy.lib.utexas.edu/login?url=https://search.ebscohost.com/login.aspx?direct=true&db=sih&AN=112611578&site=ehost-live,"Social media have been increasingly embraced by social actors inhabiting a wide range of social worlds, including the world of professional sports. This paper argues that Twitter has become an indispensible resource for sociologists seeking to better understand these worlds. Using data collected for a study of the Canadian Football League (CFL), the paper contrasts traditional interviews and Twitter as sources of data. This is followed by a discussion of both the unique advantages and limitations of Twitter data in research. The paper ends by encouraging an expansion of sociology's methodological toolbox to include this form of social media. [ABSTRACT FROM AUTHOR]",Twitter (Web resource); Twitter; Research methodology; Social media research; Sociologists; Social Media; Canadian Football League; Canadian Football League (CFL); Methodological Toolbox; Sources of Data,SocIndex,16,,,,,,,
1528,journalArticle,2021.0,"Wielk, Emily; Standlee, Alecea",Fighting for Their Future: An Exploratory Study of Online Community Building in the Youth Climate Change Movement.,Qualitative Sociology Review,,https://ezproxy.lib.utexas.edu/login?url=https://search.ebscohost.com/login.aspx?direct=true&db=sih&AN=150267569&site=ehost-live,"While offline iterations of the climate activism movement have spanned decades, today online involvement of youth through social media platforms has transformed the landscape of this social movement. Our research considers how youth climate activists utilize social media platforms to create and direct social movement communities towards greater collective action. Our project analyzes narrative framing and linguistic conventions to better understand how youth climate activists utilized Twitter to build community and mobilize followers around their movement. Our project identifies three emergent strategies, used by youth climate activists, that appear effective in engaging activist communities on Twitter. These strategies demonstrate the power of digital culture, and youth culture, in creating a collective identity within a diverse generation. This fusion of digital and physical resistance is an essential component of the youth climate activist strategy and may play a role in the future of emerging social movements. [ABSTRACT FROM AUTHOR]",Collective action; Group identity; Activism; Social movements; Virtual communities; Crowdsourcing; Climate change; Social Media; Youth; Climate Activism; Digital Ethnography; Social Movements,SocIndex,12,,,,,,,
1529,journalArticle,2018.0,"Sele, Sello J.; Coetzee, Jan K.; Elliker, Florian; Groenewald, Cornie; Matebesi, Sethulego Z.","Online Social Networking, Interactions, and Relations: Students at the University of the Free State, Bloemfontein.",Qualitative Sociology Review,,https://ezproxy.lib.utexas.edu/login?url=https://search.ebscohost.com/login.aspx?direct=true&db=sih&AN=133179886&site=ehost-live,"Online social networking (OSN) is an activity performed through social network sites (SNS) such as Facebook, Twitter, WhatsApp, and Instagram. OSN has become a dominant interaction mechanism within contemporary society. Online platforms are woven inextricably into the fabric of individuals' everyday lives, especially those of young adults. We present a mixed-methods study--conducted at the University of the Free State in Bloemfontein--that analyzes how students reflect on their everyday experiences of OSN. The key theoretical frameworks guiding this research are phenomenology, existentialism, and reflexive sociology. These theoretical lenses collectively assist in broadening our understanding of the students' experiences that reveal the complexities associated with their interactions and social relations via SNS. From their narratives we learn how the students make sense of their engagements on SNS, how these engagements have an impact on their social interactions, and how OSN affects their self-presentation. [ABSTRACT FROM AUTHOR]",Twitter (Web resource); Social interaction; Facebook (Web resource); Online social networks; Virtual communities; Identity; Online Social Networking (OSN); Social Interaction; Social Network Sites (SNS),SocIndex,1,,,,,,,
1530,journalArticle,2022.0,"Behzadidoost, Rashid; Hasheminezhad, Mahdieh; Farshi, Mohammad; Derhami, Vali; Alamiyan-Harandi, Farinaz",A framework for text mining on Twitter: a case study on joint comprehensive plan of action (JCPOA)- between 2015 and 2019.,Quality & Quantity,,https://ezproxy.lib.utexas.edu/login?url=https://search.ebscohost.com/login.aspx?direct=true&db=sih&AN=159087513&site=ehost-live,"In the big data era, there is a necessity for effective frameworks to collect, retrieve, and manage data. As not all tweets are hashtagged by users, retrieving them is a complicated task. To address this issue, we present a rule-based expert system classifier that uses the well-known concept of fingerprint in the judicial sciences. This expert system using defined rules first takes a fingerprint from the tweets of an emerging topic. After that, for being robust the fingerprint, using a rule-based search, the fingerprint with its neighbor features is to be updated. For detecting the unhashtagged tweets of the topic, each tweet in question checks itself with the generated fingerprint. By using the Twitter APIs of Streaming API and REST API, there is no way to access old Twitter data. To address this issue, we present a hybrid approach of Web scraping and Twitter streaming API. When the presented framework is compared to other similar works, there are (1) a novel two-class classification using an expert system approach that can intelligently and robustly detect the most of tweets of the emerging topics although they do not have the hashtag of the topic.; (2) a practical method for extracting old Twitter data. Also, we made a comparative text mining in 195649 collected Persian and English tweets about JCPOA. The JCPOA is one of the most important international treaties about the nuclear program between the Islamic Republic of Iran and the USA, China, France, Russia, Germany, and England. [ABSTRACT FROM AUTHOR]",Sentiment analysis; Twitter Inc.; Twitter; Iran; Text mining; Expert systems; Fingerprint; Iran deal; JCPOA; Joint Comprehensive Plan of Action (2015); Text mining (Information retrieval); Topic detection,SocIndex,3,,,,,,,
1531,journalArticle,2020.0,"Chong, Miyoung; Kim, Hae Jung Maria",Social roles and structural signatures of top influentials in the #prayforparis Twitter network.,Quality & Quantity,,https://ezproxy.lib.utexas.edu/login?url=https://search.ebscohost.com/login.aspx?direct=true&db=sih&AN=141511589&site=ehost-live,"Scholars have shown much interest in whether diffusion is inflated through planting a piece of information by influential people (influentials). Although a few attempts have been made to discover structural gaps or gap fillers in the Twitter network, these efforts mainly concentrated on applying topological approaches to detect influentials in online networks. Further, though many studies explored diffusion on the Twitter network, they rarely examined the phenomenon with a theoretical framework. Through the #prayforparis Twitter network, this study attempted (1) to identify top influentials by applying multiple centrality measures and word frequency measures and (2) to examine social roles based on structural signatures of the Twitter network through the lens of the Diffusion of Innovation Theory. To fulfill the objectives of this study, the authors employed an innovative multi-method approach combining Social Network Analysis, word frequency analysis via NodeXL and R, and a qualitative approach to examine behavioral and structural relationships of the #prayforparis Twitter network. Top influentials of the network were pop music celebrities who shared condolences to the victims of the 2015 Paris attacks through their tweets. This study identified ""celebrity"" and ""fan"" as social roles based on the structural and qualitative analysis of the network as well as metrical examinations, including indegree and outdegree counts of the social roles of the ""celebrities"" and ""fans."" Justin Bieber, the most dominant influential individual in the #prayforparis Twitter network, functioned as a breaking news provider through his tweet about the death of his friend during the Paris attacks. By filling the gap from the past studies, this study utilizes the theoretical improvement in the diffusion research as well as contributes to the methodological approach about influentials and social roles in the Twitter network. [ABSTRACT FROM AUTHOR]","Twitter; Social network analysis; Diffusion of innovations; Bieber, Justin, 1994-; Diffusion of innovation; Diffusion of innovations theory; Influentials; Paris (France); Paris Terrorist Attacks, Paris, France, 2015; Popular music; Prayforparis; Social role; Social roles; Structural signatures; Word frequency",SocIndex,10,,,,,,,
1532,journalArticle,2023.0,"Matuszewski, Paweł","How to prepare data for the automatic classification of politically related beliefs expressed on Twitter? The consequences of researchers' decisions on the number of coders, the algorithm learning procedure, and the pre-processing steps on the performance of supervised models",Quality & Quantity,,https://ezproxy.lib.utexas.edu/login?url=https://search.ebscohost.com/login.aspx?direct=true&db=sih&AN=161607110&site=ehost-live,"Due to the recent advances in natural language processing, social scientists use automatic text classification methods more and more frequently. The article raises the question about how researchers' subjective decisions affect the performance of supervised deep learning models. The aim is to deliver practical advice for researchers concerning: (1) whether it is more efficient to monitor coders' work to ensure a high quality training dataset or have every document coded once and obtain a larger dataset instead; (2) whether lemmatisation improves model performance; (3) if it is better to apply passive learning or active learning approaches; and (4) if the answers are dependent on the models' classification tasks. The models were trained to detect if a tweet is about current affairs or political issues, the tweet's subject matter and the tweet author's stance on this. The study uses a sample of 200,000 manually coded tweets published by Polish political opinion leaders in 2019. The consequences of decisions under different conditions were checked by simulating 52,800 results using the fastText algorithm (DV: F1-score). Linear regression analysis suggests that the researchers' choices not only strongly affect model performance but may also lead, in the worst-case scenario, to a waste of funds. [ABSTRACT FROM AUTHOR]",Big data; Content analysis; Natural language processing; Machine learning; Trend setters; Deep learning; Social scientists; Supervised learning; Automatic classification; Text classification,SocIndex,0,,,,,,,
1533,journalArticle,2022.0,"Yum, Seungil",Social networks and spatial-temporal analyses for winter storm Jupiter in the US in 2017.,Quality & Quantity,,https://ezproxy.lib.utexas.edu/login?url=https://search.ebscohost.com/login.aspx?direct=true&db=sih&AN=158238330&site=ehost-live,"This study sheds new light on understanding human sentiment for Winter storm Jupiter according to the whole US states and different periods based on qualitative and quantitative analyses. This study finds that Twitter users upload their tweets to share important messages for the winter storm, such as weather changes and road conditions. Next, some people think that governments use the winter storm to move people's attention from the serious problems in their life to the weather issue. Third, people are highly interested in a temporary school or workplace closing and weather forecast channels in the winter storm week. Fourth, tweets have the most frequent keywords, such as day, ice, and today, which are related to the weather during the winter storm. Lastly, the spatial pattern of the proportion of tweets is differentiated by regions and periods. [ABSTRACT FROM AUTHOR]",Twitter; Social network analysis; Jupiter; Qualitative analysis; Quantitative analysis; School closings; Weather forecasting; Winter storm; Winter storms,SocIndex,0,,,,,,,
1534,journalArticle,2016.0,"Cerchiello, Paola; Giudici, Paolo",How to measure the quality of financial tweets.,Quality & Quantity,,https://ezproxy.lib.utexas.edu/login?url=https://search.ebscohost.com/login.aspx?direct=true&db=sih&AN=115928317&site=ehost-live,"Twitter text data may be very useful to evaluate from a different perspective financial tangibles, such as share prices, as well as intangible assets, such as company reputation. While twitter data are becoming widely available to researchers, methods aimed at selecting reliable twitter data are, to our knowledge, not yet available. To overcome this problem, and allow to employ twitter data for descriptive and predictive purposes, in this contribution we propose an effective statistical method that formalises and extends a quality index employed in the context of the evaluation of academic research, the h index, renamed T index. Our proposal will be tested on a list of twitterers described by the Financial Times as 'the top financial tweeters to follow', for the year 2013. Using our methodology we rank these twitterers and provide confidence intervals to decide whether they are significantly different. Moreover through a sentiment analysis, we employ the twitters content to estimate graphical models useful in the context of financial systemic risk. To this aim we focus on the Italian bank system and we show how listed banks are connected on the basis of tweets data. [ABSTRACT FROM AUTHOR]",Big data; Twitter (Web resource); Quantitative research; Economic research; Financial Times (Newspaper); h index; Monte Carlo methods; Stock prices; Systemic risk modeling,SocIndex,24,,,,,,,
1535,journalArticle,2014.0,"Kim, Minjeong; Heo, Yun-Cheol; Choi, Seong-Cheol; Park, Han",Comparative trends in global communication networks of #Kpop tweets.,Quality & Quantity,,https://ezproxy.lib.utexas.edu/login?url=https://search.ebscohost.com/login.aspx?direct=true&db=sih&AN=97287280&site=ehost-live,"This exploratory study is designed to provide an in-depth understanding of the communication world that Twitter mediates in the context of global conversations centering on the topic of Korean pop music (Kpop). Drawing on the theoretical framework of the duality of media, this study proposes that the multifaceted communication world that Twitter mediates can be understood as a result of interactions between Twitter users and the structure of Twitter. We collected all Tweets including the hashtag #kpop from November 9, 2011 to February 15, 2012, and then applied the webometric technique to visualize the #kpop Twitter networks across various regions of the world. We examined the use of URLs and hashtags in #kpop Tweets and found that Twitter use varied across regions, forming various communication networks. The results suggest that Twitter's technological design can shape communication patterns as well as structures. [ABSTRACT FROM AUTHOR]",Twitter (Web resource); Webometrics; Comparative studies; Comparative trend; International communication; Korean pop music; Kpop; Uniform Resource Locators,SocIndex,26,,,,,,,
1536,journalArticle,2015.0,"Xu, Weiai; Chiu, I-Hsuan; Chen, Yixin; Mukherjee, Tanuka",Twitter hashtags for health: applying network and content analyses to understand the health knowledge sharing in a Twitter-based community of practice.,Quality & Quantity,,https://ezproxy.lib.utexas.edu/login?url=https://search.ebscohost.com/login.aspx?direct=true&db=sih&AN=103122594&site=ehost-live,"We utilize network and content analyses to examine the health-related conversations via Twitter hashtags. The study is an extension of the Leveraging Internet for Knowledge Sharing model to the new Twitter context. The findings show that the conversations involve the themes of knowledge sharing, nurturing relationship (community), and activism/advocacy/promotion (action). The conversation networks are decentralized, with advocates, healthcare providers, and average individuals being the central participants. Conversations flow most frequently between participants of the same healthcare roles, yet there is a considerable amount of conversations from healthcare providers to average consumers, and from average consumers to media. It is also noted that most conversations are not continuous or reciprocal. The findings and their implications are discussed in relation to the characteristics of communities of practice. [ABSTRACT FROM AUTHOR]",Social media; Twitter (Web resource); Twitter; Content analysis; Health; Network analysis; Information sharing; Hashtag; Community of practice; Decentralization in management; Leveraging internet for knowledge sharing; Medical informatics; Webometric,SocIndex,105,,,,,,,
1537,journalArticle,2015.0,"Nam, Yoonjae; Lee, Yeon-Ok; Park, Han","Measuring web ecology by Facebook, Twitter, blogs and online news: 2012 general election in South Korea.",Quality & Quantity,,https://ezproxy.lib.utexas.edu/login?url=https://search.ebscohost.com/login.aspx?direct=true&db=sih&AN=100905761&site=ehost-live,"This study aimed to provide an empirical and analytical account of online information flow and web ecology in four platforms around the 2012 general election in South Korea. The study quantitatively examined the interrelationship of web ecology among relevant platforms-including online news, blogs, Twitter and Facebook-during election campaigns. In order to quantify the current political situations, this study employed network analysis and the model fitting method with co-occurrence web visibility data of political parties and their leaders in four platforms. The findings demonstrated to what extent web ecologies on four different online platforms during the given election reflect the country's political situation. Comparing network centralizations across platforms, results showed that online news was the least biased media and Twitter was the most biased with the highest centralization scores. Although both the ruling party and the major opposition party-including the leaders of those two parties-had higher degree centrality scores than minor parties and their leaders in all platforms, some distinct features were observed in Twitter and Facebook due to their attributes. In addition, regressions and their residuals confirmed that web ecologies in four platforms, in terms of degree centrality, had been linearly expanded over time and showed their individual characteristics. [ABSTRACT FROM AUTHOR]",Practical politics; Social media; Twitter (Web resource); Twitter; Facebook (Web resource); Online social networks; Facebook; Webometrics; South Korea; Empirical research; Blog; Communication Network; Election; Korea; Online news; Social Network analysis; Webecology,SocIndex,19,,,,,,,
1538,journalArticle,2014.0,"Kim, Daejoong; Kim, Jang-Hyun; Nam, Yoonjae","How does industry use social networking sites? An analysis of corporate dialogic uses of Facebook, Twitter, YouTube, and LinkedIn by industry type.",Quality & Quantity,,https://ezproxy.lib.utexas.edu/login?url=https://search.ebscohost.com/login.aspx?direct=true&db=sih&AN=97287286&site=ehost-live,"This study examines the corporate dialogic uses of four types of social networking sites (SNSs) (Facebook, Twitter, YouTube, and LinkedIn) with the public and their differences by industry type. The results suggest that corporations have integrated SNS uses, and use SNSs in different ways according to the characteristics and purposes provided by each SNS. In most cases, retailers and communications and transportation companies actively use SNSs and frequently interact with the public. In addition, Facebook was the leading tool for the dialogic feedback loop, as the dialogic interaction index of Facebook was much higher than that of Twitter. [ABSTRACT FROM AUTHOR]",Social networks; Twitter; Communication; Facebook (Web resource); Disclosure; Facebook; Dialogic interaction; Dialogic theory (Communication); Industrial differences; Retail industry; Social Networking Service; Transportation industry,SocIndex,121,,,,,,,
1539,journalArticle,2014.0,"Yoon, Ho; Park, Han",Strategies affecting Twitter-based networking pattern of South Korean politicians: social network analysis and exponential random graph model.,Quality & Quantity,,https://ezproxy.lib.utexas.edu/login?url=https://search.ebscohost.com/login.aspx?direct=true&db=sih&AN=93439261&site=ehost-live,"This paper examines the Twitter networking pattern of 'following' and 'mention' relationships between South Korean politicians. The data were obtained from the Twitter profiles of Korea's national assemblymen and the most influential political figures. We conducted social network techniques including exponential random graph model and a regression method. The results suggest that these politicians employ two different strategies to establish relationships with other politicians on Twitter. One is 'following' other politicians as a social ritual based on dyadic reciprocity, and the other is to 'mention' other politicians as asymmetric political support based on the public popularity of their peers on Twitter. [ABSTRACT FROM AUTHOR]",Twitter (Web resource); Twitter; Social network analysis; Politicians; Online social networks; Regression analysis; South Korea; Dyadic communication; Exponential random graph model; Political support; Politician; Random graphs; Social ritual,SocIndex,55,,,,,,,
