165,866,journalArticle,2011.0,"Ampofo, Lawrence; Anstead, Nick; O'Loughlin, Ben","TRUST, CONFIDENCE, AND CREDIBILITY.","Information, Communication & Society",,https://ezproxy.lib.utexas.edu/login?url=https://search.ebscohost.com/login.aspx?direct=true&db=sih&AN=63627255&site=ehost-live,"This paper explores how citizen-users think and communicate about public opinion polling through an analysis of tweets published during and just after the 2010 UK General Election leaders' debate broadcast on Sky News on 22 April 2010, the second of three debates. For those who comment on events in real time through social media such as Twitter, a category we call the ‘viewertariat’, this event was notable for Sky News's immediate coverage of a YouGov poll that seemed discrepant. Indeed, within an hour of the end of the debate, various mainstream media published a number of polls apparently at odds with each other. Such discrepancies opened a space for lay theories to emerge about relationships between political parties, media, polling firms, and the wider public itself. Individuals were pushed to find explanations and quick to publish them in a public assembly of views. Analysis of these data illuminates not just what people think, but how they think about long-term concerns of scholars and practitioners of politics and political communication, such as credibility, trust and power, and how citizens manage expectations during events where the outcome is uncertain. Accounting for viewertariat behaviour develops recent research on mediatized politics in important ways. First, we find some viewertariat members performing a lay tutelage role, providing information and explanations about polling and elections to fellow citizens who express confusion. This indicates the continued importance of informed public discussion to some citizens. Second, we find a blurring of elite/non-elite interactions alongside persistent theories about elite conspiracies. [ABSTRACT FROM AUTHOR]",Social networks; United Kingdom; Elections; Public opinion polls; politics; media studies; Web 2.0; social networking; Truthfulness & falsehood; Internet & politics; e-democracy; Teledemocracy,SocIndex,0,,,,,,,
166,867,journalArticle,2013.0,"Skovsgaard, Morten; Van Dalen, Arjen",DODGING THE GATEKEEPERS?,"Information, Communication & Society",,https://ezproxy.lib.utexas.edu/login?url=https://search.ebscohost.com/login.aspx?direct=true&db=sih&AN=87844700&site=ehost-live,"Although politicians, scholars and campaigners claim that social media such as Facebook and Twitter profoundly change election campaigns, still little is known about the place of social media in the overall campaign mix and its use compared to traditional campaigning channels like the mass media. Cluster analysis of a representative survey among the candidates in the 2011 parliamentary election in Denmark shows that the candidates can be divided into three groups with different campaign mixes: a group which mainly communicates through the traditional mass media, a group which emphasizes social media, and a group which puts low emphasis on media in their campaign. The place of social media in the campaign mix of Danish candidates can be explained by access to the mainstream media and incentives for individual candidates. Traditional media remain the most important communication channel in the Danish campaign, but primarily for candidates who are newsworthy due to their experience and incumbency status. These candidates use social media to generate coverage in the traditional mass media. Challengers and less experienced candidates are more likely to use social media to compensate for lack of attention from the mainstream media, in particular when they are involved in intra-party competition. It is concluded that social media are integrated into Danish campaign mix according to the incentive structure of the electoral system and the media logic which characterizes modern campaigns. [ABSTRACT FROM AUTHOR]",Twitter; social media; Political communication; politicians; Facebook; election; Social media & politics; Election of legislators; campaigning; Internet in political campaigns; Denmark; Mass media -- Political aspects,SocIndex,0,,,,,,,
167,879,journalArticle,2017.0,"Bucher, Taina",The algorithmic imaginary: exploring the ordinary affects of Facebook algorithms.,"Information, Communication & Society",,https://ezproxy.lib.utexas.edu/login?url=https://search.ebscohost.com/login.aspx?direct=true&db=sih&AN=118835138&site=ehost-live,"This article reflects the kinds of situations and spaces where people and algorithms meet. In what situations do people become aware of algorithms? How do they experience and make sense of these algorithms, given their often hidden and invisible nature? To what extent does an awareness of algorithms affect people's use of these platforms, if at all? To help answer these questions, this article examines people's personal stories about the Facebook algorithm through tweets and interviews with 25 ordinary users. To understand the spaces where people and algorithms meet, this article develops the notion of the algorithmic imaginary. It is argued that the algorithmic imaginary – ways of thinking about what algorithms are, what they should be and how they function – is not just productive of different moods and sensations but plays a generative role in moulding the Facebook algorithm itself. Examining how algorithms make people feel, then, seems crucial if we want to understand their social power. [ABSTRACT FROM PUBLISHER]",Power (Social sciences); Algorithms; affect; Algebraic geometry; Algebraic spaces; Algorithm; algorithmic imaginary; experience; social power,SocIndex,1016,,,,,,,
168,886,journalArticle,2014.0,"Agarwal, Sheetal D.; Barthel, Michael L.; Rost, Caterina; Borning, Alan; Bennett, W. Lance; Johnson, Courtney N.",Grassroots organizing in the digital age: considering values and technology in Tea Party and Occupy Wall Street.,"Information, Communication & Society",,https://ezproxy.lib.utexas.edu/login?url=https://search.ebscohost.com/login.aspx?direct=true&db=sih&AN=94573691&site=ehost-live,"Power dynamics shape, and are shaped by, the tools used by participants in social movements. In this study we explore the values, attitudes, and beliefs of Tea Party and Occupy Wall Street stakeholders as they relate to their use of technology. This multi-method study applies the lens of value sensitive design [VSD; Friedman, B. (Ed.) (1997).Human values and the design of computer technology(vol. 72). Cambridge: Cambridge University Press] to examine stakeholder values and sites of value tension. We contextualize our findings with qualitative observation of how these values are reflected in each organization's online spaces, including Facebook, Twitter, and key organizational websites, as well as private spaces such as email. We found liberty, the value most mentioned by Tea Party members, was not reflected in the movement's organizational websites and Facebook pages, where user autonomy is frequently undermined. However, the Occupy value of equality is supported in the movement's web presence. We also found a set of shared central values – privacy and security, inclusion, and consensus – underlying both Tea Party and Occupy's approach to organization and participation. Value tensions around privacy and inclusion emerged for both groups, as some members opted not to use these tools due to security concerns and leaders struggled to adapt their communication strategies accordingly. This study provides insight into the adoption and contestation of different technological tools within grassroots social movements, how those decisions are shaped by core values, and how conflicts over the use of digital tools can result from tension between how different stakeholders prioritize those values. [ABSTRACT FROM AUTHOR]",Social psychology; digital media; Collective action; Digital media; Digital communications; ICTs; Occupy; collective action; Computer engineering; Computer industry; Tea Party; value-sensitive design,SocIndex,0,,,,,,,
169,889,journalArticle,2013.0,"Klinger, Ulrike",MASTERING THE ART OF SOCIAL MEDIA.,"Information, Communication & Society",,https://ezproxy.lib.utexas.edu/login?url=https://search.ebscohost.com/login.aspx?direct=true&db=sih&AN=87844695&site=ehost-live,"Online communication has become a central part in the communication repertoires of political actors in Western mass democracies. In Switzerland, where broadband, internet use, and media literacy are amongst the highest in the world, all major political parties run their own website and are active on social media. This article seeks to show how Swiss political parties deal with social media, how they implement it and how they use social media. The study builds on empirical data from a structural analysis of party websites, the official Facebook sites, and Twitter feeds. These social media sites were analysed for their resonance, update frequency, and thematic clusters focusing on information, mobilization, and participation. A weekly assessment of the user numbers illustrates the development of user resonance throughout the 2011 election year. While political parties claim to appreciate the dialogue and mobilization potentials of social media, they mainly use social media as an additional channel to spread information and electoral propaganda. The overall resonance is still on a very low level. The data seem to sustain the normalization hypothesis, as larger parties with more resources and voters are better able to generate effective communication and to mobilize online than small and marginal parties. [ABSTRACT FROM AUTHOR]",Social media; Twitter (Web resource); Political participation; Political parties; social media; Facebook (Web resource); Switzerland; political parties; Resonance,SocIndex,0,,,,,,,
170,891,journalArticle,2012.0,"Franklin, M. I.",KEY THINKERS PAST AND PRESENT : SERIES EDITOR'S NOTE.,"Information, Communication & Society",,https://ezproxy.lib.utexas.edu/login?url=https://search.ebscohost.com/login.aspx?direct=true&db=sih&AN=71754821&site=ehost-live,"An introduction is presented in which the editor discusses various published within on topics including the next generation of Internet-based technologies, cybernetics, phenomenology, feminism and critical pedagogy and Twitter revolution.",Internet; Cybernetics,SocIndex,-,,,,,,,
171,893,journalArticle,2011.0,"Ward, Janelle",REACHING CITIZENS ONLINE.,"Information, Communication & Society",,https://ezproxy.lib.utexas.edu/login?url=https://search.ebscohost.com/login.aspx?direct=true&db=sih&AN=63627251&site=ehost-live,"Keeping in mind the potential consequences that digital communication may hold for democratic societies, this research focuses on better understanding the web presence of UK youth organizations. It is interesting to examine how such organizations tie their theoretical conception of citizenship (their ‘offline’ philosophy) to the choices they make about web presence (their ‘online’ structure). Web presence – in this case, websites but also the use of Web 2.0 applications – can aim to provide information and promote participation, but can also encourage a particular view of citizenship and use certain forms of communication to advance this view. This paper focuses on seven youth organizations that embrace either a more conventional or non-conventional view of citizenship and have expanded their web presence from a dedicated website into Web 2.0, particularly social networking sites. First, I will summarize interview findings with web producers to better understand the philosophy behind web presence of the youth organization, along with a look at official website content. Second, I will provide a first look at how such organizations have adapted to Web 2.0, specifically via Facebook and Twitter. This paper contributes to an understanding of how online spaces and in particular the adaptation to Web 2.0 reflect offline views towards citizenship, a particularly important focus in an environment of increasing concern as to how to reach youth via technology. [ABSTRACT FROM AUTHOR]",United Kingdom; Computer network resources; politics; ICTs; Web 2.0; e-democracy; computer-mediated communication; Citizenship; Telematics; Youth societies & clubs; Teledemocracy; young people,SocIndex,0,,,,,,,
172,894,journalArticle,2011.0,"Bodle, Robert",REGIMES OF SHARING.,"Information, Communication & Society",,https://ezproxy.lib.utexas.edu/login?url=https://search.ebscohost.com/login.aspx?direct=true&db=sih&AN=59530486&site=ehost-live,"This paper explores the values, characteristics, and conditions of interoperability provided by Open Application Programming Interfaces (Open APIs) used by Facebook to identify underlying tensions that may challenge the sustainability of the Web as an open, secure, and liberating communication space. Interoperability between major online social network services holds great potential for linking a broad range of platforms, spaces, and people together in exciting new ways. Open APIs support interoperability by providing the tools to share data used to develop popular and useful Web applications, achieve seamless integration of social media services, and give rise to mutually beneficial third-party developer ecosystems that build on top of social media platforms. Yet, while Open APIs provide new ways of sharing and participating, they also provide a means for companies like Facebook to achieve market dominance, as well as undermine privacy, data security, contextual integrity, user autonomy and freedom. This paper examines interoperability enabled by Open APIs among competing online services (Facebook, Google, YouTube, MySpace and Twitter) to identify the tenuous push and pull of competition and cooperation. The author provides a summary and analysis of Facebook's Open API releases over the last five years, to determine the underlying conditions for sharing and identify the social implications of their technical features. This paper concludes by suggesting ways that users can make more informed decisions about their sharing and perhaps change the underlying conditions of interoperability all together by developing more secure and user controllable social networks, Open APIs, and online applications. [ABSTRACT FROM AUTHOR]",Online social networks; Online information services; Facebook; social networks; YouTube LLC; political economy; Google Inc.; Information services; Open APIs; interoperability; sustainability,SocIndex,0,,,,,,,
173,897,journalArticle,2016.0,"Tantarangsee, Chaiwat",The Impact of Social Media on Students' Engagement with English outside the Classroom.,International Academic Conference on Social Sciences,,https://ezproxy.lib.utexas.edu/login?url=https://search.ebscohost.com/login.aspx?direct=true&db=sih&AN=123298765&site=ehost-live,"The purposes of this study are to identify types of social media tools most frequently used by 3rd year English major students, and to study the students' engagements with English outside the classroom. Samples include 78 - 3rd year students, English language program, faculty of Humanities and Social Sciences, Suan Sunandha Rajabhat University, Bangkok, Thailand. A Likert Scale Questionnaire is used to collect the data, and the statistics employed include percentage, mean, and Standard Deviation. The research findings point out that the most frequently used social media tool is Line followed by Facebook, YouTube, and Twitter respecttively. Moreover, students' engagements with English outside the classroom accomplish a range of communicative functions in English in high level taking about 6-8 hours per day. 7 functions found in high level with the highest mean score of such engagements include 1) watching cartoon with English sound track from websites followed by 2) reading articles in English form journals and magazines, 3) watching TV programs in English from TV, 4) using online dictionaries to solve linguistic problems, 5) reading comments in English from blogs and forum based, 6) watching entertainment and documentaries in English from online medias, and 7) reading news in English from printed newspapers respectively. It is noticeable that 4 out of the 7 functions found in high level are ca-rried out by social media tools. However, 2 functions found in low level taking less than 2 hours/day inc-lude 1) listening to music in English from CD or radio and 2) using printed English-English dictionary to solve linguistic problems. [ABSTRACT FROM AUTHOR]",Social sciences; Linguistics; Classroom environment; English language education; Likert scale,SocIndex,-,,,,,,,
174,899,journalArticle,2011.0,"Hiles, Timothy; Staples, Cary",An Integrated Information System for the Disabled.,"International Journal of Diversity in Organisations, Communities & Nations",,https://ezproxy.lib.utexas.edu/login?url=https://search.ebscohost.com/login.aspx?direct=true&db=sih&AN=65534415&site=ehost-live,"Most of us would agree with Francis Bacon's oft-repeated sentiment: ""knowledge is power."" But to the physically disabled, knowledge is more appropriately identified with empowerment. That is a fine distinction but one that has profound implications. The former implies control over others; the latter conveys control over ones own life. Ramps, curb cuts, accessible entrances and bathrooms, public transportation, Braille signs, and crosswalks for the hearing impaired are all significant strides toward inclusion mandated by those in power. They make mobility possible for those with diverse physical disabilities. They do not necessarily empower; for that to occur a person must have knowledge of the enabling adaptation. Will there be curb cuts along my path? Will the building's entrance be accessible? Which bathrooms are accessible? Will the elevator be in service? Questions like these are addressed daily by those with disabilities who endeavor to go about their day unencumbered with the matter-of-fact attitude of the physically abled. At the University of Tennessee we are proposing a suite of integrated information systems that would provide a variety of archival resources as well as real-time information for the disabled in need of navigation assistance. This system would leverage existing technology, such as Google maps, GPS navigation, Twitter and other internet resources to develop site-specific, real-time resources that address a variety of mobility issues. [ABSTRACT FROM AUTHOR]",Technology; Global Positioning System; Information technology; Self-efficacy; Social integration; Theory of knowledge; Accessibility; Accessible design; Disability; Inclusion; Mobility; Mobility of people with disabilities,SocIndex,-,,,,,,,
175,909,journalArticle,2017.0,"Zavattaro, Staci M.; Fay, Daniel L.",SOCIAL MEDIA IN STATE LOTTERIES: EXPLORING THE ROLE OF TECHNOLOGY IN PROGRAM MARKETING.,International Journal of Organization Theory & Behavior (PrAcademics Press),,https://ezproxy.lib.utexas.edu/login?url=https://search.ebscohost.com/login.aspx?direct=true&db=sih&AN=123323314&site=ehost-live,"State-sponsored lotteries are adopted to raise funds for state programs. As such, there is a public mission within these organizations; however, most operate like private companies, thus shifting the organizational ethos to profit maximization. Much research on social media focuses on federal and local government agencies. In this paper, we explore the role of social media in lottery program marketing. Through an analysis of random lotteries on Facebook, Twitter, YouTube, and Instagram, we find: 1) a focus on aspirational marketing to promote the lottery as a business entity through its products and 2) increased dialogue with followers (i.e. customers) compared to other public agencies. This is a shift in how public organizations traditionally use the social tools, showing there can be a balance between marketing and dialogue. [ABSTRACT FROM AUTHOR]",Twitter (Web resource); Facebook (Web resource); YouTube (Web resource); Social media in business; Lottery advertising,SocIndex,-,,,,,,,
176,911,journalArticle,2019.0,"Tufekci, Zeynep","A Response to Johanne Kübler's A Review of Zeynep Tufekci – Twitter and Tear Gas: The Power and Fragility of Networked Protest (2017, New Haven: Yale University Press).","International Journal of Politics, Culture & Society",,https://ezproxy.lib.utexas.edu/login?url=https://search.ebscohost.com/login.aspx?direct=true&db=sih&AN=137992093&site=ehost-live,"A Response to Johanne Kübler's A Review of Zeynep Tufekci - Twitter and Tear Gas: The Power and Fragility of Networked Protest (2017, New Haven: Yale University Press) It was clear from the first moment of the so-called Arab Spring were intertwined with technological changes that were taking place - a few young companies like Twitter and Facebook, plus all the tools of digital connectivity: smartphones in many hands. Facebook, Twitter and Google executives have been called to testify in the USA: Congress and Europe enacted privacy legislations. Technology firmsshape political communication: The work of microsoft,Facebook, Twitter, and google with campaigns during the2016 U.S. presidential cycle. [Extracted from the article]",Political communication; Social groups; Tear gas; Yale University Press,SocIndex,0,,,,,,,
177,912,journalArticle,2019.0,"Kübler, Johanne","A Review of Zeynep Tufekci—Twitter and Tear Gas: the Power and Fragility of Networked Protest (2017, New Haven: Yale University Press).","International Journal of Politics, Culture & Society",,https://ezproxy.lib.utexas.edu/login?url=https://search.ebscohost.com/login.aspx?direct=true&db=sih&AN=137992092&site=ehost-live,"A Review of Zeynep Tufekci - Twitter and Tear Gas: the Power and Fragility of Networked Protest (2017, New Haven: Yale University Press) Through her comparison of contemporary movements with historical campaigns like the civil rights movement, Tufekci underscores that concurrent to the properties of digital tools, which determine how activists can use them to their benefit, the internal make-up of movements beget certain trajectories. In fact, the key online actors in the Arab World in 2011 had been online activists for many years and were part of activist networks facilitated organizations such as the blogger community Global Voices, who brought like-minded activists from across the region together, for example via their yearly conference (p.15). As Tufekci notes, ""to be ready to play key roles in movements that emerge quickly, activists must maintain themselves as activists over the years even when there is little protest activity or overt dissent"" (p.15). [Extracted from the article]",Tear gas; Yale University Press; Anti-globalization movement; Civil rights movements; Labor union members,SocIndex,0,,,,,,,
178,919,journalArticle,2020.0,"Perriam, Jessamy; Birkbak, Andreas; Freeman, Andy",Digital methods in a post-API environment.,International Journal of Social Research Methodology,,https://ezproxy.lib.utexas.edu/login?url=https://search.ebscohost.com/login.aspx?direct=true&db=sih&AN=142313286&site=ehost-live,"Qualitative and mixed methods digital social research often relies on gathering and storing social media data through the use of APIs (Application Programming Interfaces). In past years this has been relatively simple, with academic developers and researchers using APIs to access data and produce visualisations and analysis of social networks and issues. In recent years, API access has become increasingly restricted and regulated by corporations at the helm of social media networks. Facebook (the corporation) has restricted academic research access to Facebook (the social media platform) along with Instagram (a Facebook-owned social media platform). Instead, they have allowed access to sources where monetisation can easily occur, in particular, marketers and advertisers. This leaves academic researchers of digital social life in a difficult situation where API related research has been curtailed. In this paper we describe some rationales and methodologies for using APIs in social research. We then introduce some of the major events in academic API use that have led to the prohibitive situation researchers now find themselves in. Finally, we discuss the methodological and ethical issues this produces for researchers and, suggest some possible steps forward for API related research. [ABSTRACT FROM AUTHOR]",Social media; Social networks; Twitter; Social network analysis; Facebook; Social media in education; Social science research; ethics; Social network theory; Social media in business; Netvizz; APIs; Digital methods; University research; web scraping,SocIndex,0,,,,,,,
