774,journalArticle,2018.0,"Molyneux, Logan; Holton, Avery; Lewis, Seth C.","How journalists engage in branding on Twitter: individual, organizational, and institutional levels.","Information, Communication & Society",,https://ezproxy.lib.utexas.edu/login?url=https://search.ebscohost.com/login.aspx?direct=true&db=sih&AN=130244143&site=ehost-live,"In a social media age, branding is an increasingly visible aspect of identity construction online. For media professionals generally and journalists especially, branding on spaces such as Twitter reveals the complicated set of forces confronting such public-facing actors as they navigate tensions between personal disclosure for authenticity and professional decorum for credibility, and between establishing one’s own distinctiveness and promoting one’s employer or other stakeholders. While studies have begun to reveal what journalists say about branding, they have yet to provide a broad profile of what they do. This study takes up that challenge through a content analysis of the Twitter profiles and tweets of a representative sample of 384 U.S. journalists. We focus on the extent of branding practices; the levels at which such branding occurs, whether to promote one’s self (individual), one’s news organization (organizational), or the journalism profession at large (institutional); and how other social media practices may be related to forms of journalistic branding. Results suggest that branding is now widely common among journalists on Twitter; that branding occurs at all three levels but primarily at the individual and organizational levels, with organizational branding taking priority; and that time on Twitter is connected with more personal information being shared. [ABSTRACT FROM AUTHOR]",Social media; Twitter (Web resource); identity; social media; Journalism; Branding (Marketing); brand enactment; Branding; journalistic branding; journalistic roles; Truthfulness & falsehood,SocIndex,161,,,,,,,
775,journalArticle,2019.0,"Bolsover, Gillian; Howard, Philip","Chinese computational propaganda: automation, algorithms and the manipulation of information about Chinese politics on Twitter and Weibo.","Information, Communication & Society",,https://ezproxy.lib.utexas.edu/login?url=https://search.ebscohost.com/login.aspx?direct=true&db=sih&AN=139504183&site=ehost-live,"A 2016 review of literature about automation, algorithms and politics identified China as the foremost area in which further research was needed because of the size of its population, the potential for Chinese algorithmic manipulation in the politics of other countries, and the frequency of exportation of Chinese software and hardware. This paper contributes to the small body of knowledge on the first point (domestic automation and opinion manipulation) and presents the first piece of research into the second (international automation and opinion manipulation). Findings are based on an analysis of 1.5 million comments on official political information posts on Weibo and 1.1 million posts using hashtags associated with China and Chinese politics on Twitter. In line with previous research, little evidence of automation was found on Weibo. In contrast, a large amount of automation was found on Twitter. However, contrary to expectations and previous news reports, no evidence was found of pro-Chinese-state automation on Twitter. Automation on Twitter was associated with anti-Chinese-state perspectives and published in simplified Mandarin, presumably aimed at diasporic Chinese and mainland users who 'jump the wall' to access blocked platforms. These users come to Twitter seeking more diverse information and an online public sphere but instead they find an information environment in which a small number of anti-Chinese-state voices are attempting to use automation to dominate discourse. Our understanding of public conversation on Twitter in Mandarin is extremely limited and, thus, this paper advances the understanding of political communication on social media. [ABSTRACT FROM AUTHOR]",Practical politics; Twitter; Political communication; Automation; Propaganda; bots; China; computational propaganda; Literature reviews; politics; Public sphere; Weibo,SocIndex,108,,,,,,,
776,journalArticle,2021.0,"Harmer, Emily; Southern, Rosalynd",Digital microaggressions and everyday othering: an analysis of tweets sent to women members of Parliament in the UK.,"Information, Communication & Society",,https://ezproxy.lib.utexas.edu/login?url=https://search.ebscohost.com/login.aspx?direct=true&db=sih&AN=153311273&site=ehost-live,"Online abuse directed at female politicians has the potential to present barriers to the political representation of women in the digital age. Previous research has produced mixed results, with some finding little difference between the extent of abuse received by male and female MPs, while others found that women and minority groups are subjected to specific kinds of abuse. While straightforward examples of abuse and discrimination are easy to identify, categorise and quantify, tweets which include more subtle microaggressions that position women and minority MPs as unqualified and unwelcome in politics deserve attention. This research therefore employs a qualitative thematic analysis of 11,543 tweets sent to UK members of Parliament. The analysis identified four themes: 1. 'overt online abuse', 2. 'everyday sexism and othering', 3. 'dismissing discrimination and victim blaming', and 4. 'claiming reverse discrimination'. We argue that these digital microaggressions serve as constant reminders of the marginalised status of female representatives, and women of colour specifically, and should be conceptualised as forms of psychological and semiotic violence that reconstitute online political spaces as a hostile environment for women and may discourage women from seeking political office or compel women representatives to leave. Digital microaggressions may therefore be as damaging to women's democratic representation as outright abuse. [ABSTRACT FROM AUTHOR]",United Kingdom; Microblogs; social media; Virtual communities; Gender; online harassment; Legislators; politics; race; Minorities; Microaggressions; intersectionality,SocIndex,12,,,,,,,
777,journalArticle,2018.0,"Hermida, Alberto; Hernández-Santaolalla, Víctor",Twitter and video activism as tools for counter-surveillance: the case of social protests in Spain.,"Information, Communication & Society",,https://ezproxy.lib.utexas.edu/login?url=https://search.ebscohost.com/login.aspx?direct=true&db=sih&AN=126206214&site=ehost-live,"From a communication perspective, social movements of international significance such as the Arab Spring, Toronto G20, Spanish 15M or Occupy Wall Street have been characterized by the use of mobile communication and social media as tools for video activism and counter-surveillance against the abuse of power committed by the state forces. A representative case of this reality, which reached a high coverage and support in social media environment, can be found in the riots that took place in the Gamonal neighbourhood (Burgos, Spain) in January 2014. In this regard, this article focuses on the denunciation of police violence through video activism by Twitter users during the demonstrations across the country, applying a quantitative–qualitative mixed methodology. First, by means of a content analysis, a sample of 784 tweets linked to videos is analysed in order to identify the main topics and functions of the shared content. Second, a textual analysis of those linked videos of a violent nature recorded by witnesses in order to document police interventions is carried out. The prominent use of Twitter for distributing videos to denounce police violence stands out among the main findings, underlining the audiovisual exposure and ‘secondary visibility’ of the police officers. The results obtained also reinforce the idea of citizen empowerment through the development of an alternative form of journalism, as a practice to criticize the mainstream media coverage of the protests. Additionally, this article sheds light on the open debate about the relevance of social media to encourage citizen involvement in a face-to-face interaction. [ABSTRACT FROM AUTHOR]",Social media; Twitter (Web resource); Microblogs; Social movements; Police brutality; catopticon; citizen journalism; Counter-surveillance; police violence; witness video,SocIndex,71,,,,,,,
778,journalArticle,2017.0,"Ogan, Christine; Varol, Onur",What is gained and what is left to be done when content analysis is added to network analysis in the study of a social movement: Twitter use during Gezi Park.,"Information, Communication & Society",,https://ezproxy.lib.utexas.edu/login?url=https://search.ebscohost.com/login.aspx?direct=true&db=sih&AN=122728197&site=ehost-live,"As social movements relying on the weak ties found in social networks have spread around the world, researchers have taken several approaches to understanding how networks function in such instances as the Arab Spring. While social scientists have primarily relied on survey or content analysis methodology, network scientists have used social network analysis. This research combines content analysis with the automated techniques of network analysis to determine the roles played by those using Twitter to communicate during the Turkish Gezi Park uprising. Based on a network analysis of nearly 2.4 million tweets and a content analysis of a subset of 5126 of those tweets, we found that information sharing was by far the most common use of the tweets and retweets, while tweets that indicated leadership of the movement constituted a small percentage of the overall number of tweets. Using automated techniques, we experimented with coded variables from content analysis to compute the most discriminative tokens and to predict values for each variable using only textual information. We achieved 0.61 precision on identifying types of shared information. Our results on detecting the position of user in the protest and purpose of the tweets achieved 0.42 and 0.33 precision, respectively, illustrating the necessity of user cooperation and the shortcomings of automated techniques. Based on annotated values of user tweets, we computed similarities between users considering their information production and consumption. User similarities are used to compute clusters of individuals with similar behaviors, and we interpreted average activities for those groups. [ABSTRACT FROM AUTHOR]",Mass mobilization; Social movements; content analysis; connective action; social networks; Cultural movements; Gezi Park; Political development; Social criticism; user behavior; Value-added theory (Sociology),SocIndex,65,,,,,,,
779,journalArticle,2021.0,"Recuber, Timothy","Race, racism and mnemonic freedom in the digital afterlife.","Information, Communication & Society",,https://ezproxy.lib.utexas.edu/login?url=https://search.ebscohost.com/login.aspx?direct=true&db=sih&AN=149729508&site=ehost-live,"American public discourse is increasingly populated by the names of Black men and women killed by police, often because their deaths were caught on camera and footage of their deaths has circulated virally online. In this way they are doubly victimized, losing not only their lives but also the agency to define themselves and the ways they'd like to be remembered. At the same time, the lives of many Black victims of police violence have been commemorated using digital platforms, especially hashtags on Twitter. So what exactly does it mean to be remembered online in these contexts? To help answer this question, this article is built around a discourse analysis of 990 tweets from two such hashtags: #IfTheyGunnedMeDown and #IfIDieInPoliceCustody. In addition to pushing back against racist stereotypes and state violence, I argue that these two hashtags collect the digital claims to mnemonic freedom of thousands of Black people. The term mnemonic freedom, as I use it here, refers to the ability to ensure that the stories we tell about ourselves, and the morals and meanings of our lives, get remembered by others in the ways that we want. But more than simply that, these hashtags show how mnemonic freedom might be achieved collectively rather than individually. [ABSTRACT FROM AUTHOR]",Twitter; hashtags; Digital technology; Racism; Black Lives Matter movement; Police brutality; Black Lives Matter; Collective memory; Afterlife; digital afterlife,SocIndex,2,,,,,,,
780,journalArticle,2019.0,"Pond, Philip; Lewis, Jeff","Riots and Twitter: connective politics, social media and framing discourses in the digital public sphere.","Information, Communication & Society",,https://ezproxy.lib.utexas.edu/login?url=https://search.ebscohost.com/login.aspx?direct=true&db=sih&AN=132616777&site=ehost-live,"Social media technologies like Twitter are credited with enabling a new form of connective action, in which political movements coalesce and mobilise around hashtags, memes and personalised action frames. After the UK riots in 2011, citizen ‘broom armies’ took to the streets to clear up and repair damage. Different hashtags, including #RiotCleanUp and #OperationCupOfTea, were implicated in these movements. This paper questions connective action theory in this context. It seeks to respond to two criticisms of the connective approach, namely that connective action underplays differences between technologies and does not account sufficiently for cultural and ideological drivers of action. The paper combines an analysis of software systems, issue publics and discourse to giver a fuller account of connective politics during the riot clean-up movements. In doing so, it develops several metrics to advance understanding of digital communication systems, drawing attention to the roles that time and account status play in assembling meaning on Twitter. This analysis suggests that the clean-up movements were complex, discursive political acts, in which celebrity accounts played an influential role in framing discourse. Furthermore, the #RiotCleanUp hashtag credited with mobilising these groups is found to provide a less compelling explanation of action when compared against the more emotive but less noted #OperationCupOfTea. [ABSTRACT FROM AUTHOR]",Social media; Twitter (Web resource); Twitter; Social movements; Tags (Metadata); Digital communications; Political debates; social movements; connective action; ICTs; media studies,SocIndex,110,,,,,,,
781,journalArticle,2020.0,"Vicari, Stefania; Iannelli, Laura; Zurovac, Elisabetta",Political hashtag publics and counter-visuality: a case study of #fertilityday in Italy.,"Information, Communication & Society",,https://ezproxy.lib.utexas.edu/login?url=https://search.ebscohost.com/login.aspx?direct=true&db=sih&AN=144953139&site=ehost-live,"In 2016 the Italian health ministry launched the 'Fertility Day' campaign, aimed at tackling Italy's low birth rate. Under the accusation of delivering sexist and racist messages, the campaign became a trending topic on Twitter, and a protest was launched to be held during Fertility Day. By applying a combination of digital methods and visual content analysis to the #fertilityday Twitter stream, this paper contributes to existing research on the deliberative strength of political hashtag publics, with a particular focus on their power structures, communication patterns and visual content use. Findings on gatekeeping dynamics downsize optimistic views on the democratising potential of Twitter's socio-technical infrastructure as they point to the emergence of online satirical media and 'tweetstars' – along with mainstream news media– as main producers of spreadable content, with ordinary users only surfacing when traditional media elites and new satirical actors lack or lose interest in the debate. Results confirm that political hashtag publics follow acute event communication patterns, with users highly engaged in retweeting and referencing external material and visual content playing a key role in these gatewatching practices. The transient counter-visuality – or critical stance – of tweets with user-manipulated images, however, also suggests that the deliberative potential of these publics is not easily sustainable over time. [ABSTRACT FROM AUTHOR]",Italy; Twitter; Content analysis; Public demonstrations; Case studies; public sphere; Birth rate; Visual communication; Gatekeeping; Communication patterns; hashtag publics; visual data,SocIndex,20,,,,,,,
782,journalArticle,2018.0,"Quinlan, Stephen; Gummer, Tobias; Roßmann, Joss; Wolf, Christof",‘Show me the money and the party!’ - variation in Facebook and Twitter adoption by politicians.,"Information, Communication & Society",,https://ezproxy.lib.utexas.edu/login?url=https://search.ebscohost.com/login.aspx?direct=true&db=sih&AN=128928097&site=ehost-live,"Our study explores the adoption of Facebook and Twitter by candidates in the 2013 German Federal elections. Utilizing data from the German Longitudinal Election Study candidate survey fused with data gathered on the Twitter and Facebook use of candidates, we draw a clear distinction between Facebook and Twitter. We show that adoption of both channels is primarily driven by two factors: party and money. But the impact of each plays out differently for Facebook and Twitter. While the influence of money is homogenous for Facebook and Twitter with the more resources candidates have, the more likely they are to adopt, the effect is stronger for Facebook. Conversely, a party’s impact on adoption is heterogeneous across channels, a pattern we suggest is driven by the different audiences Facebook and Twitter attract. We also find candidates’ personality traits only correlate with Twitter adoption, but their impact is minimal. Our findings demonstrate that social media adoption by politicians is far from homogenous, and that there is a need to differentiate social media channels from one another when exploring motivations for their use. [ABSTRACT FROM AUTHOR]",Social media; Twitter (Web resource); Twitter; Politicians; Facebook (Web resource); Occupations; Facebook; politics; media studies; heterogeneity of social media,SocIndex,64,,,,,,,
783,journalArticle,2020.0,"Walter, Stefanie; Brüggemann, Michael",Opportunity makes opinion leaders: analyzing the role of first-hand information in opinion leadership in social media networks.,"Information, Communication & Society",,https://ezproxy.lib.utexas.edu/login?url=https://search.ebscohost.com/login.aspx?direct=true&db=sih&AN=141097048&site=ehost-live,"Theorizing information flows is at the heart of traditional communication theories such as the two-step flow of communication and the concept of opinion leadership. Social media have fundamentally altered how information reaches people. This study examines opinion leadership in social media networks and argues that opinion leaders may no longer need to rely on information provided by the media if they have access to first-hand information. To test this assumption empirically, we used data from the 2015 United Nations Climate Change Conference (COP21). Attendees of the conference had direct information about what was happening, which they were able to share live with their followers via social media. We used geo-located tweets to identify Twitter users who attended the COP21 summit. We then located these users in a data set of tweets that were collected based on the main conference hashtag (#COP21) and represent the wider social media debate on the conference. Our results, which are based on network analysis measures and Twitter user data, show that COP21 participants were more central actors compared to the average user in the network, and that they were more likely to have brokering positions. They were also more involved in the debate and received more attention from other users. We used automated content analysis to divide COP21 participants into different actor types and performed the analysis by actor group. The results show only minor differences across the actors and support the robustness of our analysis. [ABSTRACT FROM AUTHOR]",Social media; Social networks; Twitter; United Nations; social media; Trend setters; social networking; Leadership; opinion leadership; climate change; Climate change conferences; Communication studies,SocIndex,49,,,,,,,
784,journalArticle,2017.0,"Waisbord, Silvio; Amado, Adriana",Populist communication by digital means: presidential Twitter in Latin America.,"Information, Communication & Society",,https://ezproxy.lib.utexas.edu/login?url=https://search.ebscohost.com/login.aspx?direct=true&db=sih&AN=123602606&site=ehost-live,"In this paper, we analyze the uses of Twitter by populist presidents in contemporary Latin America in the context of the debates about whether populism truly represents a revolution in public communication – that is, overturning the traditional hierarchical model in favor of popular and participatory communication. In principle, Twitter makes it possible to promote the kind of interactive communication often praised in populist rhetoric. It offers a flattened communication structure in contrast to the top–down structure of the traditional legacy media. It is suitable for horizontal, unmediated exchanges between politicians and citizens. Our findings, however, suggest that Twitter does not signal profound changes in populist presidential communication. Rather, it represents the continuation of populism’s top–down approach to public communication. Twitter has not been used to promote dialogue among presidents and publics or to shift conventional practices of presidential communication. Instead, Twitter has been used to reach out the public and the media without filters or questions. It has been incorporated into the presidential media apparatus as another platform to shape news agenda and public conversation. Rather than engaging with citizens to exchange views and listen to their ideas, populists have used Twitter to harass critical journalists, social media users and citizens. Just like legacy media, Twitter has been a megaphone for presidential attacks on the press and citizens. It has provided with a ready-made, always available platforms to lash out at critics, conduct personal battles, and get media attention. [ABSTRACT FROM AUTHOR]",Social media; Twitter (Web resource); Twitter; United States; political communication; populism; Populism; Digital media; Political communication; presidential communication; Presidents of the United States; Public communication,SocIndex,227,,,,,,,
785,journalArticle,2017.0,"Chen, Wenhong; Tu, Fangjing; Zheng, Pei",A transnational networked public sphere of air pollution: analysis of a Twitter network of PM2.5 from the risk society perspective.,"Information, Communication & Society",,https://ezproxy.lib.utexas.edu/login?url=https://search.ebscohost.com/login.aspx?direct=true&db=sih&AN=122640718&site=ehost-live,"Drawing on digitaltrace data, publicly accessible government documents, and journalistic reports, this research integrates Beck’s risk society theory with digital media theories to examine the mediated process of risk definition and assessment of PM2.5 (particulate matters with a diameter less than 2.5 micrometers) in a networked public sphere. Network and content analysis of a PM2.5 Twitter network shows that political and professional elite remained the most powerful producers of risk definition. Established media played a key role, yet faced challenges from a variety of actors who disseminated and filtered information. Laypersons, while peripheral, actively interacted with elite and established media. The blurring geographic boundary in the PM2.5 Twitter network revealed an emerging transnational public sphere, which, however, was segregated by language. This research advances a layered understanding of the contingent, paradoxical media impact for social changes in a risk society. [ABSTRACT FROM AUTHOR]",Twitter (Web resource); Twitter; Digital media; network analysis; China; Public sphere; Air pollution; environment; networked public sphere; Particulate matter; PM2.5; risk society,SocIndex,54,,,,,,,
786,journalArticle,2022.0,"Han, Jing",Twitter: A Biography.,"Information, Communication & Society",,https://ezproxy.lib.utexas.edu/login?url=https://search.ebscohost.com/login.aspx?direct=true&db=sih&AN=159177093&site=ehost-live,"As Twitter grows, in the stage of contestation, the tensions between Twitter as both a platform and a business intensify. In the current media ecology, Twitter is sometimes perceived as a platform full of misinformation and disinformation. The platform biography approach enriches scholarship on how both cultures of use on Twitter and ""social media logics"" change. [Extracted from the article]",Social media; Twitter Inc.; Microblogs; Biography (Literary form); Participatory culture; Scholarly method,SocIndex,0,,,,,,,
