,Item Type,Publication Year,Author,Title,Publication Title,DOI,Url,Abstract Note,Keywords,Database,Citation,"Social Movements, politics, policy, and Activism",News,Mis/Disinformation,Social Stratification or Segregation,Economic sociology,Health,Other
1181,journalArticle,2019.0,"Lin, Shu-Fang; Dale, Katherine R.; McDonald, Daniel G.; Collier, James G.; Jones, Kaitlyn",Narrative Engagement and Vicarious Interaction with Multiple Characters.,Mass Communication & Society,,https://ezproxy.lib.utexas.edu/login?url=https://search.ebscohost.com/login.aspx?direct=true&db=sih&AN=135909170&site=ehost-live,"This study investigates how audience members relate to and vicariously interact with multiple characters while viewing a narrative. Under the framework of the theory of situation models, we applied a real-time thought-listing technique that incorporated Twitter and focused on three debuting TV dramas to explore how the participants followed multiple characters while watching prime-time television dramas. We examined 3,274 tweets across the three TV series and found that monitoring a greater diversity of characters is associated with an increased number of questions asked and more accurate predictions of future events. The participants who made more accurate predictions had higher narrative engagement. In addition, the participants who had more thoughts about the self tracked a greater diversity of characters and made more accurate predictions about the plot. The results are discussed in terms of the developing literature on narratives in mass communication and entertainment research. [ABSTRACT FROM AUTHOR]",Autobiographical memory; Episodic memory; Introspection; Narration on television; Television characters; Television viewers -- Psychology; Television viewing,SocIndex,4,,,,,,,
1182,journalArticle,2023.0,"Owen, Diana","The Ubiquitous Presidency: Presidential Communication and Digital Democracy in Tumultuous Times: Joshua M. Scacco and Kevin Coe. New York: Oxford University Press, 2021, 248 pp., ISBN: 9780197520642 (paperback).",Mass Communication & Society,,https://ezproxy.lib.utexas.edu/login?url=https://search.ebscohost.com/login.aspx?direct=true&db=sih&AN=161465627&site=ehost-live,"Separate chapters analyzing the ubiquitous presidency in the administrations of Barack Obama and Donald Trump are especially formidable as they demonstrate how the framework can be applied to specific presidencies and tested empirically. Scacco and Coe emphasize that tensions between old and new communication forms are evident for presidents, but also for the press and media audiences. It may be tempting to view these developments primarily through the lens of the Trump presidency with its unprecedented use of Twitter to achieve the goals of a ubiquitous presidency. [Extracted from the article]","Political communication; Digital communications; Presidents of the United States; Presidents; Oxford University Press; Ubiquitous Presidency: Presidential Communication & Digital Democracy in Tumultuous Times, The (Book); White House staff",SocIndex,0,,,,,,,
1183,journalArticle,2016.0,"Sanderson, Jimmy; Frederick, Evan; Stocz, Mike",When Athlete Activism Clashes With Group Values: Social Identity Threat Management via Social Media.,Mass Communication & Society,,https://ezproxy.lib.utexas.edu/login?url=https://search.ebscohost.com/login.aspx?direct=true&db=sih&AN=113744369&site=ehost-live,"On November 30, 2014, five African American St. Louis Rams players locked hands and displayed a “hands-up” gesture during player introductions in response to racial tensions in Ferguson, Missouri, emanating from the Michael Brown case. This act generated significant media attention and prompted discussions via Facebook and Twitter. Two notable venues on social media for these conversations were the “Boycott the St. Louis Rams” Facebook page and the Twitter hashtag #BoycottRams. A thematic analysis of 1,019 user-generated Facebook comments and 452 tweets was conducted through the lens of social identity threat management. Six primary themes emerged: (a) renouncing fandom, (b) punishment commentary, (c) racial commentary, (d) general criticism, (e) attacking other group members, and (f) presenting the “facts” of the case. The results suggest that social media sites such as Facebook and Twitter serve as forums where group members discuss and debate challenges to group values and promote action steps that can mitigate social identity threats. This form of protest holds implications for minority athletes’ activism efforts and sport organization administrators. [ABSTRACT FROM AUTHOR]",Social media; Group identity; Activism; Athletes; Group values (Sociology),SocIndex,166,,,,,,,
1184,journalArticle,2022.0,"Roden, Jessica; Saleem, Muniba",White Apathy and Allyship in Uncivil Racial Social Media Comments.,Mass Communication & Society,,https://ezproxy.lib.utexas.edu/login?url=https://search.ebscohost.com/login.aspx?direct=true&db=sih&AN=156835404&site=ehost-live,"Given the pervasiveness of racist online comments, it is important to determine what factors motivate White audiences to take actions for racial justice. We utilize and expand on the defensive effect, which proposes that uncivil online comments can mobilize action, by focusing on social identities and group-based emotions. By manipulating the race of a person tweeting in support of racial justice protests and the civility of the racist response, we find that uncivil replies lead to increased feelings of group-based anger, which is associated with willingness to respond to the comment online and take political action for racial equality. These findings highlight the mobilizing influence that anger, as opposed to other emotions, can have on White bystanders witnessing racist incivility within social media environments. [ABSTRACT FROM AUTHOR]",Social media; Political participation; Emotions; Racial inequality; Online comments; Apathy; Racism in language,SocIndex,2,,,,,,,
1185,journalArticle,2020.0,"Wells, Chris; Zhang, Yini; Lukito, Josephine; Pevehouse, Jon C. W.",Modeling the Formation of Attentive Publics in Social Media: The Case of Donald Trump.,Mass Communication & Society,,https://ezproxy.lib.utexas.edu/login?url=https://search.ebscohost.com/login.aspx?direct=true&db=sih&AN=141750890&site=ehost-live,"Previous research has shown the importance of Donald Trump's Twitter activity, and that of his Twitter following, in spreading his message during the primary and general election campaigns of 2015–2016. However, we know little about how the publics who followed Trump and amplified his messages took shape. We take this case as an opportunity to theorize and test questions about the assembly of what we call ""attentive publics"" in social media. We situate our study in the context of current discussions of audience formation, attention flow, and hybridity in the United States' political media system. From this we derive propositions concerning how attentive publics aggregate around a particular object, in this case Trump himself, which we test using time series modeling. We also present an exploration of the possible role of automated accounts in these processes. Our results reiterate the media hybridity described by others, while emphasizing the importance of news media coverage in building social media attentive publics. [ABSTRACT FROM AUTHOR]","Social media; Elections; Political campaigns; Political systems; Press; Primaries; Trump, Donald, 1946-",SocIndex,14,,,,,,,
1186,journalArticle,2020.0,"Tully, Melissa; Vraga, Emily K.; Bode, Leticia",Designing and Testing News Literacy Messages for Social Media.,Mass Communication & Society,,https://ezproxy.lib.utexas.edu/login?url=https://search.ebscohost.com/login.aspx?direct=true&db=sih&AN=141133789&site=ehost-live,"As concerns grow about the spread of misinformation through social media, scholars have called for improving the public's media literacy as a potential solution. This study examines the effectiveness of deploying news literacy (NL) messages on social media by testing whether NL tweets are able to affect perceptions of information credibility and NL beliefs. Using two experiments, this study tests NL tweets designed to (a) mitigate the impact of exposure to misinformation about two health issues (genetically modified foods and the flu vaccine) and (b) boost people's perceptions of their own media literacy and media literacy's value to society broadly. Findings suggest that NL messages are able to alter misinformation perceptions and NL beliefs, but not with a single message, suggesting the need to develop tailored and targeted NL campaigns that feature multiple messages and calls to action. [ABSTRACT FROM AUTHOR]",Social media; Genetically modified foods; Influenza vaccines; Media literacy; Reading ability testing,SocIndex,131,,,,,,,
1187,journalArticle,2018.0,"Kilgo, Danielle K.; Harlow, Summer; García-Perdomo, Victor; Salaverría, Ramón",From #Ferguson to #Ayotzinapa: Analyzing Differences in Domestic and Foreign Protest News Shared on Social Media.,Mass Communication & Society,,https://ezproxy.lib.utexas.edu/login?url=https://search.ebscohost.com/login.aspx?direct=true&db=sih&AN=131378285&site=ehost-live,"This study compares U.S. digital news coverage of recent foreign and domestic protests. Differences in coverage's framing, sourcing, and device emphases were analyzed for two cases: protests that erupted after the death of Michael Brown and protests demanding justice for the 43 missing students from Ayotzinapa, Mexico. Building on protest paradigm literature, content analysis results show that news articles that appeared on Facebook and Twitter emphasized legitimizing frames for foreign protests more than domestic protests. Foreign protests were framed with the spectacle frame more than domestic protests, which were more often portrayed as confrontational. Digitally native news organizations produced content that deviated from expected paradigmatic norms the most. In addition, this research examines the relationship between content and sharing on Facebook and Twitter. Implications of these findings within the theoretical framework of the protest paradigm are discussed. [ABSTRACT FROM AUTHOR]",Twitter (Web resource); Facebook (Web resource); Frames (Social sciences); Information sharing; Media effects theory (Communication); Protest movements in mass media,SocIndex,42,,,,,,,
1188,journalArticle,2018.0,"Lee, Tae Kyoung; Kim, Youngju; Coe, Kevin","When Social Media Become Hostile Media: An Experimental Examination of News Sharing, Partisanship, and Follower Count.",Mass Communication & Society,,https://ezproxy.lib.utexas.edu/login?url=https://search.ebscohost.com/login.aspx?direct=true&db=sih&AN=130244211&site=ehost-live,"This study examines whether the characteristics of those who share news articles on social media influence the hostile media effect. In an experiment, participants read a news article shared by 1 of 4 Twitter users, 2 (Republican vs. Democrat) × 2 (21 vs. 503,000 followers). Consistent with the hostile media effect, both Republicans and Democrats believed that a news article shared by a Twitter user from an opposing political party was more biased than one shared by a Twitter user from the same political party. As the Twitter account had more followers, however, this effect was more prominent among Republicans and less prominent among Democrats. [ABSTRACT FROM AUTHOR]",Partisanship; Mass media influence; Republicans; Media effects theory (Communication); Democrats (United States); Hostile media perception; Mass media & public opinion,SocIndex,34,,,,,,,
1189,journalArticle,2018.0,"Oeldorf-Hirsch, Anne",The Role of Engagement in Learning From Active and Incidental News Exposure on Social Media.,Mass Communication & Society,,https://ezproxy.lib.utexas.edu/login?url=https://search.ebscohost.com/login.aspx?direct=true&db=sih&AN=127560022&site=ehost-live,"The growing reliance on social media as news platforms may lead to more passive news consumption but also offers greater potential for engaging in news. This study investigates the role of engagement with news content on Facebook and Twitter between news exposure and current events knowledge. An online survey (N = 400) tests the relationships between social media news seeking, incidental exposure to news on social media, engagement in shared news content, cognitive elaboration, and current events knowledge. The results show that both active seeking of and incidental exposure to news on both sites are linked to engagement, which is linked to greater cognitive elaboration about the content. Furthermore, engagement mediates the relationship between both types of news exposure and cognitive elaboration. However, engagement and elaboration are not related to knowledge. These results indicate that the key role of social media in news content is not knowledge gain but the ability to engage users who may be passively receiving news on these sites. This study extends the cognitive mediation model of learning from the news in the context of current social media, with updated news consumption norms such as engagement with news on these sites, and incidental news exposure. [ABSTRACT FROM PUBLISHER]",Social media; Twitter (Web resource); Facebook (Web resource); News websites; Psychology; Engagement (Philosophy); Information-seeking behavior,SocIndex,181,,,,,,,
1190,journalArticle,2016.0,"Bode, Leticia",Political News in the News Feed: Learning Politics from Social Media.,Mass Communication & Society,,https://ezproxy.lib.utexas.edu/login?url=https://search.ebscohost.com/login.aspx?direct=true&db=sih&AN=112042616&site=ehost-live,"Although literature about the relationship between social media and political behaviors has expanded in recent years, little is known about the roles of social media as a source of political information. To fill this gap, this article considers the question of whether and to what extent learning political information occurs via Facebook and Twitter. Theory suggests that social media may play a significant role in the learning of political information within the modern media environment. Making use of a combination of experimental and survey-based studies, the data suggest that the potential for users to learn political information from social media exists but is not always realized within the general population. [ABSTRACT FROM AUTHOR]",Practical politics; Social media; Twitter Inc.; Facebook Inc.; Literature,SocIndex,566,,,,,,,
1191,journalArticle,2015.0,"Jeffres, Leo W.",Mass Communication Theories in a Time of Changing Technologies.,Mass Communication & Society,,https://ezproxy.lib.utexas.edu/login?url=https://search.ebscohost.com/login.aspx?direct=true&db=sih&AN=109420873&site=ehost-live,"An introduction is presented in which the editor discusses various reports within the issue on topics including an article on the nature of mass communication in the digital age, the utility of agenda-setting theory using a data set collected on Twitter during the 2012 U.S. presidential election, and the diffusion of innovations.",Diffusion of innovations; Mass media; Agenda setting theory (Communication),SocIndex,17,,,,,,,
1192,journalArticle,2015.0,"Guo, Lei; Vargo, Chris",The Power of Message Networks: A Big-Data Analysis of the Network Agenda Setting Model and Issue Ownership.,Mass Communication & Society,,https://ezproxy.lib.utexas.edu/login?url=https://search.ebscohost.com/login.aspx?direct=true&db=sih&AN=109420870&site=ehost-live,"This article presents an empirical study that tests a new concept, “issue ownership network,” which is based on the network agenda setting (NAS) model and the theory of issue ownership. Big data analytics and semantic network analysis were used to examine the large data set collected on Twitter during the 2012 U.S. presidential election. Results showed that the news media could determine the public's identification of a political candidate with not just individual issues but also entire networks of issues. Here we argue that traditional news media still set the public agenda in this new media environment, and do so in ways more complicated through constructing message networks. The study also demonstrates that the NAS model and its unique focus can potentially enrich the understanding of other communication and social science theories and concepts. [ABSTRACT FROM PUBLISHER]","Big data; Twitter (Web resource); United States; Data analysis; Computer network resources; Social sciences; Political candidates; United States presidential election, 2012; Agenda setting theory (Communication); Political affiliation",SocIndex,160,,,,,,,
1193,journalArticle,2013.0,"Allen, Myria; Wicks, Robert H.; Schulte, Stephanie","Online Environmental Engagement Among Youth: Influence of Parents, Attitudes and Demographics.",Mass Communication & Society,,https://ezproxy.lib.utexas.edu/login?url=https://search.ebscohost.com/login.aspx?direct=true&db=sih&AN=90134956&site=ehost-live,"Although young citizens may not always politically engage in the same fashion as their elders, research suggests they are using Facebook, Twitter, and other newer communication systems to mobilize politically both generally and around environmental issues. Given the declining environmental conditions facing young citizens, a national stratified quota sample of 1,096 U.S. parents and their children between the ages of 12 and 17 was conducted to investigate the factors potentially related to their efforts to persuade members of their online social networks to be more environmental. We believe that online peer persuasion is an important concept to investigate because peer persuasion can create subjective norms that ultimately may influence behavior. Hierarchical regression analysis revealed that, although parents influence youth behavior (Adj. R2 =.11), the greatest variance in behavior was explained by the youth's own environmental self-efficacy, environmental news consumption, political interest, time spent online, gender, and environmental consumerism (ΔR2 =.29). Youth political interest and environmental consumerism were especially important variables in the final model. Structural equation modeling reinforced that parental influence is primarily indirect. This study appears to be among the first to link environmental consumerism with youth online peer persuasion. [ABSTRACT FROM AUTHOR]",Twitter (Web resource); Facebook (Web resource); Regression analysis; Multivariate analysis; Young adult attitudes,SocIndex,31,,,,,,,
1194,journalArticle,2021.0,"Banez, JE","""A Real Man cries"": A Scoping of Filipino Masculinities Construction in Tweets",MCS-MASCULINITIES AND SOCIAL CHANGE,10.17583/MCS.2021.8634,,"Online content can be a rich source of information on current constructions of masculinities and much can be explored on the digital's role in masculinities construction (Light, 2013). This study compares and contrasts our current literature on masculinities with empirical qualitative data - that is, Filipino tweets. To do this, I analyzed tweets containing the phrase ""ang tunay na lalake"" (the real man) and the hashtag ""# angtunaynalalake"". Using qualitative content analysis, the following themes were generated: 1) Romance and Masculinities which highlights heteronormativity of romantic context and the concept of ""more deserving real man"" - a construct produced through networked masculinity and within the context of fandom and bigotry; 2) Masculine Capital - highlights how rites of passage, specifically circumcision, can be overshadowed by masculine capital to the point that failing to meet the required masculine capital would render one as 'de-circumcised'; and lastly, 3) Online Resistance to Hegemonic Masculinity - shows the use of jokes, sarcasm, and confrontation in questioning hegemonic masculinity. The results show both concern and hope for gender advocacy.",ONLINE; MEN; IDENTITY; GENDER; SELF; hegemonic masculinity; Philippines; masculine capital; online identity construction,WOS,0,,,,,,,
1195,journalArticle,2021.0,"Ferg, Robyn A.; Conrad, Frederick G.; Gagnon-Bartsch, Johann A.",A Critical Evaluation of Tracking Public Opinion with Social Media: A Case Study in Presidential Approval.,"MDA - Methoden, Daten, Analysen",,https://ezproxy.lib.utexas.edu/login?url=https://search.ebscohost.com/login.aspx?direct=true&db=sih&AN=152457977&site=ehost-live,"There has been much interest in using social media to track public opinion. We introduce a higher level of scrutiny to these types of analyses, specifically looking at the relationship between presidential approval and ""Trump"" tweets and developing a framework to interpret its strength. We use placebo analyses, performing the same analysis but with tweets assumed to be unrelated to presidential approval, to assess the relationship and conclude that the relationship is less strong than it might otherwise seem. Secondly, we suggest following users longitudinally, which enables us to find evidence of a political signal around the 2016 presidential election. For the goal of supplementing traditional surveys with social media data, our results are encouraging, but cautionary. [ABSTRACT FROM AUTHOR]","Social media; Sentiment analysis; sentiment analysis; Twitter; Public opinion; social media; Email hacking; Media studies; United States presidential election, 2016; presidential approval; Social media in business; surveys",SocIndex,0,,,,,,,
1196,journalArticle,2020.0,"Smit, A; Bosch, T",Television and Black Twitter in South Africa: Our Perfect Wedding,MEDIA CULTURE & SOCIETY,10.1177/0163443720926040,,"This article examines Twitter use by audiences of the popular South African television show, Our Perfect Wedding. We argue that the show's Twitter feed provides an extension of South Africa's 'Black Twitter' facilitating a space for recognition and group identity for Black South African television viewers. Such a space is significant since Black audiences have been neglected in the short history of South African television broadcasting. On Our Perfect Wedding, broadcast on a satellite television service DStv to paying subscribers, questions of class and race are salient for an audience group prized as an emerging market of Black middle-class viewers. Through qualitative analysis of a sample of tweets featuring the hashtag, #OPWMzansi (Our Perfect Wedding South Africa), we demonstrate how Twitter is used for the performance and negotiation of class and race for the audience. The comedy of the show's Twitter commentary is largely dependent upon judgements around class, taste and language. While the Twitter feed features creative user contributions, the #OPWMzansi network reveals that much of the communication is prompted and networked back to the official programme Twitter site, demonstrating the centrality of the traditional television broadcaster to Twitter interactions with the text.",MEDIA; Twitter; social media; race; Black Twitter; television; class; CONSUMPTION; NATION; post-apartheid; South Africa,WOS,17,,,,,,,
1197,journalArticle,2013.0,"Bastos, MT; Raimundo, RLG; Travitzki, R",Gatekeeping Twitter: message diffusion in political hashtags,MEDIA CULTURE & SOCIETY,10.1177/0163443712467594,,"This article explores the structure of gatekeeping in Twitter by means of a statistical analysis of the political hashtags #FreeIran, #FreeVenezuela and #Jan25, each of which reached the top position in Twitter Trending Topics. We performed a statistical correlation analysis on nine variables of the dataset to evaluate if message replication in Twitter political hashtags was correlated with network topology. Our results suggest an alternative scenario to the dominant view regarding gatekeeping in Twitter political hashtags. Instead of depending on hubs that act as gatekeepers, we found that the intense activity of individuals with relatively few connections is capable of generating highly replicated messages that contributed to Trending Topics without relying on the activity of user hubs. The results support the thesis of social consensus through the influence of committed minorities, which states that a prevailing majority opinion in a population can be rapidly reversed by a small fraction of randomly distributed committed agents.",Twitter; hashtags; internet; #FreeIran; #FreeVenezuela; #Jan25; communication theory; gatekeeping; network theory; two-step flow theory,WOS,253,,,,,,,
1198,journalArticle,2020.0,"Urman, A",Context matters: political polarization on Twitter from a comparative perspective,MEDIA CULTURE & SOCIETY,10.1177/0163443719876541,,"This article explores the issue of political polarization on social media. It shows that the intensity of polarization on Twitter varies greatly from one country to another. The analysis is performed using network-analytic audience duplication approach and is based on the data about the followers of the political parties' Twitter accounts in 16 democratic countries. Based on the topology of the audience duplication graphs, the political Twitterspheres of the countries are classified as perfectly integrated, integrated, mixed, polarized and perfectly polarized. Explorative analysis shows that polarization is the highest in two-party systems with plurality electoral rules and the lowest in multi-party systems with proportional voting. The findings help explain the discrepancies in the results of previous studies into polarization on social media. The results of the study indicate that extrapolation of the findings from single-case studies on the topic is impossible in most cases, suggesting that more comparative studies on the matter are necessary to better understand the subject and get generalizable results.",NEWS; SOCIAL MEDIA; Twitter; social media; OPINION; network analysis; audience duplication; AUDIENCE FRAGMENTATION; comparative analysis; political polarization,WOS,88,,,,,,,
