1199,journalArticle,2016.0,"Eriksson, M",Managing collective trauma on social media: the role of Twitter after the 2011 Norway attacks,MEDIA CULTURE & SOCIETY,10.1177/0163443715608259,,"This study analyses the meaning-making discourse on Twitter in the 6days following the 2011 Norway attacks. The attacks in Oslo and on the island of UtOya resulted in 77 deaths, of which 69 were youths on UtOya, where a summer camp arranged by the Norwegian Social Democratic youth organisation Arbeidernes Ungdomsfylking (AUF) was being held. The main discursive themes in the material were found to be focused on the Norwegian nation, expressions of solidarity, the meaning and outcomes of the attacks, as well as details of the attacks themselves. These themes were of changing importance over the 6days following the attacks, as discussions concerning the Norwegian nation and the attacks themselves dropped rapidly in favour of negotiating the explanations behind the attacks. Twitter was shown to be useful for providing backchannel discourse negotiations that were separate from the mass media discourse concerning the attacks.",Twitter; discourse; 2011 Norway attacks; backchannel communication; collective trauma; EVENTS; meaning-making,WOS,113,,,,,,,
1200,journalArticle,2017.0,"Bruns, A; Hanusch, F",Conflict imagery in a connective environment: audiovisual content on Twitter following the 2015/2016 terror attacks in Paris and Brussels,MEDIA CULTURE & SOCIETY,10.1177/0163443717725574,,"Acute crisis events ranging from natural disasters to terrorist incidents now tend to generate an almost immediate response from social media users. This is especially pronounced on Twitter, due to that platform's specific affordances as a particularly open and real-time medium. While analyses of such events have increased over recent years, we still understand relatively little about the way in which audiovisual materials relating to such crises are circulated and what they contribute to processes of witnessing. This is important, however, in an increasingly visual age when audiovisual material tends to be more widely viewed and shared than plain-text updates, and thus has a greater potential to influence viewers' interpretations of an event. To address this gap in our understanding, this article investigates the distribution dynamics of audiovisual content on Twitter in the immediate aftermath of terror attacks in Paris and Brussels. Results point to the importance of broadening conceptualisations of conflict-related visuals and the ongoing relevance of affective content in such material. Furthermore, this article argues that contexts of time and space are crucial to consider, as is the role that individual actors - both human and non-human - play in disseminating such content.",ENGAGEMENT; NEWS; Twitter; social media; 2015 Paris attacks; 2016 Brussels attacks; conflict imagery; EYEWITNESS IMAGES; MEDIA EVENTS; PUBLICS; terrorist attacks; TRAJECTORIES; witnessing,WOS,69,,,,,,,
1201,journalArticle,2014.0,"Ems, L",Twitter's place in the tussle: how old power struggles play out on a new stage,MEDIA CULTURE & SOCIETY,10.1177/0163443714529070,,"The recent proliferation and impact of protest events in the Middle East, northern Africa, and the development of a worldwide Occupy Wall Street movement have ignited inquiry into the people, social structures and technologies that have helped give these social movements form. Three cases are described here which add to this discussion and lead to a pruning of the analytical landscape in this subject area. By looking to the use of Twitter as a tool for political protest in Iran in 2009, Moldova in 2009 and the G-20 Summit in Pittsburgh in 2009, the complexity of the intertwined social and technological strands that have given rise to these new political protests is acknowledged. By realizing that this distinction is salient yet fuzzy, it becomes possible to make new observations, ask new questions and begin to understand the nature of recent political tussles and the communication tools used in them. For instance, this article posits that by seeing the particular use of a new communication tool - a socio-technical assemblage - as an artifact, analysts can learn something new about the motivations of those sitting at the negotiating table.",SOCIAL MEDIA; Twitter; social media; INTERNET; Arab Spring; social movements; revolution; REVOLUTION; communication technology; political crisis; protests; socio-technical,WOS,74,,,,,,,
1202,journalArticle,2016.0,"Sorensen, MP",Political conversations on Facebook - the participation of politicians and citizens,MEDIA CULTURE & SOCIETY,10.1177/0163443715620924,,"Political conversations are according to theories on deliberative democracy essential to well-functioning democracies. Traditionally, these conversations have taken place in face-to-face settings, for example, in party meetings and town meetings. However, social media such as Facebook and Twitter offer new possibilities for online political conversations between citizens and politicians. This article examines the presence on Facebook and Twitter of Members of the Danish National Parliament, the Folketing, and focusses on a quantitative mapping of the political conversation activities taking place in the threads following Facebook posts from Danish Members of Parliament (MPs). The article shows that, in comparison with previous findings from other countries, Danish MPs have a relatively high degree of engagement in political conversations with citizens on Facebook - and that a large number of citizens follow MPs, read posts from the MPs and discuss politics with them and other citizens via the posts made by the MPs.",Twitter; social media; political conversation; INTERNET; Facebook; COMMUNICATION; public sphere; political participation; CAMPAIGNS,WOS,91,,,,,,,
1203,journalArticle,2015.0,"Revers, M",The augmented newsbeat: spatial structuring in a Twitterized news ecosystem,MEDIA CULTURE & SOCIETY,10.1177/0163443714549085,,"This article deals with the intertwining of digital and nondigital spaces of news reporting. It focuses specifically on how Twitter affects spatial and temporal orderings of news ecosystems. At the New York state government, actors within the space permeate informational barriers through Twitter while enabling others to follow and engage in events from remote locations. The always-on mentality of tweeters not only blurs boundaries between work life and private life but also helps correspondents to get access to and pass on information instantly, as well as to better anticipate events. The proliferation of digital spaces enhances awareness of nondigital spaces but requires coordination between the two. This paper is based on over two years of field research, involving observation, interviews, digital ethnography of the state house twitterverse and content analysis of journalists' tweets during the same-sex marriage debate.",SOCIAL MEDIA; social media; SPACE; CRISIS; PERFORMANCE; WORK; convergence; news digitization; news media; BLOGS; CONVERGENCE,WOS,46,,,,,,,
1204,journalArticle,2016.0,"Bulut, E",Social media and the nation state: of revolution and collaboration,MEDIA CULTURE & SOCIETY,10.1177/0163443716643013,,"This article examines the legal infrastructure of social media governance in the politically contested context of contemporary Turkey. It looks at how social media companies (specifically, Twitter and Facebook (FB)) and the nation state (Turkey) have negotiated power in the aftermath of Gezi Uprising in Summer 2013. I argue that while today's concerns regarding online surveillance might echo the calls for a new world information order of the 1970s, the world system model based on the core-periphery distinction has considerably changed. The useful insights of cultural imperialism fall short of explaining the geopolitical context within which Turkey finds itself in the aftermath of the Arab Uprisings and the sub-imperial relations within which she struggles to establish hegemony in the region. Findings suggest that the Turkish state tries hard to establish the legal and material infrastructure for these companies' operations. FB is more open to cooperation with the nation state, while Twitter has chosen to legally negotiate with the government. There also seems to be major risk for activists given the contradictory articulation of nation state and corporate interests.",Twitter; Turkey; Facebook; cultural imperialism; nation state; social media governance,WOS,27,,,,,,,
1205,journalArticle,2016.0,"Kjeldsen, L","Event-as-participation: building a framework for the practice of ""live-tweeting' during televised public events",MEDIA CULTURE & SOCIETY,10.1177/0163443716664482,,"Real-time commentary, also called live-tweeting', has become a widely used feature of the social networking site Twitter. Live-tweeting offers new dynamics in political communication by affording a space in which politicians, journalists, and the public alike are present while commenting on televised events in real time. Here, the social, spatial, and temporal arrangements of political communication are intermingled in a new fashion. This article presents a novel framework to theoretically conceptualize the use of live-tweeting. Drawing on the literature of context collapse' and a phenomenological perspective on media use, the concept of events-as-participation' is developed to identify a situation in which a public event is commented on online both by the participants present at the actual event and by an audience not physically present. Thus, a pluralization of the event occurs as it is experienced in situ, via broadcast and on various online platforms where new forms of interaction between those present and the audience can occur, blurring the boundaries between places, scenes, and social contexts and creating a new type of interplay between older and newer media formats.",SOCIAL MEDIA; Twitter; political communication; social networking sites; BRITISH; DEBATE; context collapse; live-tweeting; media geography; TWITTER USE; CYCLE,WOS,14,,,,,,,
1206,journalArticle,2018.0,"Anstead, N; Chadwick, A",A primary definer online: the construction and propagation of a think tank's authority on social media,MEDIA CULTURE & SOCIETY,10.1177/0163443717707341,,"Who has power in the construction of economic news in the United Kingdom? Are social media reshaping how this power is enabled? We examine the public Twitter interactions between journalists, political elites and, what is arguably the United Kingdom's most important think tank, the Institute for Fiscal Studies (IFS), during the 2015 UK general election campaign. Combining human-coded content analysis and network analysis of Twitter discourse about the IFS during a 38-day period, we explain how and why the authority of this think tank is being translated to social media. We develop a new, social media theory of primary definers' and show how the political authority on which such roles rest is co-constructed and propagated by professional journalists and political elites. Central to this process is a behaviour we conceptualize and measure: authority signalling. Our findings call into question some of the more sanguine generalizations about social media's contribution to pluralist democracy. Given the dominance of public service broadcasters in the processes we identify, we argue that, despite the growth of social media, there can be surprising limits on the extent to which contemporary media systems help citizens gain information about the assumptions underlying economic policy.",social media; austerity; CRISIS; journalism; power; news; authority signalling; economic policy,WOS,39,,,,,,,
1207,journalArticle,2020.0,"Selnes, FN; Orgeret, KS",Social media in Uganda: revitalising news journalism?,MEDIA CULTURE & SOCIETY,10.1177/0163443719900353,,"The article discusses the role of social media in relation to the traditional journalistic sphere in Uganda. Through an analysis of how journalists in three Ugandan newspapers use social media in their daily work, the article discusses how social media affect conventional sourcing practices, reportage and professional norms. The article is particularly interested in how Facebook and Twitter serve as alternative channels through which sources with less access to traditional means of communication get their message(s) across to journalists. The findings are discussed in light of the present development of social media legislation in Uganda. The discussions feed into a larger reflection on social media's potential to create avenues of access in a semi-democratic setting where attempts to curtail media freedom and freedom of expression are frequent.",social media; journalism; digital divide; freedom of speech; news sourcing; TWITTER; CITIZEN JOURNALISM; THINKING,WOS,0,,,,,,,
1208,journalArticle,2016.0,"Herzogenrath-Amelung, H",The new instantaneity: how social media are helping us privilege the (politically) correct over the true,MEDIA CULTURE & SOCIETY,10.1177/0163443716664855,,"The recent sacking of the eminent scientist Tim Hunt from one of the United Kingdom's leading research institutions is only the latest in a series of cases where public individuals have been derided for comments made in jest on social media, with serious consequences for their professional and personal lives. This article discusses the case of Tim Hunt as an example of the extent to which the privileging of the correct over the true which has long pervaded media discourse is taken to the extreme by the instant-response culture of social media. It points to the emergence of a new form of instantaneity enabled by these networked forms of communication that serves to reinforce systemic inaction rather than the change widely associated with these technologies. It draws on philosophy and critical theory as useful conceptual frameworks for highlighting the ways in which Twitter and co. increasingly call us to action but crowd out thought, thereby passing over opportunities for real social change.",Twitter; social media; critical theory; instantaneity; philosophy; political correctness,WOS,0,,,,,,,
1209,journalArticle,2018.0,"MacDowall, LJ; de Souza, P","I'd Double Tap That!!': street art, graffiti, and Instagram research",MEDIA CULTURE & SOCIETY,10.1177/0163443717703793,,"Recent scholarship into the uses of social media has opened up productive ways of thinking about the dynamic relationship between user-generated content and new forms of sociality and social practice. However, compared with Twitter and Facebook, the photo- and video-sharing platform Instagram has received relatively little scholarly attention. Instagram is only the latest in a complex media history that has shaped a range of social practices, including graffiti and street art. This article considers the relationship between street art, graffiti, and mobile digital technologies, in particular the ways in which the production and consumption of forms of street art and graffiti are increasingly shaped by the architectures, protocols, and uses of Instagram. Beyond thinking conceptually about how Instagram is reshaping these practices, it also considers some analytic strategies for Instagram research that can illuminate this emerging and dynamic relationship. We also suggest that thinking of Instagram simply as another tool obscures both the complex issues of using Instagram metadata for research (privacy, the definition of publication, intellectual property, archiving, and conservation) and they ways in which the platform itself is in no way distinct from the cultural formations to which it promises access.",social media; Instagram; graffiti; research methods; street art; technology and culture; TWITTER,WOS,0,,,,,,,
