,Item Type,Publication Year,Author,Title,Publication Title,DOI,Url,Abstract Note,Keywords,Database,Citation,"Social Movements, politics, policy, and Activism",News,Mis/Disinformation,Social Stratification or Segregation,Economic sociology,Health,Other
1331,journalArticle,2022.0,"Vraga, Emily; Tully, Melissa; Bode, Leticia",Assessing the relative merits of news literacy and corrections in responding to misinformation on Twitter.,New Media & Society,,https://ezproxy.lib.utexas.edu/login?url=https://search.ebscohost.com/login.aspx?direct=true&db=sih&AN=158747309&site=ehost-live,"Extending previous research, we test two solutions for addressing misinformation by pairing news literacy (NL) messages with corrective responses to health misinformation shared on Twitter. Importantly, we consider a range of outcomes, including not just credibility or misperceptions, but also feelings of news literacy and support for its value. Using an experiment, we find that user corrections of a meme containing false information reduced credibility assessments of the misinformation post and misperceptions but seeing misinformation also produced lower perceptions of personal news literacy and its value for society, regardless of whether it is corrected or not. Exposure to an NL message did not enhance the effectiveness of these corrective responses nor boost NL attitudes and may have generated cynicism. We discuss the challenges of designing NL messages for social media that achieve the wide range of goals news literacy interventions aspire to address. [ABSTRACT FROM AUTHOR]",Social media; social media; Correction; credibility; Cynicism; Literacy; Memes; misinformation; Misinformation; news literacy,SocIndex,30,,,,,,,
1332,journalArticle,2016.0,"Bastos, Marco T.; Mercea, Dan",Serial activists: Political Twitter beyond influentials and the twittertariat.,New Media & Society,,https://ezproxy.lib.utexas.edu/login?url=https://search.ebscohost.com/login.aspx?direct=true&db=sih&AN=118606926&site=ehost-live,"This article introduces a group of politically charged Twitter users that deviates from elite and ordinary users. After mining 20 M tweets related to nearly 200 instances of political protest from 2009 to 2013, we identified a network of individuals tweeting across geographically distant protest hashtags and revisited the term “serial activists.” We contacted 191 individuals and conducted 21 in-depth, semi-structured interviews thematically coded to provide a typology of serial activists and their struggles with institutionalized power. We found that these users have an ordinary following, but bridge disparate language communities and facilitate collective action by virtue of their dedication to multiple causes. Serial activists differ from influentials or traditional grassroots activists and their activity challenges Twitter scholarship foregrounding the two-step flow model of communication. The results add a much needed depth to the prevalent data-driven treatment of political Twitter by describing a class of extraordinarily prolific users beyond influentials and the twittertariat. [ABSTRACT FROM AUTHOR]",Twitter; Tags (Metadata); Occupy Wall Street protest movement; Civic participation; influentials; Internet & activism; protest hashtags; serial activists; Social influence; social networks; Twitter (Web resource) -- Social aspects; Microblogs -- Social aspects,SocIndex,98,,,,,,,
1333,journalArticle,2016.0,"Highfield, Tim",News via Voldemort: Parody accounts in topical discussions on Twitter.,New Media & Society,,https://ezproxy.lib.utexas.edu/login?url=https://search.ebscohost.com/login.aspx?direct=true&db=sih&AN=118069549&site=ehost-live,"Parody accounts are prevalent on Twitter, offering irreverent interpretations of public figures, fictional characters and more. These accounts post comments framed within the context of their fictional universes or stereotypes of their subjects, responding in-character to topical events. This article positions parody accounts as a ritualised social media practice, an extension of fan practices and irreverent Internet culture. By providing a typology of parody accounts and analysing the topicality of selected parody accounts’ tweets, the research examines how these accounts contribute to topical discussions. In-character framing of topical comments allows parody accounts to offer original interpretations of breaking news that receive more attention than their other tweets. The presence and longevity of parody accounts underline the importance of humour on social media, including within news and topical coverage. [ABSTRACT FROM AUTHOR]",Social media; Twitter (Web resource); Microblogs; Twitter; social media; Stereotypes; Fandom; humour; irreverence; news and commentary; parody; Parody; play; rituals; tropes; Virtual culture,SocIndex,65,,,,,,,
1334,journalArticle,2016.0,"Himelboim, Itai; Sweetser, Kaye D.; Tinkham, Spencer F.; Cameron, Kristen; Danelo, Matthew; West, Kate",Valence-based homophily on Twitter: Network Analysis of Emotions and Political Talk in the 2012 Presidential Election.,New Media & Society,,https://ezproxy.lib.utexas.edu/login?url=https://search.ebscohost.com/login.aspx?direct=true&db=sih&AN=117311176&site=ehost-live,"This study integrates network and content analyses to examine valence-based homophily on Twitter or the tendency for individuals to interact with those expressing similar valence. During the 2012 federal election cycle, we collected Twitter conversations about 10 controversial political topics and mapped their network ties. Using network analysis, we discovered clusters—subgroups of highly self-connected users—and coded messages in each cluster for their expressed positive-to-negative emotional valence, level of support or opposition, and political leaning. We found that valence-based homophily successfully explained the selection of user interactions on Twitter, in terms of expressed emotional valence in their tweets or support versus criticism to an issue. It also finds conservative voices to be associated with negatively valenced clusters and vice versa. This study expands the theory of homophily beyond its traditional conceptualization and provides a new understanding of political-issue interactions in a social media context. [ABSTRACT FROM AUTHOR]","Twitter (Web resource); Twitter; Content analysis; Social network analysis; Emotions; Homophily theory (Communication); social networks; 2012 Election; emotional valence; homophily; political talk; Subgroup analysis (Experimental design); United States presidential election, 2012",SocIndex,158,,,,,,,
1335,journalArticle,2016.0,"Graham, Todd; Jackson, Dan; Broersma, Marcel","New platform, old habits? Candidates’ use of Twitter during the 2010 British and Dutch general election campaigns.",New Media & Society,,https://ezproxy.lib.utexas.edu/login?url=https://search.ebscohost.com/login.aspx?direct=true&db=sih&AN=114508020&site=ehost-live,"Twitter has become one of the most important online spaces for political communication practice and research. Through a hand-coded content analysis, this study compares how British and Dutch Parliamentary candidates used Twitter during the 2010 general elections. We found that Dutch politicians were more likely to use Twitter than UK candidates and on average tweeted over twice as much as their British counterparts. Dutch candidates were also more likely to embrace the interactive potential of Twitter, and it appeared that the public responded to this by engaging in further dialogue. We attribute the more conservative approach of British candidates compared to the Netherlands to historic differences in the appropriation of social media by national elites, and differing levels of discipline imposed from the central party machines. [ABSTRACT FROM AUTHOR]",Twitter (Web resource); United Kingdom; Elections; Twitter; Political campaigns; social media; politicians; Netherlands; Internet; Social media & politics; Comparative research; elections; Political candidates,SocIndex,392,,,,,,,
1336,journalArticle,2016.0,"Graves, Ian; McDonald, Nora; Goggins, Sean P.",Sifting signal from noise: A new perspective on the meaning of tweets about the “big game”.,New Media & Society,,https://ezproxy.lib.utexas.edu/login?url=https://search.ebscohost.com/login.aspx?direct=true&db=sih&AN=112672299&site=ehost-live,"A good deal of Twitter research focuses on event-detection using algorithms that rely on keywords and tweet density. We present an alternative analysis of tweets, filtering by hashtags related to the 2012 Superbowl and validated against the 2013 baseball World Series. We analyze low-volume, topically similar tweets which reference specific plays (sub-contexts) within the game at the time they occur. These communications are not explicitly linked; they pivot on keywords and do not correlate with spikes in tweets-per-minute. Such phenomena are not readily identified by current event-detection algorithms, which rely on volume to drive the analytic engine. We propose to demonstrate the effectiveness of empirically and theoretically informed approaches and use qualitative analysis and theory to inform the design of future event-detection algorithms. Specifically, we propose theories of Information Grounds and “third places” to explain sub-contexts that emerge. Conceptualizing sub-contexts as a socio-technical place advances the framing of Twitter event-detection from principally computational to deeply contextual. [ABSTRACT FROM AUTHOR]",Twitter (Web resource); Microblogs; Twitter; hashtags; Qualitative research; Tags (Metadata); Empirical research; Event-detection; information grounds; third places,SocIndex,13,,,,,,,
1337,journalArticle,2020.0,"Gil de Zúñiga, Homero; Wells, Chris; Shah, Dhavan; Lukito, Josephine; Pelled, Ayellet; Pevehouse, Jon CW; Yang, JungHwan","Trump, Twitter, and news media responsiveness: A media systems approach.",New Media & Society,,https://ezproxy.lib.utexas.edu/login?url=https://search.ebscohost.com/login.aspx?direct=true&db=sih&AN=142579344&site=ehost-live,"How populists engage with media of various types, and are treated by those media, are questions of international interest. In the United States, Donald Trump stands out for both his populism-inflected campaign style and his success at attracting media attention. This article examines how interactions between candidate communications, social media, partisan media, and news media combined to shape attention to Trump, Clinton, Cruz, and Sanders during the 2015–2016 American presidential primary elections. We identify six major components of the American media system and measure candidates' efforts to gain attention from them. Our results demonstrate that social media activity, in the form of retweets of candidate posts, provided a significant boost to news media coverage of Trump, but no comparable boost for other candidates. Furthermore, Trump tweeted more at times when he had recently garnered less of a relative advantage in news attention, suggesting he strategically used Twitter to trigger coverage. [ABSTRACT FROM AUTHOR]","Social media; populism; Mass media; hybrid media; Clinton; Sanders; Attention economy; Breitbart; Cruz; Email hacking; Geometric shapes; populist; Presidential candidates; Press; Primaries; Trump, Donald, 1946-",SocIndex,83,,,,,,,
1338,journalArticle,2020.0,"An, Zheng; Mendiola-Smith, Luana",Connections to neighborhood storytellers and community-oriented emotional disclosure on Twitter during an emergency event.,New Media & Society,,https://ezproxy.lib.utexas.edu/login?url=https://search.ebscohost.com/login.aspx?direct=true&db=sih&AN=144806558&site=ehost-live,"From a communication infrastructure theory perspective, this study examined local residents' connections to neighborhood storytellers and its association with community-oriented emotional disclosure, a specific form of neighborhood storytelling, during an emergency event. A sample of 1676 local residents and their Twitter activities were obtained from Twitter's streaming application programming interface (API) during a 2-hour window after the event. A connection was established when the focal user retweeted, commented on, or replied to another user. The results show that scope of connections to residents, community organizations, and mainstream media positively predicted community-oriented disclosure of negative emotions. Scope of connections to residents positively predicted community-oriented disclosure of positive emotions. Scope of connections to local media did not predict community-oriented emotional disclosure. [ABSTRACT FROM AUTHOR]",Twitter; Community organization; Mass media; Communication infrastructure; Communication infrastructure theory; community-oriented emotional disclosure; Disclosure; emergencies; neighborhood storytelling; Neighborhoods; Storytellers,SocIndex,7,,,,,,,
1339,journalArticle,2018.0,"Oz, Mustafa; Zheng, Pei; Chen, Gina Masullo","Twitter versus Facebook: Comparing incivility, impoliteness, and deliberative attributes.",New Media & Society,,https://ezproxy.lib.utexas.edu/login?url=https://search.ebscohost.com/login.aspx?direct=true&db=sih&AN=131666146&site=ehost-live,"Using two quantitative methods, this study sought to understand whether user-generated posts would vary in frequency of incivility, impoliteness, and deliberative attributes on Twitter versus Facebook. A quantitative content analysis (N = 1458) revealed that posts responding to the White House’s tweets were significantly more uncivil and impolite and less deliberative than responses to White House Facebook posts. Also, comments on posts that concerned sensitive topics (such as same-sex marriage) were more uncivil, impolite, and deliberative than comments regarding less sensitive topics (such as technology). An experiment (N = 198) showed that people were more deliberative when responding to White House Facebook posts, compared with White House tweets, but no differences were found for incivility and impoliteness. Results suggest that both the varying affordances of the two platforms and the fact that the two sites may attract different types of people might explain these results. [ABSTRACT FROM AUTHOR]","social media; incivility; Social media & politics; Same-sex marriage; Impoliteness; public deliberation; Twitter (Web resource) -- Social aspects; Facebook (Web resource) -- Social aspects; White House (Washington, D.C.)",SocIndex,194,,,,,,,
1340,journalArticle,2019.0,"Crosset, Valentine; Tanner, Samuel; Campana, Aurélie",Researching far right groups on Twitter: Methodological challenges 2.0.,New Media & Society,,https://ezproxy.lib.utexas.edu/login?url=https://search.ebscohost.com/login.aspx?direct=true&db=sih&AN=135737844&site=ehost-live,"The Internet poses a number of challenges for academics. Internet specificities such as anonymity, the decontextualisation of discourse, the misuse or non-use of references raise methodological questions about the quality and the authenticity of the data available online. This is particularly true when dealing with extremist groups and grass-root militants that cultivate secrecy. Based on a study of the far-right on Twitter, this article explores these methodological issues. It discusses the qualitative indicators we have developed to determine whether a given Twitter account should be included in the sample or not. By using digital traces drawn from profiles, interactions, content and through other visual information, we recontextualize user's profile and analyze how digital traces participate in providing far right ideas with a wider representation. [ABSTRACT FROM AUTHOR]",Twitter (Web resource); Twitter; Digital traces; far right; Internet; methodology; Radicals; recontextualization; Right-wing extremists; Secrecy,SocIndex,70,,,,,,,
1341,journalArticle,2019.0,"Wihbey, John; Joseph, Kenneth; Lazer, David","The social silos of journalism? Twitter, news media and partisan segregation.",New Media & Society,,https://ezproxy.lib.utexas.edu/login?url=https://search.ebscohost.com/login.aspx?direct=true&db=sih&AN=135737836&site=ehost-live,"The present work proposes social media as a tool to understand the relationship between journalists' social networks and the content they produce. Specifically, we ask, ""what is the association between the partisan nature of the accounts journalists follow on Twitter and the news content they produce?"" Using standard text scaling techniques, we analyze partisanship in a novel dataset of more than 300,000 news articles produced by 644 journalists at 25 different US news outlets. We then develop a novel, semi-supervised model of partisanship of Twitter following relationships and show a modest correlation between the partisanship of whom a journalist follows on Twitter and the content she produces. The findings provide insight into the partisan dynamics that appear to characterize the US media ecosystem in its broad contours, dynamics that may be traceable from social media networks to published stories. [ABSTRACT FROM AUTHOR]",Social media; Social networks; Twitter (Web resource); Twitter; Journalists; Partisanship; social media; Computational social science; journalism; partisanship; text analysis,SocIndex,30,,,,,,,
1342,journalArticle,2013.0,"Jin, Seung-A Annie",Peeling back the multiple layers of Twitter’s private disclosure onion: The roles of virtual identity discrepancy and personality traits in communication privacy management on Twitter.,New Media & Society,,https://ezproxy.lib.utexas.edu/login?url=https://search.ebscohost.com/login.aspx?direct=true&db=sih&AN=90180338&site=ehost-live,"This study examined multiple layers of private disclosure on the microblogging site Twitter. Survey data (N = 375) were collected from current Twitter users (N = 198), nonusers (N = 116), and dropouts (N = 61). Data from current Twitter users revealed the existence of multiple strata of private disclosure boundaries on Twitter. There were significant differences at the descriptive and inferential levels among the multiple dimensions of private information, including daily lives, social identity, competence, socio-economic status, and health. Private information regarding daily lives and entertainment was disclosed easily and located at the outermost layer of the disclosure onion. In contrast, health-related private information was concealed and located within the innermost layer of the disclosure onion. ANOVAs (N = 375) also indicated that there were significant differences among current Twitter users, nonusers, and dropouts with regard to personality traits and privacy concerns about Twitter. Theoretical implications were discussed. [ABSTRACT FROM PUBLISHER]",Microblogs; Twitter; social media; Online social networks; tweets; social networking; Online identities; User-generated content; Microblogging; Neo Big 5; privacy management; private disclosure; Social status; user-generated content (UGC); virtual identity discrepancy,SocIndex,81,,,,,,,
1343,journalArticle,2017.0,"Shin, Jieun; Jian, Lian; Bar, François; Driscoll, Kevin",Political rumoring on Twitter during the 2012 US presidential election: Rumor diffusion and correction.,New Media & Society,,https://ezproxy.lib.utexas.edu/login?url=https://search.ebscohost.com/login.aspx?direct=true&db=sih&AN=124424890&site=ehost-live,"Social media can be a double-edged sword for political misinformation, either a conduit propagating false rumors through a large population or an effective tool to challenge misinformation. To understand this phenomenon, we tracked a comprehensive collection of political rumors on Twitter during the 2012 US presidential election campaign, analyzing a large set of rumor tweets (n = 330,538). We found that Twitter helped rumor spreaders circulate false information within homophilous follower networks, but seldom functioned as a self-correcting marketplace of ideas. Rumor spreaders formed strong partisan structures in which core groups of users selectively transmitted negative rumors about opposing candidates. Yet, rumor rejecters neither formed a sizable community nor exhibited a partisan structure. While in general rumors resisted debunking by professional fact-checking sites (e.g. Snopes), this was less true of rumors originating with satirical sources. [ABSTRACT FROM AUTHOR]",Elections; social media; political communication; Political communication; Social media & politics; partisan homophily; rumor; Rumor; satire; Satire,SocIndex,0,,,,,,,
1344,journalArticle,2017.0,"Patton, Desmond U; Leonard, Patrick; Lane, Jeffrey; Macbeth, Jamie; Smith Lee, Jocelyn R",Gang violence on the digital street: Case study of a South Side Chicago gang member's Twitter communication.,New Media & Society,,https://ezproxy.lib.utexas.edu/login?url=https://search.ebscohost.com/login.aspx?direct=true&db=sih&AN=124080171&site=ehost-live,"Social media connects youth to peers who share shared experiences and support; however, urban gang-involved youth navigate 'the digital street' following a script that may incite violence. Urban gang-involved youth use SNS to brag and insult and make threats a concept known as Internet banging. Recent research suggests Internet banging has resulted in serious injury and homicide. We argue violence may be disseminated in Chicago through social media platforms like Twitter. We examine the Twitter communications of one known female gang member, Gakirah Barnes, during a two week window in which her friend was killed and then weeks later, she was also killed. We explore how street culture is translated online through the conventions of Twitter. We find that a salient script of reciprocal violence within a local network is written online in real time. Those writing this script anticipate, direct, historicize, and mourn neighborhood violence. [ABSTRACT FROM AUTHOR]",Social media; Social networks; Twitter (Web resource); twitter; social media; Facebook (Web resource); African American youth; Gang violence; Gang Violence,SocIndex,92,,,,,,,
1345,journalArticle,2021.0,"Quan-Haase, Anabel; Mendes, Kaitlynn; Ho, Dennis; Lake, Olivia; Nau, Charlotte; Pieber, Darryl",Mapping #MeToo: A synthesis review of digital feminist research across social media platforms.,New Media & Society,,https://ezproxy.lib.utexas.edu/login?url=https://search.ebscohost.com/login.aspx?direct=true&db=sih&AN=150826370&site=ehost-live,"A tweet by Hollywood actress Alyssa Milano using Tarana Burke's phrase ""me too"" sparked a global movement. Despite the media attention #MeToo has garnered, little is known about how scholars have studied the movement. Through a synthesis review covering sources from 2006 to 2019, we learned that in this time period only 22 studies examined participation on social media such as Twitter and Facebook. We conclude that more research needs to be conducted, particularly to fill a gap in qualitative studies that directly engage individuals, to learn about their experiences with the movement. While #MeToo is a global movement, the omission of any reference to geography or a lack of geographic diversity suggests a narrow focus on scholarship based in the Global North. There is a need for more cross-cultural analysis to gain a better understanding of the movement as it evolves over time and moves into different spaces. [ABSTRACT FROM AUTHOR]","Social media; digital activism; Twitter; social media; Feminists; Facebook; Social media in education; Social participation; #MeToo; Cross-cultural studies; Global North-South divide; Milano, Alyssa, 1972-; Phylogeography; Reddit; sexual violence; social affordance; synthesis review; Tumblr",SocIndex,41,,,,,,,
1346,journalArticle,2018.0,"Zhang, Yini; Wells, Chris; Wang, Song; Rohe, Karl",Attention and amplification in the hybrid media system: The composition and activity of Donald Trump’s Twitter following during the 2016 presidential election.,New Media & Society,,https://ezproxy.lib.utexas.edu/login?url=https://search.ebscohost.com/login.aspx?direct=true&db=sih&AN=131666134&site=ehost-live,"Building on studies of the hybrid media system and attention economy, we develop the concept of amplification to explore how the activities of social media–based publics may enlarge the attention paid to a given person or message. We apply the concept to the 2016 US election, asking who constituted Donald Trump’s enormous Twitter following and how that following contributed to his success at attracting attention, including from the mainstream press. Using spectral clustering based on social network similarity, we identify key publics that constituted Trump’s Twitter following and demonstrate how particular publics amplified his social media presence in different ways. Our discussion raises questions about how algorithms “read” metrics to guide content on social media platforms, how journalists draw on social media metrics in their determinations of news value and worthiness, and how the process of amplification relates to possibilities of citizen action through digital communication. [ABSTRACT FROM AUTHOR]","Twitter; social media; News websites; Social media & society; engagement; algorithm; Amplification; attention; metrics; power; United States elections; Trump, Donald, 1946-; Social media -- Economic aspects",SocIndex,111,,,,,,,
