1347,journalArticle,2018.0,"Hanusch, Folker",Political journalists’ corporate and personal identities on Twitter profile pages: A comparative analysis in four Westminster democracies.,New Media & Society,,https://ezproxy.lib.utexas.edu/login?url=https://search.ebscohost.com/login.aspx?direct=true&db=sih&AN=128947034&site=ehost-live,"The practice for journalists to present an identity and brand the self on social media has become common across many newsrooms, yet its practice is still poorly understood. Focusing on journalists’ self-representations on the social network site Twitter, this study aims to address the lack of empirical understanding through an analysis of the identities which political journalists present on their Twitter profile pages. A total of 679 accounts of parliamentary press gallery journalists in Australia, Canada, New Zealand and the United Kingdom were analyzed, with a focus on various textual and visual pieces of professional and personal information. The article develops scales of corporate and personal identity, finding that UK and Canadian journalists most strongly differentiate between personal and corporate identities. Differences across countries are linked to political and economic aspects of the respective media systems. [ABSTRACT FROM AUTHOR]",Social media; Twitter (Web resource); Twitter; Journalists; social media; Brand; comparative; corporate; journalist; Online identities; personal; Self-presentation in mass media,SocIndex,53,,,,,,,
1348,journalArticle,2011.0,"Hargittai, Eszter; Litt, Eden",The tweet smell of celebrity success: Explaining variation in Twitter adoption among a diverse group of young adults.,New Media & Society,,https://ezproxy.lib.utexas.edu/login?url=https://search.ebscohost.com/login.aspx?direct=true&db=sih&AN=63648239&site=ehost-live,"The article analyzes what explains the uptake of Twitter during the year when the site enjoyed considerable increase in use, focusing on longitudinal data that surveyed 505 diverse young American adults about their Internet uses in 2009 and 2010. Results reveal that African Americans are most likely to use the service compared with those with higher Internet skills. The findings also indicate that a significant predictor of Twitter adoption has been an interest in celebrity and entertainment news. In addition, results show that interest in local and national news, international news, and politics fails to demonstrate any relationship to Twitter use in this population segment.",Microblogs; United States; Computer network resources; Internet; Celebrities; African Americans; Internet users; Reporters & reporting,SocIndex,352,,,,,,,
1349,journalArticle,2020.0,"Jones, Callum; Trott, Verity; Wright, Scott",Sluts and soyboys: MGTOW and the production of misogynistic online harassment.,New Media & Society,,https://ezproxy.lib.utexas.edu/login?url=https://search.ebscohost.com/login.aspx?direct=true&db=sih&AN=145701177&site=ehost-live,"Men Going Their Own Way (MGTOW) are a separatist Manosphere group (digital manifestation of the Men's Liberation Movement) who focus on individualistic, self-empowering actions as opposed to traditional collective actions typical of Men's Rights Activists and Incels. This study investigates how the ideology and rhetoric of MGTOW propagates and normalises misogynistic beliefs through online harassment, using a multi-phased content and thematic analysis of 10,280 tweets from three of the most active MGTOW users on Twitter. The findings document a link between the MGTOW ideology and toxic masculinity, showing that the online harassment generated is deeply misogynistic and polices the boundaries of a heterosexual, hegemonic masculinity. The analysis demonstrates that while the misogyny and violence produced by MGTOW is not extreme in nature, their appeals to rational thinking make it seem like common sense. The article develops new knowledge about the heterogeneous nature of the Manosphere and its constructions of masculinity. [ABSTRACT FROM AUTHOR]",Twitter; Thematic analysis; social media; Collective action; gender; online harassment; Misogyny; Harassment; Masculinity; manosphere; Common sense; Digital violence; emasculation; MGTOW; misogyny; toxic masculinity,SocIndex,118,,,,,,,
1350,journalArticle,2018.0,"Ramos-Serrano, Marina",Follow the closing of the campaign on streaming': The use of Twitter by Spanish political parties during the 2014 European elections.,New Media & Society,,https://ezproxy.lib.utexas.edu/login?url=https://search.ebscohost.com/login.aspx?direct=true&db=sih&AN=127317674&site=ehost-live,"The results of the elections to the European Parliament of 25 May 2014 marked a before and an after for Spanish politics. This influential European campaign took place at a moment when Internet use was well established as a tool, with political parties and candidates actively using social media. This article aims to research whether Spanish parties are using Twitter to develop interactive communication, or simply for broadcasting messages. Thus, the Twitter activity of various political parties during the 2014 European campaign is content-analysed. Results indicate that activity seems to depend on ideology, that parties are revealed to be committed to unidirectional communication/broadcasting, and that debate on Twitter is fundamentally between the politicians themselves. On a theoretical level, our data are in line with the idea that the normalisation hypothesis tends to prevail. [ABSTRACT FROM AUTHOR]",Twitter (Web resource); Elections; Twitter; Political campaigns; Political parties; social media; Spain; Social media & politics; Election campaigns; Interactive multimedia; interactivity; Internet & politics; Internet and politics,SocIndex,65,,,,,,,
1351,journalArticle,2017.0,"Liang, Hai; Fu, King-wa; Shen, Fei",Privacy protection and self-disclosure across societies: A study of global Twitter users.,New Media & Society,,https://ezproxy.lib.utexas.edu/login?url=https://search.ebscohost.com/login.aspx?direct=true&db=sih&AN=124739570&site=ehost-live,"Privacy is a culturally specific phenomenon. As social media platforms are going global, questions concerning privacy practices in a cross-cultural context become increasingly important. The purpose of this study is to examine cultural variations of privacy settings and self-disclosure of geolocation on Twitter. We randomly selected 3.3 million Twitter accounts from more than 100 societies. Results revealed considerable cultural and societal differences. Privacy setting in collectivistic societies was more effective in encouraging self-disclosure; whereas it appeared to be less important for users in individualistic societies. Internet penetration was also a significant factor in predicting both the adoption of privacy setting and geolocation self-disclosure. However, we did not find any direct relationships between cultural values and self-disclosure. [ABSTRACT FROM AUTHOR]",Social media; Twitter (Web resource); Twitter; Self-disclosure; self-disclosure; Boundary regulation; cross-cultural comparison; geolocation; Internet privacy; privacy protection; Wireless geolocation systems,SocIndex,59,,,,,,,
1352,journalArticle,2018.0,"Tromble, Rebekah",Thanks for (actually) responding! How citizen demand shapes politicians' interactive practices on Twitter.,New Media & Society,,https://ezproxy.lib.utexas.edu/login?url=https://search.ebscohost.com/login.aspx?direct=true&db=sih&AN=127838692&site=ehost-live,"Social media are frequently touted for their potential to strengthen democratic processes by bringing politicians and citizens into dialogue with one another. Social media may enrich the public sphere and improve democratic decision-making by allowing politicians and constituents to discuss matters of political import directly, free from intermediaries. But what factors impact whether this potential is realized? Previous research has focused on politicians' structural incentives for strategic communication online but neglected the impact of citizen demand for politicians' attention. I examine the role of citizen demand using an original dataset comprising the Twitter activity from and to members of the lower legislative houses in the Netherlands, United Kingdom, and United States during the latter half of October 2013. The data suggest that citizen demand plays a crucial role in determining the presence, as well as the extent, of politicians' reciprocal engagement with members of the public. [ABSTRACT FROM AUTHOR]",Twitter (Web resource); Political participation; Twitter; social media; political communication; Democracy; Political communication; Legislators; Social media & politics; digital discourse; online political engagement,SocIndex,134,,,,,,,
1353,journalArticle,2017.0,"Shuzhe Yang; Quan-Haase, Anabel; Rannenberg, Kai","The changing public sphere on Twitter: Network structure, elites and topics of the #righttobeforgotten.",New Media & Society,,https://ezproxy.lib.utexas.edu/login?url=https://search.ebscohost.com/login.aspx?direct=true&db=sih&AN=126691895&site=ehost-live,"Since the ruling of the European Court of Justice, the right to be forgotten has provided more informational self-determination to users, whilst raising new questions around Google's role as arbiter of online content and the power to rewrite history. We investigated the debate that unfolded on Twitter around the #righttobeforgotten through social network analysis. The results revealed that latent topics, namely Google's role as authority, alternated in popularity with rising and fading flare topics. The public sphere, or Öffentlichkeit, that we observed resembles the traditional one, with elite players such as news portals, experts and corporations participating, but it also differs significantly in terms of the underlying mechanisms and means of information diffusion. Experts are critical to comment, relay and make sense of information. We discuss the implications for theories of the public sphere and examine why social media do not serve as a democratising tool for ordinary citizens. [ABSTRACT FROM AUTHOR]",Social media; Twitter (Web resource); European Union; Twitter; Social network analysis; social network analysis; Law; European Union countries; Google; Google (Web resource); right to be forgotten; Right to be forgotten; Social media laws,SocIndex,57,,,,,,,
1354,journalArticle,2016.0,"Rauchfleisch, Adrian; Metag, Julia",The special case of Switzerland: Swiss politicians on Twitter.,New Media & Society,,https://ezproxy.lib.utexas.edu/login?url=https://search.ebscohost.com/login.aspx?direct=true&db=sih&AN=118606927&site=ehost-live,"We analyse the use of Twitter in political communication in Switzerland because, in comparison with other democracies, Switzerland with its strong federalism, fragmented party system, small country size and semi-professional politicians can be seen as the least-likely critical case, thus creating unique conditions for the use of social media. The study investigates the individual characteristics of Swiss Members of Parliament that could influence social media usage. Thus, the study contributes to the debate about equalization and normalization with respect to Twitter as a relevant microblogging channel for political communication and to the significance of country-specific conditions for the adoption of innovations in political online communication. The study explains the shift from equalization towards normalization with the diffusion of innovations theory. [ABSTRACT FROM AUTHOR]",Twitter; Diffusion of innovations; Politicians; social media; political communication; Political communication; Internet & politics; equalization; microblogging; normalization; Swiss politics & government; Switzerland; Twenty-first century; Twitter (Web resource) -- Social aspects; Microblogs -- Social aspects; Equality -- Social aspects,SocIndex,96,,,,,,,
1355,journalArticle,2016.0,"Ceron, Andrea; d’Adda, Giovanna",E-campaigning on Twitter: The effectiveness of distributive promises and negative campaign in the 2013 Italian election.,New Media & Society,,https://ezproxy.lib.utexas.edu/login?url=https://search.ebscohost.com/login.aspx?direct=true&db=sih&AN=118069545&site=ehost-live,"Recent studies investigated the effect of e-campaigning on the electoral performance. However, little attention has been paid to the content of e-campaigning. Given that political parties broadcast minute-by-minute the campaign messages on social media, this comprehensive and unmediated information can be useful to evaluate the impact of different electoral strategies. Accordingly, this article examines the electoral campaign for the 2013 Italian general election to assess the effectiveness of positive and negative campaigning messages, measured through content analysis of information published on the official Twitter accounts of Italian parties. We evaluate their impact on the share of unsolicited voting intentions expressed on Twitter, measured through an innovative technique of sentiment analysis. Our results show that negative campaign has positive effects and its impact is stronger when the attacker is meanwhile under attack. Conversely, we only find a circumstantial effect of positive campaign related to clientelistic and distributive appeals. [ABSTRACT FROM AUTHOR]",Social media; Sentiment analysis; sentiment analysis; Twitter; Content analysis; social media; Digital technology; Digital media; Clientelism; e-campaigning; electoral campaign; electoral forecast; negative campaign; online mobilization; positive campaign,SocIndex,143,,,,,,,
1356,journalArticle,2022.0,"Downing, Joseph; Dron, Richard","Theorising the 'Security Influencer': Speaking security, terror and Muslims on social media during the Manchester bombings.",New Media & Society,,https://ezproxy.lib.utexas.edu/login?url=https://search.ebscohost.com/login.aspx?direct=true&db=sih&AN=156613835&site=ehost-live,"Security studies literature neglects social media's potential for lay actors to become influential within security debates. This article develops the concept of 'security influencers', bringing literature from marketing into the security debate to understand how social media enables individuals to 'speak' and contest security and how lay actors exert influence. Methodologically, this article applies a multi-methods approach to 27,367 tweets to identify and analyse the top four most influential actors in 48 hours following the 2017 bombings by keywords 'Manchester' and 'Muslims'. This article builds a typology of security influencers nuancing definitions of the passive 'security broadcaster' and the active 'security engager', both of which emerge from obscurity or influence within non-security domains. Furthermore, a dichotomy emerges within influential messages and contestation; messages discussing Muslims in banal terms as diverse individuals register high levels of agreement, whereas those discussing Islam as a world religion receive more hostility and contestation. [ABSTRACT FROM AUTHOR]",Social media; Twitter; social media; Muslims; Influencers; UK; Financial markets; Bombings; Burglary protection; Manchester; security; terrorism,SocIndex,8,,,,,,,
1357,journalArticle,2016.0,"Kreiss, Daniel",Seizing the moment: The presidential campaigns’ use of Twitter during the 2012 electoral cycle.,New Media & Society,,https://ezproxy.lib.utexas.edu/login?url=https://search.ebscohost.com/login.aspx?direct=true&db=sih&AN=117556251&site=ehost-live,"Drawing on interviews with staffers from the 2012 Obama and Romney presidential campaigns and qualitative content analysis of their Twitter feeds, this article provides the first inside look at how staffers used the platform to influence the agendas and frames of professional journalists, as well as appeal to strong supporters. These campaigns sought to influence journalists in direct and indirect ways, and planned their strategic communication efforts around political events such as debates well in advance. Despite these similarities, staffers cite that Obama’s campaign had much greater ability to respond in real time to unfolding commentary around political events given an organizational structure that provided digital staffers with a high degree of autonomy. After analyzing the ways staffers discuss effective communication on the platform, this article argues that at extraordinary moments campaigns can exercise what Isaac Reed calls “performative power,” influence over other actors’ definitions of the situation and their consequent actions through well-timed, resonant, and rhetorically effective communicative action and interaction. [ABSTRACT FROM AUTHOR]","Twitter (Web resource); Twitter; Content analysis; United States; social media; political communication; Political communication; Electoral politics; Organizational structure; United States presidential election, 2012; Obama, Barack, 1961-; Romney, Mitt, 1947-",SocIndex,394,,,,,,,
1358,journalArticle,2016.0,"English, Peter","Twitter’s diffusion in sports journalism: Role models, laggards and followers of the social media innovation.",New Media & Society,,https://ezproxy.lib.utexas.edu/login?url=https://search.ebscohost.com/login.aspx?direct=true&db=sih&AN=113451195&site=ehost-live,"The roles of sports journalists have been affected considerably by the influence of Twitter, but what is not known is how the social media application has been adopted across a range of sports newsrooms in different countries. Employing Rogers’ diffusion of innovations theory, this study examines how Twitter has been accepted or rejected on the sports desks of six broadsheet/quality news organisations in Australia, India and the United Kingdom. A mixed methods approach is employed, combining 36 in-depth interviews with a content analysis of 4103 print and online articles. This allows a comprehensive analysis of issues such as when and why sports journalists adopt this innovation, and how much Twitter-related content appears in the sports pages. Twitter adoption contains many benefits for individuals and their organisations, and the results from this study have implications for sports journalism in other nations at various stages of diffusion. [ABSTRACT FROM AUTHOR]",Twitter (Web resource); Twitter; Content analysis; Diffusion of innovations; social media; Online social networks; Rogers; Role models; sports journalism; Sports journalism,SocIndex,95,,,,,,,
1359,journalArticle,2021.0,"Wiggins, Bradley E",Boogaloo and Civil War 2: Memetic antagonism in expressions of covert activism.,New Media & Society,,https://ezproxy.lib.utexas.edu/login?url=https://search.ebscohost.com/login.aspx?direct=true&db=sih&AN=153044566&site=ehost-live,"Internet memes are remixed images, videos, GIFs, hashtags, and similar content that usually incorporates humor but also some form of political or cultural critique. Several studies have previously examined the ways in which minority groups curate Internet memes for the purpose of protest or other forms of activism. This article examines user-generated tweets including any of the following hashtags: boogaloo, boogaloo2020, and/or civilwar2. The time period of interest on Twitter concerns any and all images posted between 15 and 25 January 2020, exactly 5 days before and after a controversial gun rally held in Richmond, Virginia. Drawing on Eco's theory of semiotics, the results from a critical discourse analysis reveal a tendency toward a preference for antagonism as a means to consolidate identity for individuals engaged in online discursive practice within hybrid structures. Findings include the presence of deeply contextualized and situated logics within an emergent boogaloo discourse. In addition, the study found that hypernarrative storytelling serves the movement in terms of identity negotiation and consolidation. [ABSTRACT FROM AUTHOR]",Twitter Inc.; Activism; Discourse analysis; Virtual communities; Critical discourse analysis; critical discourse analysis; Memes; Boogaloo; Civil war; COVID; Discursive practices; memes; memetic antagonism; Richmond (Va.); semiotics; Semiotics,SocIndex,23,,,,,,,
