1472,journalArticle,2019.0,"Chen, Zhuo",An Agent-Based Model for Information Diffusion over Online Social Networks.,Papers in Applied Geography,,https://ezproxy.lib.utexas.edu/login?url=https://search.ebscohost.com/login.aspx?direct=true&db=sih&AN=139414055&site=ehost-live,"Online social networks have become a new channel for urban citizens to acquire information. The efficient information diffusion in their communities ensures wide awareness of updated special events. With agent-based models built on the NetLogo platform, I study information diffusion on online social networks with different simulated network structures. Outcomes from simulated networks and from a case study of real-world Twitter networks show that there exist a range of paired optimal propagation parameters that could mimic real-world information diffusion. It is found that the physical space and the process of information diffusion on the real retweet network over time still demonstrate a geographic pattern showing that a local city or a related city is more involved in a special event in the area. [ABSTRACT FROM AUTHOR]",Twitter (Web resource); Twitter; Online social networks; Information diffusion; social network; agent-based modeling; efficient information diffusion,SocIndex,0,,,,,,,
1473,journalArticle,2023.0,"Santos, DL",Populist communication and thematic strategy in the official Instagram accounts of Spanish candidates during the electoral campaigns of 28 August and 10 November 2019,PAPERS-REVISTA DE SOCIOLOGIA,10.5565/rev/papers.3082,,"This paper aims to contribute to the study of populist messaging on Instagram, a social net-work that is well-established as a digital tool for political communication during electoral periods. Using content analysis that combines both quantitative and qualitative method-ologies, we analysed the posts (N=386) uploaded to the official Instagram accounts of the main candidates for president of the Spanish government during the electoral campaigns for the two general elections held in 2019. This enabled us to meet the main objective of the study, which was to verify whether the Instagram platform is prone to hosting political messages and discussions of a populist nature. Likewise, in order to obtain a wider perspec-tive of both campaigns on the same social network, the issues forming the subject of each candidates' agendas in the same period were studied. The main results show that Instagram, like Twitter and Facebook, enables political leaders to spread messages that in essence carry a populist narrative; to use the social network as a means of electoral propaganda; and largely to avoid discussing the proposals of their political agendas.",SOCIAL MEDIA; POLITICAL COMMUNICATION; political leaders; FACEBOOK; populism; DISCOURSE; social networks; MEDIATIZATION; PARTIES; TWITTER; IMAGE; DISCURSIVE STRATEGY; general elections; GENERAL-ELECTION; thematic agenda,WOS,0,,,,,,,
1474,journalArticle,2020.0,"Pietrantonio, Kipp; Llamas, Jasmín D.; Llamas, Jasmín","Closed Borders, Closed Hearts: Systemic Oppression of Latinas in U.S. Politics: Fronteras Cerradas, Corazones Cerrados Opresión sistémica de la Gente de Latinx en la Política Estadounidense.",Peace & Conflict,,https://ezproxy.lib.utexas.edu/login?url=https://search.ebscohost.com/login.aspx?direct=true&db=sih&AN=143041175&site=ehost-live,"This is Part 1 of a 2-part special edition of Peace and Conflict: The Journal of Peace Psychology, entitled ""The Challenge of Being Latina: Personal, Political, and Economic: Social Justice Edition."" In this introduction, we introduce the journal and provide a background on the unique intersection of race, sex, and socioeconomic status in which Latinas inhabit. Further, we explore the impact of the Trump presidency, including discussion of coded racist language, twitter ""bluster,"" media bias, ""The Wall,"" the Victims of Immigration Crime Engagement office, and the impact this has had on the Latinx people's opinions about their place in the United States. Public Significance Statement: Latinas sit at the cross section of two minority statuses, which can be further complicated by issues of class and immigration. This special edition examines the difficulties Latinas face through a lens of structural and systemic violence. We aim to highlight both the challenges and triumphs of Latinas, while attending to the larger sociopolitical context that impacts the entire Latinx population. [ABSTRACT FROM AUTHOR]",policy; Emigration & immigration; Social justice; Peace; social class; Violence; latina; latino; latinx; Socioeconomic status,SocIndex,3,,,,,,,
1475,journalArticle,2020.0,"Schneider, Nico",Will the Revolution Be Tweeted?,Peace Review,,https://ezproxy.lib.utexas.edu/login?url=https://search.ebscohost.com/login.aspx?direct=true&db=sih&AN=151554273&site=ehost-live,"The article focuses on traditional movement-building requires hierarchy, organizational structures, and social ties between members, social media have both transformed how social movements mobilize and diversified the ways people participate in campaigns for socio-political change. Topics include examines that it enable a differentiated understanding of Black Lives Matter mobilization at the intersection between power, public discourse, online activism.",Social media; Activism; Social movements; Black Lives Matter movement; Public discontent,SocIndex,3,,,,,,,
1476,journalArticle,2020.0,"Polić, Mirela",FEMALE PUBLIC RELATIONS PROFESSIONALS' PERCEPTIONS ON THE PORTRAYAL OF THE #METOO MOVEMENT IN CROATIAN MEDIA.,PERCEPCIJE ŽENA U ODNOSIMA S JAVNOŠĆU O PORTRETU #METOO POKRETA U HRVATSKIM MEDIJIMA.,,https://ezproxy.lib.utexas.edu/login?url=https://search.ebscohost.com/login.aspx?direct=true&db=sih&AN=149584951&site=ehost-live,"The #MeToo movement gained prominence in 2017 when the #MeToo hashtag went viral and woke up the world to the magnitude of the problem of sexual violence. It was the actress Alyssa Milano who made the first viral tweet accusing Hollywood producer Harvey Weinstein of sexual assault. Since research on the #MeToo movement across cultural contexts is limited and mostly comes from Western countries, this research aims to explore the perceptions of six female public relations experts on the portrayal of the #MeToo movement in Croatian media. Thematic analysis has been conducted to analyse data from six interviews. The results show three main themes in the responses from the interviewees: media's failure to protect the public interest, insufficient visibility of the #MeToo movement in Croatian media and the lack of expertise in the media. (English) [ABSTRACT FROM AUTHOR]","Sexual assault; Public relations; journalism; Social problems; public relations; Cultural movements; Milano, Alyssa, 1972-; #MeToo movement; #MeToo pokret; Croatia; Croats; Hrvatska; novinarstvo; odnosi s javnošću; seksualna diskriminacija; sexual discrimination; Weinstein, Harvey, 1952-",SocIndex,1,,,,,,,
1477,journalArticle,2022.0,"Dynel, M; Ross, AS",Metarecipient parents' #Bluey tweets as a distributed fandom affinity space,POETICS,10.1016/j.poetic.2022.101648,,"This article explores children's and adults' online fandom and engagement with the children's animated television programme Bluey. This Australian cartoon has proven extremely popular worldwide with its primary recipients, that is children, and has also received significant attention and positive evaluation from parents, who - we suggest - offer a metarecipient perspective on the series as they tweet about it, both voicing their own opinions and serving as their children's mouthpiece. Proposing the notion of a distributed fandom affinity space, we explore parents' discourse on Twitter around the commonly adopted hashtag #Bluey and discern several fundamental categories of posts that provide insight into child and metarecipient parent fandom in the #Bluey affinity space. The tweets revolve around the concepts of parenting, family life, education and language that arise from watching Bluey, which both parents and children evaluate in positive terms. Overall, the distributed fandom affinity space realised through the #Bluey hashtag highlights the capacity for user engagement in popular culture offered by Twitter outside dedicated fandom accounts.",ENGAGEMENT; MEDIA; Affinity space; Cartoon series reception; Metarecipient; Online fandom; Twitter hashtag,WOS,2,,,,,,,
1478,journalArticle,2016.0,"Vlieghe, J; Muls, J; Rutten, K",Everybody reads: Reader engagement with literature in social media environments,POETICS,10.1016/j.poetic.2015.09.001,,"This paper focuses on how readers participate in literary culture through social media environments. The study involves an observation of the website and Facebook group of the Flemish reading initiative ledereenleest.be (EverybodyReads.be), and includes in-depth interviews with highly active participants. We introduce the concept of affinity spaces to develop our understanding of how readers engage in a variety of literary practices within social media environments dedicated to literature and reading. Based on a qualitative thematic analysis of the interview data we discuss four ways in which users characterize literary and social media practices. As such, the study provides insight into readers' understanding and appreciation of the social aspects of participating in literary culture within social media environments. It also shows how they perceive and negotiate their role within these environments. The image presented by the participants confirms the characterization of social media as affinity spaces and stresses the crucial importance of acknowledging, supporting and encouraging people's passions and interests by allowing engagement in a variety of literary practices. (C) 2015 Elsevier B.V. All rights reserved.",Social media; IMPACT; ONLINE; PARTICIPATION; TWITTER; Affinity spaces; FICTION; Reader engagement; Social reading,WOS,67,,,,,,,
1479,journalArticle,2022.0,"Ginzarly, M; Srour, FJ",Cultural heritage through the lens of COVID-19,POETICS,10.1016/j.poetic.2021.101622,,"This study examines the discourse emerging from cultural heritage content shared online during the COVID-19 pandemic. It aims to understand the different affective and cognitive dynamics that are associated with the online sharing of cultural heritage in difficult times. To do so, we analyzed two Instagram hashtags-#ShareOurHeritage and #ShareCulture - that are promoted by UNESCO on a global scale. We applied a comprehensive quantitative method for qualitative data analysis. This method relied on Latent Dirichlet Allocation for topic modeling to generate automated induction of semantic topics and understand the underlying cognitive and affective dimensions of Instagram posts under each topic. Social values- including safety, inclusion, participation, and resilience - positive emotional language, and diverse cultural expressions were the most shared by the investigated hashtag community during the COVID-19 pandemic. In addition, results showed that users approach the virtual space as a substitute for the loss of their physical place through terms like home, virtual, online, travel tomorrow, and museums from home. Results are discussed in the context of the global digital divide, the social value of heritage to hashtag communities, and the use of Instagram as a longitudinal record of how cultural heritage values change across time.",Social media; SOCIAL MEDIA; COVID-19; FACEBOOK; WEB 2.0; GRATIFICATIONS; EXPERIENCES; TWITTER; PHOTOS; TRAVEL; DIGITAL DIVIDE; Hashtag community; Heritage values; Sharing; TRAUMA,WOS,19,,,,,,,
