,Item Type,Publication Year,Author,Title,Publication Title,DOI,Url,Abstract Note,Keywords,Database,Citation,"Social Movements, politics, policy, and Activism",News,Mis/Disinformation,Social Stratification or Segregation,Economic sociology,Health,Other
1451,journalArticle,2021.0,"Claussen, Dane S.","What did you, or would you, do as a journalist when your country had a ""dangerous,"" ""severely impaired,"" ""disordered and abnormal,"" and ""childlike"" president?",Newspaper Research Journal,,https://ezproxy.lib.utexas.edu/login?url=https://search.ebscohost.com/login.aspx?direct=true&db=sih&AN=149494914&site=ehost-live,"In between were Michael Maccoby's I Psychoanalytic and Historical Perspectives on the Leadership of Donald Trump i (May 2020); John Kruse's I Recognizing Adult ADHD: What Donald Trump Can Teach Us About Attention Deficit Hyperactivity Disorder i (July 2019); John Gartner et al.'s I Rocket Man: Nuclear Madness and the Mind of Donald Trump i (June 2018); John Martin-Joy's I Diagnosing From a Distance: Debates Over Libel Law, Media, and Psychiatric Ethics From Barry Goldwater to Donald Trump i (April 2020); Justin A. Frank's I Trump on the Couch: Inside the Mind of the President i (September 2018); Steven Buser et al.'s I A Clear and Present Danger: Narcissism in the Era of Donald Trump i (July 2016); Rachel Montgomery and John Gartner's I All I Ever Wanted to Know About Donald Trump I Learned From His Tweets: A Psychological Exploration of the President via Twitter i (September 2017); and, of course, Bill Eddy's I Why We Elect Narcissists and Sociopaths - and How We Can Stop i (May 2019). Zurawik criticizes his fellow journalists not only for not more often pointing out Trump's lies but also for not calling out Trump more often when the president was being racist and/or ""fascist."" Analogies have run fast and furious: If Trump were a cop, you would need to take away his gun; if Trump were your elderly father or grandfather, you would send him to an assisted-living facility or nursing him, if not a psychiatric hospital; if Trump were a doctor or lawyer, you would have his license revoked; and so on. [Extracted from the article]",Journalists; Antisocial personality disorders; Psychological tests,SocIndex,0.0,,,,,,,
1452,journalArticle,2016.0,"Cox, Jennifer Brannock",News orgs post more often on Twitter than on Facebook.,Newspaper Research Journal,,https://ezproxy.lib.utexas.edu/login?url=https://search.ebscohost.com/login.aspx?direct=true&db=sih&AN=118260693&site=ehost-live,"This study uses a content analysis to examine Twitter and Facebook postings from six news organizations. A sample of 1,232 items was coded for author type, news topic, timeliness, and story type. Overall, 82 percent of news organizations’ social media postings were on Twitter compared with 18 percent on Facebook. [ABSTRACT FROM AUTHOR]",Twitter (Web resource); Twitter Inc.; Microblogs; United States; social media; Facebook (Web resource); framing; content analysis; online; television; quantitative; Facebook Inc.; frequencies; print,SocIndex,15,,,,,,,
1453,journalArticle,2017.0,"Garud-Patkar, Nisha; Kalyango, Yusuf",News stories don’t match political party agendas.,Newspaper Research Journal,,https://ezproxy.lib.utexas.edu/login?url=https://search.ebscohost.com/login.aspx?direct=true&db=sih&AN=126263583&site=ehost-live,"Using rank order correlations, this study contrasts party agendas propagated in press releases and tweets of Democratic and Republican parties in USA and India’s BJP and Congress Party, with front-page newspaper agendas published in The New York Times and The Times of India. Analysis of all news articles shows governance, economy/business, international relations, and defense rank highly in both newspapers, whereas press releases and tweets in political parties are mainly concerned with governance and economy/business. [ABSTRACT FROM AUTHOR]",Twitter; content analysis; quantitative; Accuracy in journalism; American journalism; Journalistic ethics; New York Times; Newspaper publishing; agenda building; comparative politics; international communication.; rank-order correlation; Times of India,SocIndex,2,,,,,,,
1454,journalArticle,2021.0,"Wu, Yanfang; Garrison, Bruce",Private and public ownership in the drive toward digital innovations in newspaper newsrooms.,Newspaper Research Journal,,https://ezproxy.lib.utexas.edu/login?url=https://search.ebscohost.com/login.aspx?direct=true&db=sih&AN=149494913&site=ehost-live,"This research explores the impact of ownership on innovations in U.S. newspaper newsrooms by constructing a structural equation model (SEM). The study, using an online survey (N = 1,063), found that social media triggers a paradigm shift—newspapers owned by publicly held, for-profit companies excel in social media innovations and create more social media friendly innovations milieus than newspapers owned by privately held, for-profit companies. Journalists from the publicly held newspapers engage with audiences more on social media than privately held newspapers. The more journalists engage on Twitter, the more they tend to have a negative attitude toward social media. However, the more journalists at publicly held newspapers engage on Facebook, the more they tend to hold a positive attitude toward social media, opposite of journalists at privately held newspapers. [ABSTRACT FROM AUTHOR]",Social media; Structural equation modeling; Newspapers; social media; Social attitudes; Electronic newspapers; media innovation; Newsrooms; Psychological ownership; social media engagement; social media innovations milieu; social media share,SocIndex,3,,,,,,,
1455,journalArticle,2018.0,"Sheffer, Mary Lou; Schultz, Brad; Tubbs, Willie",#deflategate.,Newspaper Research Journal,,https://ezproxy.lib.utexas.edu/login?url=https://search.ebscohost.com/login.aspx?direct=true&db=sih&AN=129514377&site=ehost-live,"This study investigated how different groups of sports journalists covered the NFL ""deflategate"" scandal through social media, specifically in terms of employing image repair strategies via Twitter. Image repair strategy is typically used within public relations, but its use within journalism has not been examined. A content analysis revealed that while many journalists employed objective reporting, many others engaged in a variety of repair strategies, notably minimization and stonewalling. Discussion and implications focused on two main issues: conflicts of interest between journalists and sports organizations, and the evolving role of social media in crisis coverage. [ABSTRACT FROM AUTHOR]",Social media; Twitter (Web resource); Twitter; crisis communication; Public relations; sports journalism; Sports journalism; Football; National Football League; Corruption; IRS (image repair strategy); New England Patriots (Football team); PR (public relations),SocIndex,0,,,,,,,
1456,journalArticle,2018.0,"Wu, Yanfang",Social media engagement in the digital age: Accountability or threats.,Newspaper Research Journal,,https://ezproxy.lib.utexas.edu/login?url=https://search.ebscohost.com/login.aspx?direct=true&db=sih&AN=132518600&site=ehost-live,"An online survey of newspaper journalists (N = 1,063) shows engagement is a mediator between social media instructions in newsrooms and perceptions or attitude toward social media. The more journalists are engaged with Twitter, the more they believe social media is accountable and social media is less threatening to journalists, journalism and their news organizations. However, social media accountability is not significantly associated with social media as threats. [ABSTRACT FROM AUTHOR]",Social media; Newspaper journalists; social media; Journalism; engagement; quantitative; Newsrooms; accountability; attitude toward social media; Computer surveys; digital journalism; Internet surveys; online survey; structural equation modeling (SEM); threats,SocIndex,7,,,,,,,
1457,journalArticle,2018.0,"Pjesivac, Ivanka; Geidner, Nicholas; Cameron, Jaclyn",Social credibility online.,Newspaper Research Journal,,https://ezproxy.lib.utexas.edu/login?url=https://search.ebscohost.com/login.aspx?direct=true&db=sih&AN=129514376&site=ehost-live,"This 2 x 2 experimental study (N = 196) tested the effects of source expertise and opinion valence in readers' comments on the credibility of an online news story about genetically modified organisms (GMOs). Source expertise had a significant influence on perceptions of article credibility; articles were judged more credible when public comments embedded in the story were from expert sources (e.g., scientists) rather than nonexpert sources (e.g., Twitter users). Effects were larger on high-frequency news users, regardless of whether comments were for or against GMOs. Results suggest that Internet users mainly use the peripheral or heuristic route of information processing to evaluate online news credibility. The importance for online journalism of social heuristics via opinions of other people is discussed. [ABSTRACT FROM AUTHOR]",News websites; Truthfulness & falsehood; Internet users; Online journalism; online news; Online comments; expert sources; genetically modified organisms; GMOs; news credibility; online comments; social credibility; Transgenic organisms,SocIndex,0,,,,,,,
1458,journalArticle,2018.0,"Ferrucci, Patrick",Networked.,Newspaper Research Journal,,https://ezproxy.lib.utexas.edu/login?url=https://search.ebscohost.com/login.aspx?direct=true&db=sih&AN=129514378&site=ehost-live,"This study examines social media usage by journalists through the prism of the hierarchy of influences model. Utilizing interviews with 53 digital journalists, it identifies the actors playing a role in producing news through social media. It finds that journalists, opinion leaders, audience and extra-media organizations affect news production. It calls for a revisiting of the hierarchy of the influences model to understand on what levels of influence the audience affects news production. [ABSTRACT FROM AUTHOR]",Social media; Twitter (Web resource); Twitter; Journalists; social media; Facebook (Web resource); Facebook; Trend setters; Online journalism; qualitative; digital journalism; in-depth interviews; media sociology; hierarchy of influences; in-depth  interviews; the United States,SocIndex,0,,,,,,,
1459,journalArticle,2015.0,"Bullard, Sue Burzynski",Editors Use Social Media Mostly to Post Story Links.,Newspaper Research Journal,,https://ezproxy.lib.utexas.edu/login?url=https://search.ebscohost.com/login.aspx?direct=true&db=sih&AN=108423134&site=ehost-live,"A survey of senior editors of U.S. print broadcast and online news outlets found that while 98 percent of the 376 respondents say they use social media, they primarily use it to post links to stories on Facebook and Twitter. Far fewer use social media to interact with audiences by posing questions and responding to comments. [ABSTRACT FROM AUTHOR]",Twitter (Web resource); social media; Facebook (Web resource); News websites; engagement; Social media research; dissemination; Periodical editors; Readership; best practices; news sources; training,SocIndex,25,,,,,,,
1460,journalArticle,2017.0,"Szuminsky, Brandon; Sherman, Chad",Obamacare headlines mirror local political leanings.,Newspaper Research Journal,,https://ezproxy.lib.utexas.edu/login?url=https://search.ebscohost.com/login.aspx?direct=true&db=sih&AN=137543524&site=ehost-live,"This 485-newspaper study investigated the substantive differences in the media agenda in reports of the 2012 Supreme Court ruling on the Affordable Care Act ('Obamacare'), as represented by newspaper front page articles, with emphasis on differences in coverage between red and blue states. Newspapers in blue states used positive headlines more often and negative headlines less than did newspapers in red states. [ABSTRACT FROM AUTHOR]",Twitter (Web resource); Twitter; Content analysis; United States; Newspapers; content analysis; interactivity; normalization; quantitative; Internet forums; Patient Protection & Affordable Care Act; descriptive statistics; Newspaper & Online News; political reporters,SocIndex,1,,,,,,,
1461,journalArticle,2013.0,"Rosenberry, Jack","Circulation, Population Factor into Social Media Use.",Newspaper Research Journal,,https://ezproxy.lib.utexas.edu/login?url=https://search.ebscohost.com/login.aspx?direct=true&db=sih&AN=90330287&site=ehost-live,Analysis of Facebook and Twitter activity of 38 U.S. daily newspapers found strong correlation between the news organizations' use of social media tools and the size of the community and circulation of the print edition. Larger papers were more effective in using social media. [ABSTRACT FROM AUTHOR],Social media; Twitter (Web resource); Newspapers; Facebook (Web resource); Journalism,SocIndex,6,,,,,,,
1462,journalArticle,2011.0,"Greer, Jennifer B.; Yan, Yan",Newspapers Connect with Readers Through Multiple Digital Tools.,Newspaper Research Journal,,https://ezproxy.lib.utexas.edu/login?url=https://search.ebscohost.com/login.aspx?direct=true&db=sih&AN=70292454&site=ehost-live,"This article presents the results of a content analysis study on newspaper organizations' use of emerging digital delivery tools via blogging and social media to communicate with their readership. Topics include a transition from reliance on Rich Site Summary (RSS) feeds and email to more immediate social networking sites such as Facebook and Twitter, distinctions between the 20th-century electronic culture and the 21st-century digital culture, and correlations between the size of the news organization and the level of engaged and practiced digital innovation.",Content analysis; Online social networks; Electronic newspapers; Media literacy; Readership; Technological innovations in mass media,SocIndex,49,,,,,,,
1463,journalArticle,2012.0,"Grusin, Elinor Kelly; Utt, Sandra H.",Editors' Comments.,Newspaper Research Journal,,https://ezproxy.lib.utexas.edu/login?url=https://search.ebscohost.com/login.aspx?direct=true&db=sih&AN=84111119&site=ehost-live,"An introduction to the journal is presented in which the editor discusses various reports published within the issue including one on how news content on metropolitan newspaper websites compares to the print editions, another on how newspaper reporters use social media to report and another one on how mid-sized newspapers use Twitter.",Social media; Twitter (Web resource); Newspapers,SocIndex,0,,,,,,,
1464,journalArticle,2022.0,"Miller, Chris",Sephora's Starter Witch Kit: Identity Construction through Social Media Protests of Commodified Religion.,Nova Religio: The Journal of Alternative & Emergent Religion,,https://ezproxy.lib.utexas.edu/login?url=https://search.ebscohost.com/login.aspx?direct=true&db=sih&AN=155293490&site=ehost-live,"In late summer 2018, beauty chain Sephora announced the release of a ""Starter Witch Kit"" in collaboration with fragrance company Pinrose. By September, Sephora announced it was cancelling the product after receiving extensive criticism on social media, particularly from Modern Witches. This article examines the uproar surrounding Sephora's Starter Witch Kit as it played out on Twitter. The debate on Twitter included Witches protesting the appropriation and commodification of their sacred traditions, as well as outsiders who questioned the right of Witches to complain about spiritual theft. This Twitter debate was an opportunity for Modern Witches to substantiate and legitimize their identities as Witches. Witches distinguished their identities as ""authentic"" by mocking certain products and consumers, and demarcated practices/traditions as distinctive of Witchcraft by calling them sacred. By accusing Sephora of spiritual theft, Witches also largely elided their own engagement with appropriation from religious traditions. [ABSTRACT FROM AUTHOR]",Social media; Twitter; social media; commercialization; commodification; Contemporary Paganism; cultural appropriation; Cultural appropriation; Modern Witchcraft,SocIndex,1,,,,,,,
1465,journalArticle,2018.0,"MENDEZ, Gina RICO; COSBY, Arthur G.; MOHANTY, Somya D.",OBAMACARE ON TWITTER: ONLINE POLITICAL PARTICIPATION AND ITS EFFECTS ON POLARISATION.,OBAMACARE na TWITTERJU: spletna politična participacija in njeni učinki na polarizacijo.,,https://ezproxy.lib.utexas.edu/login?url=https://search.ebscohost.com/login.aspx?direct=true&db=sih&AN=132942709&site=ehost-live,"As Internet-based communications have expanded, online debating has become a significant form of political participation. This work examines online discussions around health care in the United States by analysing tweets about Obamacare and then assessing the degrees of polarisation in social media. The results indicate that highly influential entities in social media have an important capacity to polarise the public. Another relevant finding is that ideology is a powerful mechanism to frame online discussions by relegating policy arguments in online debates. Finally, this work shows that social media can easily promote negative sentiments towards 'the other', confirming group homogeneity in online communities. (English) [ABSTRACT FROM AUTHOR]",Social media; Political participation; Twitter; Polarization (Social sciences); Virtual communities; online political participation; Obamacare; Patient Protection & Affordable Care Act; polarisation; polarizacija; spletna politična participacija,SocIndex,0,,,,,,,
1466,journalArticle,2021.0,"Hedges, Kristin; Lasco, Gideon",Medical Populism and COVID-19 Testing.,Open Anthropological Research,,https://ezproxy.lib.utexas.edu/login?url=https://search.ebscohost.com/login.aspx?direct=true&db=sih&AN=159525651&site=ehost-live,"This paper uses the lens of medical populism to analyze the impact of biocommunicability on COVID-19 testing through a case study approach. The political efficacy of testing is traced through two mini-case studies: the Philippines and the United States. The case studies follow the approach of populism scholars in drawing from various sources that 'render the populist style visible' from the tweets and press releases of government officials to media reportage. Using the framework of medical populism, the case studies pay attention to the ways in which coronavirus testing figured in (1) simplification of the pandemic; (2) spectacularization of the crisis; (3) forging of divisions; and (4) invocation of knowledge claims. Identifying and critically analyzing how knowledge is generated is an essential step to recognizing the impact that political styles have on the COVID pandemic. The political actors in each case study have shaped knowledge of the epidemic, in the way they construct the idea of 'testing', and in how they mobilize testing as an 'evidence-making practice'. Their actions shaped how the pandemic--as well as their responses--is measured. This framework contributes to public policy debates by providing evidence of the impact of medical populism on pandemic response efforts. [ABSTRACT FROM AUTHOR]",Information dissemination; COVID-19; Populism; Discursive practices; biocommunicability; COVID-19 testing; Medical anthropology; medical populism; pandemics; viral testing,SocIndex,16,,,,,,,
1467,journalArticle,2021.0,"Hodgson, Jayden",Reenvisioning Russian Propaganda: Media Decentralization and the Use of Social Networks as a Means to Government Continuity.,Open Political Science,,https://ezproxy.lib.utexas.edu/login?url=https://search.ebscohost.com/login.aspx?direct=true&db=sih&AN=156626342&site=ehost-live,"Abstract: Russia's social scene has been anything but stable. Through economic turbulence and social unrest by political opposition, Navalny being only the most recent figure in a long list, Russia, under Putin's leadership, has shown that it can persist when faced with hardship. How does the regime do this? This article argues that its robust propaganda machine is the answer to this question. I provide three arguments to support this thesis. First, I will present how information is produced and disseminated. Second, Russian propaganda, used for branding itself, attempts to influence foreign just as much as domestic audiences. Finally, using private proxies to peddle a positive message on Twitter will be analyzed. Russias propaganda machine threatens liberalism in the West. This article hopes to add to the conversation as first, recognizing the threat, and second, providing information for combatting the regime. [ABSTRACT FROM AUTHOR]",Twitter; Propaganda; Political opposition; Decentralization in government; Bot; Hardship; Nation Branding; Reflexive Control; Russian propaganda; Social unrest; Troll,SocIndex,1,,,,,,,
1468,journalArticle,2018.0,"TAYLOR, ZACHARY; MCARDLE, ARIANNE",TWEETING IN GREEK: HOW NATIONAL FRATERNITIES AND SORORITIES USE TWITTER.,Oracle: The Research Journal of the Association of Fraternity/Sorority Advisors,,https://ezproxy.lib.utexas.edu/login?url=https://search.ebscohost.com/login.aspx?direct=true&db=sih&AN=133611177&site=ehost-live,"No extant research examines fraternity and sorority use of social media. This study examines official Twitter accounts of national fraternities and sororities (n=135) and their Twitter usage from July 2016 - July 2017 (n=47,705 tweets). Findings reveal fraternities are less likely to use hashtags, user tags, and URLs to engage their followers than sororities, while both fraternities and sororities rarely release official statements promoting positive behavior of their members or condemning negative behavior of their members, potentially contributing to a sense of ""constant media scrutiny"" suffered by Greek organizations (Kingkade, 2015). Implications for advisors and future research are addressed. [ABSTRACT FROM AUTHOR]",Social media; Twitter (Web resource); Brotherliness; Fraternity houses; Greek letter societies; Sorority houses,SocIndex,7,,,,,,,
1469,journalArticle,2018.0,"BARBER, JAMES P.",LESSONS FROM TEAM SCIENCE.,Oracle: The Research Journal of the Association of Fraternity/Sorority Advisors,,https://ezproxy.lib.utexas.edu/login?url=https://search.ebscohost.com/login.aspx?direct=true&db=sih&AN=133611176&site=ehost-live,"An introduction is presented in which the editor discusses articles in the issue on topics including posts from fraternity and sorority headquarters on Twitter, ways to improve the quality of survey data on fraternity men, Whiteness in the recruitment process of fraternity systems in the U.S.",Twitter (Web resource); United States; Greek letter societies; Racial identity of whites,SocIndex,0,,,,,,,
1470,journalArticle,2016.0,"Hussain, Shahid; Pervez, Muhammad Aslam",Use of Social Networking Sites among the Pakistani Youth.,Pakistan Journal of Social Sciences (PJSS),,https://ezproxy.lib.utexas.edu/login?url=https://search.ebscohost.com/login.aspx?direct=true&db=sih&AN=120915952&site=ehost-live,"This research study was conducted with the objective to examine the usage pattern of Social Networking Sites (SNS) by the Pakistani youth, for which a sample of 500 young people studying in different colleges and universities of the twin cities of Rawalpindi and Islamabad was taken. The sample was consisting of 54.8 percent Male respondents while Female proportion was 45.2 percent and the Mean Age of respondents was 22.97 years. According to the results, Face book was found as the most popular SNS among Pakistani youth with 64.8 percent users, followed by the Skype, while the Twitter was found as the least popular. The majority of youth was using SNS for 'Above 1 hour up to 2 hours', while only 8.4 percent of youth was using SNS for 'more than 4 hours'. So, the youth in Pakistan was not found to be the heavy user of SNS. The Multiple Regression model showed that the youth was using SNS mostly for chatting purpose. Overall, the findings of study support the Uses and Gratification theory presented by Katz, Blumler, & Gurevitch (1974), which advocates that users of media are active and they use the various media outlets to gratify their needs. [ABSTRACT FROM AUTHOR]",Online social networks; Internet & children; Pakistan; Youth,SocIndex,2,,,,,,,
1471,journalArticle,2019.0,"Shami, Savera",Clicking Responses on Social Media: Analysis of Audience Engagement on Posts and Tweets of MNAs of Pakistan.,Pakistan Vision,,https://ezproxy.lib.utexas.edu/login?url=https://search.ebscohost.com/login.aspx?direct=true&db=sih&AN=139377311&site=ehost-live,"Some scholars strongly believe that digital public relations through Social Media is the most emerging form worldwide and it is the future of Political Public Relations. Many scholars have supported the idea that the politicians are using social media to build their political image and are not doing much to create a relationship and discourse with their voters. This also strengthen the prevailing idea that regardless of the potential advantages, politicians tend to hesitate the active involvement of online users (Hoffmann and Suphan, 2017).The primary goal of this study is to explore a relationship between the posts and tweets of the Members of National Assembly of Pakistan (MNAs) and the audience involvement by investigating the type of Facebook posts and tweets that generate more audience engagement. The analysis of audience engagement would help politicians to know what they should post and what should be avoided if they want to have more followers and cultivate a lifelong relationship with their audience. [ABSTRACT FROM AUTHOR]",Social media; Digital media; Public relations; Pakistan; Audiences; Political image; Societal reaction,SocIndex,0,,,,,,,
